Id,Titulo_P,Subtitulo_P,Descripcion,Valor,Marca,Categoria,Subcategoria,Sub_sub_categoria,URL_Redireccion,URL_Imagen_Principal,URL_Imagen_2,URL_Imagen_3,URL_Imagen_4,URL_Imagen_5,Tienda, Stock
"14513","Sillón Kahlo Ecocuero Crudo"," confeccionado en Ecocuero y estructura de madera."," otorgando mayor confort y comodidad.","00","Poliflex","","","","http://www.carrefour.com.ar/muebles/living-comedor/sillones/sillon-kahlo-2-cuerpos-eco-crudo.html","http://cdn.carrefour.com.ar/media/catalog/product/cache/1/image/9df78eab33525d08d6e5fb8d27136e95/s/i/sillon.jpg","","","","","Carrefour",""
"14479","Pelota de Fútbol Nº4 Top Life Official","Pelota de fútbol de cuero sintético Top Life Official numero 4.","Pelota de fútbol de cuero sintético Top Life Official numero 4. Color blanco con detalles en negro y verde.","00","Top Life","","","","http://www.carrefour.com.ar/tiempo-libre-y-deportes/juegos-y-juguetes/juegos-deportivos/pelota-de-futbol-n-5-top-life-official.html","http://cdn.carrefour.com.ar/media/catalog/product/cache/1/image/9df78eab33525d08d6e5fb8d27136e95/1/8/1824123456785.jpg","","","","","Carrefour",""
"13798","Cortacésped Black & Decker 1200W GR1000-AR","3 diferentes niveles de corte"," la cortadora de cesped de Black & Decker le permite desplazarse a lo largo del terreno con presicion y facilidad. Su resultado es una superficie pareja y limpia.","00","Black & Decker","","","","http://www.carrefour.com.ar/jardin/corta-cesped/cortadora-electrica-1200w-ancho-de-corte.html","http://cdn.carrefour.com.ar/media/catalog/product/cache/1/image/9df78eab33525d08d6e5fb8d27136e95/8/8/885911442848-1.jpg","","","","","Carrefour",""
"14477","Pelota de Fútbol Nº5 Top Life Liga","Pelota de fútbol de cuero sintético Top Life Liga numero 5.","Pelota de fútbol de cuero sintético Top Life Liga numero 5. Color blanco con detalles en negro y verde.","00","Top Life","","","","http://www.carrefour.com.ar/tiempo-libre-y-deportes/juegos-y-juguetes/juegos-deportivos/pelota-de-futbol-n-5-top-life-liga.html","http://cdn.carrefour.com.ar/media/catalog/product/cache/1/image/9df78eab33525d08d6e5fb8d27136e95/1/5/1542312345671-1_2.jpg","","","","","Carrefour",""
"13797","Bordeadora Black & Decker 350W GL300T-AR"," con mango auxiliar para mayor facilidad de uso"," comoda y muy facil de usar.","00","Black & Decker","","","","http://www.carrefour.com.ar/jardin/corta-cesped/bordeadora-350-watts-black-decker-pimpo.html","http://cdn.carrefour.com.ar/media/catalog/product/cache/1/image/9df78eab33525d08d6e5fb8d27136e95/8/8/885911442831-1_1.jpg","","","","","Carrefour",""
"13795","Hidrolavadora Black & Decker 1300 Watt S-Ar PW1300S","Posee bomba de aluminio y filtro para la entrada de agua."," toldos y todo lo que se te ocurra quedará limpio y sin esfuerzo!","00","Black & Decker","","","","http://www.carrefour.com.ar/jardin/hidrolavadoras/hidro-100-bar-1300w-pw-1300s-ar.html","http://cdn.carrefour.com.ar/media/catalog/product/cache/1/image/9df78eab33525d08d6e5fb8d27136e95/8/8/885911386708-2.jpg","","","","","Carrefour",""
"13794","Cortacésped Black & Decker 1200W GR3450-AR","5 diferentes niveles de corte y ajuste de altura automático"," la cortadora de cesped de Black & Decker le permite desplazarse a lo largo del terreno con presicion y facilidad. Su resultado es una superficie pareja y limpia.","00","Black & Decker","","","","http://www.carrefour.com.ar/jardin/corta-cesped/cortadora-de-cesped-1200w.html","http://cdn.carrefour.com.ar/media/catalog/product/cache/1/image/9df78eab33525d08d6e5fb8d27136e95/8/8/885911375207-2.jpg","","","","","Carrefour",""
"13792","Cortacésped Black & Decker 1600W GR3850-AR","5 diferentes niveles de corte y ajuste de altura automático"," la cortadora de cesped de Black & Decker le permite desplazarse a lo largo del terreno con presicion y facilidad. Su resultado es una superficie pareja y limpia.","00","Black & Decker","","","","http://www.carrefour.com.ar/jardin/corta-cesped/cortadora-de-cesped-1600w.html","http://cdn.carrefour.com.ar/media/catalog/product/cache/1/image/9df78eab33525d08d6e5fb8d27136e95/8/8/885911350747-2.jpg","","","","","Carrefour",""
"9557","Televisor LED Telefunken 32'' HD TKLE3215D","LED TV 32''. Resolución: 1366 x 768 - HDMI x2 - USB x1 - Sintonizador digital incorporado","imagen y texto. Ángulo de visión 160°. Brillo 300 cd/m2.  Entradas posteriores de Audio/Video/PC/Componentes de video. Salida A/V.  Salida Audio Digital Coaxial (S/P DIF).  Sintonizador digital incorporado","00","Telefunken","","","","http://www.carrefour.com.ar/imagen/televisores/led-1/led-tv-32-telefunken-mod-tkl3215d.html","http://cdn.carrefour.com.ar/media/catalog/product/cache/1/image/9df78eab33525d08d6e5fb8d27136e95/e/l/elzx_0015_7796885401584_1.jpg","","","","","Carrefour",""
"13791","Cortacésped Black & Decker 1000W GR3050- AR","3 diferentes niveles de corte"," la cortadora de cesped de Black & Decker le permite desplazarse a lo largo del terreno con presicion y facilidad. Su resultado es una superficie pareja y limpia.","00","Black & Decker","","","","http://www.carrefour.com.ar/jardin/corta-cesped/cortadora-de-cesped-1000w.html","http://cdn.carrefour.com.ar/media/catalog/product/cache/1/image/9df78eab33525d08d6e5fb8d27136e95/8/8/885911350730-2.jpg","","","","","Carrefour",""
"14078","Juego de Jardín Catalina 9 Piezas Eucaliptus","Mesa y 8 sillas."," como sustituto del cedro y la teka. De gran resistencia al agua y estabilidad a través del tiempo.  Para mantener nuestros Muebles de Jardín es conveniente no utilizar lavadoras a presión para la limpieza. Secarlos con un paño luego de las lluvias. No exponerlos innecesariamente a los rayos ultravioletas. Guardarlos en el invierno. Solo necesita una mano de aceite para madera exótica cada 6 meses.","00","Life Style","","","","http://www.carrefour.com.ar/jardin/muebles/juegos-de-jardin/set-9-pzs-eucaliptus-catalina.html","http://cdn.carrefour.com.ar/media/catalog/product/cache/1/image/9df78eab33525d08d6e5fb8d27136e95/m/d/mdjr_0000_5705820280926-06.jpg","","","","","Carrefour",""
"13037","Escritorio de Oficina Glossy Blanco","."," de poliseda o de tela lustrosa) para que las resinas melamínicas luzcan como salidas de fábrica.","00","","","","","http://www.carrefour.com.ar/muebles/oficina/escritorios/escritorio-glossy-blanco-120x60x75cm.html","http://cdn.carrefour.com.ar/media/catalog/product/cache/1/image/9df78eab33525d08d6e5fb8d27136e95/3/2/3267072141254-2_1.jpg","","","","","Carrefour",""
"13395","Colchón Eléctrico Inflable Air Bed Bestway 2 Personas","Confeccionado en pvc y felpa. 2.03 x 1.52 mt. Incluye inflador eléctrico y parche de reparación. Descanso garantizado!"," es reciclable por varios métodos.","00","Bestway","","","","http://www.carrefour.com.ar/tiempo-libre-y-deportes/camping/colchones/colchon-electrico-2-plazas.html","http://cdn.carrefour.com.ar/media/catalog/product/cache/1/image/9df78eab33525d08d6e5fb8d27136e95/3/6/3609231578547_a.jpg","","","","","Carrefour",""
"14073","Sombrilla Playera Pacific Aluminio Verde","Sombrilla de playa grande y fuerte"," lo que le permite permanecer inalterable por más tiempo que otros géneros. Para mantener nuestros Muebles de Jardín es conveniente no utilizar lavadoras a presión para la limpieza. Secarlos con un paño luego de las lluvias. No exponerlos innecesariamente a los rayos ultravioletas. Guardarlos en el invierno.","00","","","","","http://www.carrefour.com.ar/jardin/muebles/parasoles-y-sombrillas/sombrilla-playa-alum-240-cm-verde.html","http://cdn.carrefour.com.ar/media/catalog/product/cache/1/image/9df78eab33525d08d6e5fb8d27136e95/m/d/mdjr_0031_3610883316234-02.jpg","","","","","Carrefour",""
"14072","Sombrilla Playera Pacific Aluminio Blanca","Sombrilla de playa grande y fuerte"," lo que le permite permanecer inalterable por más tiempo que otros géneros. Para mantener nuestros Muebles de Jardín es conveniente no utilizar lavadoras a presión para la limpieza. Secarlos con un paño luego de las lluvias. No exponerlos innecesariamente a los rayos ultravioletas. Guardarlos en el invierno.","00","","","","","http://www.carrefour.com.ar/jardin/muebles/parasoles-y-sombrillas/sombrilla-playa-alum-240-cm-blanca.html","http://cdn.carrefour.com.ar/media/catalog/product/cache/1/image/9df78eab33525d08d6e5fb8d27136e95/m/d/mdjr_0033_3610883316227-02.jpg","","","","","Carrefour",""
"13033","Escritorio de Oficina Jerico Negro"," con estantes laterales."," por lo cual se lo considera uno de los tipos de vidrio de mayor seguridad para el uso hogareño.","00","","","","","http://www.carrefour.com.ar/muebles/oficina/escritorios/escritorio-cano-y-vidrio-negro-110x60x75.html","http://cdn.carrefour.com.ar/media/catalog/product/cache/1/image/9df78eab33525d08d6e5fb8d27136e95/3/2/3267072141124-2.jpg","","","","","Carrefour",""
"13031","Sillón de Oficina Tulum Gris"," con sistema ''gas lift'' de elevación por palanca."," recupera su belleza original.","00","","","","","http://www.carrefour.com.ar/muebles/oficina/sillas-y-sillones/sillon-oficina-gris-59-5x60xh99-109cm.html","http://cdn.carrefour.com.ar/media/catalog/product/cache/1/image/9df78eab33525d08d6e5fb8d27136e95/3/2/3267072140981-2.jpg","","","","","Carrefour",""
"11672","Reposera Sillón de Jardín Solcito con Apoyabrazos Madera"," realizado con cintas trenzadas de polietileno."," aislante térmico y muy resistente a la corrosión. Para prolongar la vida útil de la reposera nunca deberá ser guardada húmeda y para el caso de estar expuesta a aguas salitrosas enjuagar con agua dulce.","00","","","","","http://www.carrefour.com.ar/jardin/muebles/bancos-reposeras/sillon-tipo-reposera-con-apoyabrazos-de-madera-jardin.html","http://cdn.carrefour.com.ar/media/catalog/product/cache/1/image/9df78eab33525d08d6e5fb8d27136e95/7/7/7798042571604.jpg","","","","","Carrefour",""
"11670","Reposera Sillón de Jardín Solcito Acero Rojo y Naranja"," cintas trenzadas de polietileno. Posee apoyabrazos de madera."," aislante térmico y muy resistente a la corrosión. Para prolongar la vida útil de la reposera nunca deberá ser guardada húmeda y para el caso de estar expuesta a aguas salitrosas enjuagar con agua dulce.","00","","","","","http://www.carrefour.com.ar/jardin/muebles/bancos-reposeras/sillon-tipo-reposera-fijo-con-apoyabrazos-de-madera-jardin.html","http://cdn.carrefour.com.ar/media/catalog/product/cache/1/image/9df78eab33525d08d6e5fb8d27136e95/i/m/img_4500.jpg","","","","","Carrefour",""
"14900","Afeitadora Philips S1520 Negro","Sistema de cuchillas CloseCut - Cabezales Flex de 4 direcciones - Cortapatillas desplegable"," gracias a nuestra potente y eficiente batería de iones de litio. Abrí los cabezales del recortador y utilizá el cepillo de limpieza proporcionado para eliminar el pelo suelto.  Completá tu look con el recortador desplegable. Perfecto para mantener el bigote y recortar las patillas.","00","Philips","Cuidado Personal y Salud","Cuidado del Hombre","Afeitadoras","http://www.carrefour.com.ar/cuidado-personal-y-salud/cuidado-del-hombre/afeitadoras/afeitadora-philips-recargable-mod-s1520.html","http://cdn.carrefour.com.ar/media/catalog/product/cache/1/image/9df78eab33525d08d6e5fb8d27136e95/p/h/php_0000_8710103784838.jpg","","","","","Carrefour",""
"14069","Sombrilla Playera Pacific Aluminio Azul","Sombrilla de playa grande y fuerte"," lo que le permite permanecer inalterable por más tiempo que otros géneros. Para mantener nuestros Muebles de Jardín es conveniente no utilizar lavadoras a presión para la limpieza. Secarlos con un paño luego de las lluvias. No exponerlos innecesariamente a los rayos ultravioletas. Guardarlos en el invierno.","00","","","","","http://www.carrefour.com.ar/jardin/muebles/parasoles-y-sombrillas/sombrilla-playa-alum-240-cm-azul.html","http://cdn.carrefour.com.ar/media/catalog/product/cache/1/image/9df78eab33525d08d6e5fb8d27136e95/m/d/mdjr_0028_3610882012199-02.jpg","","","","","Carrefour",""
"14068","Sombrilla Playera Pacific Aluminio Fucsia","Sombrilla de playa grande y fuerte"," lo que le permite permanecer inalterable por más tiempo que otros géneros. Para mantener nuestros Muebles de Jardín es conveniente no utilizar lavadoras a presión para la limpieza. Secarlos con un paño luego de las lluvias. No exponerlos innecesariamente a los rayos ultravioletas. Guardarlos en el invierno.","00","","","","","http://www.carrefour.com.ar/jardin/muebles/parasoles-y-sombrillas/sombrilla-playa-alum-240-cm-fucsia.html","http://cdn.carrefour.com.ar/media/catalog/product/cache/1/image/9df78eab33525d08d6e5fb8d27136e95/m/d/mdjr_0034_3610882012182-02.jpg","","","","","Carrefour",""
"13388","Banco Inclinado Para Abdominales","Plegable con posición de pies regulable. Incluye dos correas elásticas."," lo que lo convierte en un aparato práctico de fácil guardado. Fabricado en acero con superficie acolchonada con goma espuma.","00","Carrefour","","","","http://www.carrefour.com.ar/tiempo-libre-y-deportes/fitness/bancos-y-multigimnasios/banco-para-abdominales.html","http://cdn.carrefour.com.ar/media/catalog/product/cache/1/image/9df78eab33525d08d6e5fb8d27136e95/3/3/3390504021838_a.jpg","","","","","Carrefour",""
"14067","Reposera de Jardín Break Acero y Textileno"," incluye almohadón."," ideal para rellenos de almohadones. Para mantener nuestros Muebles de Jardín es conveniente no utilizar lavadoras a presión para la limpieza. Secarlos con un paño luego de las lluvias. No exponerlos innecesariamente a los rayos ultravioletas. Guardarlos en el invierno.","00","","","","","http://www.carrefour.com.ar/jardin/muebles/bancos-reposeras/reposera-acero-textiline-con-almohadon.html","http://cdn.carrefour.com.ar/media/catalog/product/cache/1/image/9df78eab33525d08d6e5fb8d27136e95/3/6/3609230087736_1_1.jpg","","","","","Carrefour",""
"11669","Reposera Sillón de Jardín Solcito Acero Verde"," cintas trenzadas de polietileno. Posee apoyabrazos de madera."," aislante térmico y muy resistente a la corrosión. Para prolongar la vida útil de la reposera nunca deberá ser guardada húmeda y para el caso de estar expuesta a aguas salitrosas enjuagar con agua dulce.","00","","","","","http://www.carrefour.com.ar/jardin/muebles/bancos-reposeras/sillon-fijo-c-apoyabrazos-madera-7-8-cin.html","http://cdn.carrefour.com.ar/media/catalog/product/cache/1/image/9df78eab33525d08d6e5fb8d27136e95/7/7/7798042572502.jpg","","","","","Carrefour",""
"13386","Carpa Timberwood 3 Personas"," 1200 mm de columna de agua. Incluye bolsa transportadora"," a mayor columna de agua mayor impermeabilidad tendrá la tienda.","00","Escape","","","","http://www.carrefour.com.ar/tiempo-libre-y-deportes/camping/carpas/carpa-timberwood-3-personas.html","http://cdn.carrefour.com.ar/media/catalog/product/cache/1/image/9df78eab33525d08d6e5fb8d27136e95/c/a/carpa04.jpg","","","","","Carrefour",""
"13026","Escritorio de Oficina Veines Negro","Confeccionado en vidrio templado y estructura de acero"," con procesos de producción con mínimos desperdicios. Uno de los materiales que menos afecta el medioambiente.","00","","","","","http://www.carrefour.com.ar/muebles/oficina/escritorios/escritorio-cano-y-vidrio-diseno-vetas-12.html","http://cdn.carrefour.com.ar/media/catalog/product/cache/1/image/9df78eab33525d08d6e5fb8d27136e95/3/2/3267072140059-2.jpg","","","","","Carrefour",""
"14063","Parasol Suspendido Curazao Aluminio Verde","Con ventilación superior para que el viento no lo embolse."," con procesos de producción con mínimos desperdicios. Uno de los materiales que menos afecta el medioambiente. Para mantener nuestros Muebles de Jardín es conveniente no utilizar lavadoras a presión para la limpieza. Secarlos con un paño luego de las lluvias. No exponerlos innecesariamente a los rayos ultravioletas. Guardarlos en el invierno.","00","","","","","http://www.carrefour.com.ar/jardin/muebles/parasoles-y-sombrillas/parasol-suspendido-diam-3-mts-verde-ingl.html","http://cdn.carrefour.com.ar/media/catalog/product/cache/1/image/9df78eab33525d08d6e5fb8d27136e95/p/a/par_0003_3267078413454.jpg","","","","","Carrefour",""
"13382","Carpa Iglu Dome 6 Personas"," 800 mm de columna de agua. Incluye bolsa transportadora"," a mayor columna de agua mayor impermeabilidad tendrá la tienda.","00","Escape","","","","http://www.carrefour.com.ar/tiempo-libre-y-deportes/camping/carpas/carpa-iglu-dome-6-personas.html","http://cdn.carrefour.com.ar/media/catalog/product/cache/1/image/9df78eab33525d08d6e5fb8d27136e95/c/a/carpas_0000_3267077004394_1.jpg","","","","","Carrefour",""
"11662","Juego de Jardín Isabella 3 Piezas Eucaliptus"," todo plegable."," con procesos de producción con mínimos desperdicios. Uno de los materiales que menos afecta el medioambiente. Para mantener nuestros Muebles de Jardín es conveniente no utilizar lavadoras a presión para la limpieza. Secarlos con un paño luego de las lluvias. No exponerlos innecesariamente a los rayos ultravioletas. Guardarlos en el invierno. Sólo necesita una mano de aceite para madera exótica cada 6 meses.","00","","","","","http://www.carrefour.com.ar/jardin/muebles/juegos-de-jardin/set-3-pzs-mesa-2-sillas-eucalip-y-acer.html","http://cdn.carrefour.com.ar/media/catalog/product/cache/1/image/9df78eab33525d08d6e5fb8d27136e95/i/m/img_5489.jpg","","","","","Carrefour",""
"11661","Juego de Jardín Valentino 3 Piezas Eucaliptus"," todo plegable."," con procesos de producción con mínimos desperdicios. Uno de los materiales que menos afecta el medioambiente. Para mantener nuestros Muebles de Jardín es conveniente no utilizar lavadoras a presión para la limpieza. Secarlos con un paño luego de las lluvias. No exponerlos innecesariamente a los rayos ultravioletas. Guardarlos en el invierno. Sólo necesita una mano de aceite para madera exótica cada 6 meses.","00","","","","","http://www.carrefour.com.ar/jardin/muebles/juegos-de-jardin/juego-de-jardin-mesa-y-2-sillas.html","http://cdn.carrefour.com.ar/media/catalog/product/cache/1/image/9df78eab33525d08d6e5fb8d27136e95/i/m/img_5478.jpg","","","","","Carrefour",""
"14457","Parrilla de Acero Milano","Superficie de 53 x 38 Cm de parrilla","Parrilla de Acero para carbon. Cuenta con una estructura de madera en los laterales apto para apoyar utensillos. Tiene una superficie de 53 x 38 Cm de parrilla.","00","","","","","http://www.carrefour.com.ar/tiempo-libre-y-deportes/camping/parrillas/parrilla-milano-56x41cm.html","http://cdn.carrefour.com.ar/media/catalog/product/cache/1/image/9df78eab33525d08d6e5fb8d27136e95/3/6/3613865040042.jpg","","","","","Carrefour",""
"14456","Parrilla de Acero Antilles","Superficie de 70 x 40 Cm de parrilla","Parrila para carbon de Acero con una superficie de 70 x 40 Cm separado en dos espacios iguales. Cuenta con ruedas para traslado de la parrilla.","00","Carrefour","","","","http://www.carrefour.com.ar/tiempo-libre-y-deportes/camping/parrillas/parrilla-carrefour-antilles.html","http://cdn.carrefour.com.ar/media/catalog/product/cache/1/image/9df78eab33525d08d6e5fb8d27136e95/p/a/parrilla_0000_3292193471454.jpg","","","","","Carrefour",""
"14455","Parrilla de Acero Malaga","5 Cm de parrilla.","5 Cm separado en dos espacios iguales. Cuenta con ruedas para traslado de la parrilla.","00","","","","","http://www.carrefour.com.ar/tiempo-libre-y-deportes/camping/parrillas/parrilla-malaga-52x36-5.html","http://cdn.carrefour.com.ar/media/catalog/product/cache/1/image/9df78eab33525d08d6e5fb8d27136e95/p/a/parrilla_0001_3292193251391.jpg","","","","","Carrefour",""
"13416","Colchón Inflado Fácil Bestway 2 Personas","Confeccionado en  pvc y felpa. 1.87 x 1.375 mt. Incluye inflador y parche de reparación. Descanso garantizado!"," es reciclable por varios métodos.","00","Bestway","","","","http://www.carrefour.com.ar/tiempo-libre-y-deportes/camping/colchones/cama-inflado-facil-2-plazas-187x137-5x22.html","http://cdn.carrefour.com.ar/media/catalog/product/cache/1/image/9df78eab33525d08d6e5fb8d27136e95/6/9/6942138960624_a.jpg","","","","","Carrefour",""
"14454","Carpa Escape Cadillac 6 Personas"," 1000 mm de columna de agua. Incluye bolsa transportadora"," que equivale a la presión ejercida por una milésima parte de una columna de agua.","00","Escape","","","","http://www.carrefour.com.ar/tiempo-libre-y-deportes/camping/carpas/escape-carpa-cadillac-6p.html","http://cdn.carrefour.com.ar/media/catalog/product/cache/1/image/9df78eab33525d08d6e5fb8d27136e95/c/a/carpas_0000_3267078884797_1.jpg","","","","","Carrefour",""
"13415","Colchón Inflable Bestway 2 Personas","Confeccionado en  pvc y felpa. 1.87 x 1.37 mt. Incluye parche de reparación. Descanso garantizado!"," es reciclable por varios métodos.","00","Bestway","","","","http://www.carrefour.com.ar/tiempo-libre-y-deportes/camping/colchones/colchon-inflable-2-plazas-187x137-5x22-5.html","http://cdn.carrefour.com.ar/media/catalog/product/cache/1/image/9df78eab33525d08d6e5fb8d27136e95/6/9/6942138960464_b.jpg","","","","","Carrefour",""
"14453","Carpa Escape Xtrem 4 Personas"," 2000 mm de columna de agua. Incluye bolsa transportadora"," que equivale a la presión ejercida por una milésima parte de una columna de agua.","00","Escape","","","","http://www.carrefour.com.ar/tiempo-libre-y-deportes/camping/carpas/escape-carpa-xtrem-4p.html","http://cdn.carrefour.com.ar/media/catalog/product/cache/1/image/9df78eab33525d08d6e5fb8d27136e95/c/a/carpas_0001_3267077009092_1.jpg","","","","","Carrefour",""
"13414","Colchón Inflable Bestway 1 Persona","Confeccionado en  pvc y felpa. 1.80 x 0.75 mt. Incluye parche de reparación. Descanso garantizado!"," es reciclable por varios métodos.","00","Bestway","","","","http://www.carrefour.com.ar/tiempo-libre-y-deportes/camping/colchones/colchon-inflable-single-180x75x22-5-best.html","http://cdn.carrefour.com.ar/media/catalog/product/cache/1/image/9df78eab33525d08d6e5fb8d27136e95/6/9/6942138960440_a.jpg","","","","","Carrefour",""
"13413","Colchón Inflado Fácil Bestway 1 Persona","Confeccionado en  pvc y felpa. 1.85 x 0.76 mt. Incluye inflador y parche de reparación. Descanso garantizado!"," es reciclable por varios métodos.","00","Bestway","","","","http://www.carrefour.com.ar/tiempo-libre-y-deportes/camping/colchones/cama-inflado-facil-1plaza-185x76x21-9-be.html","http://cdn.carrefour.com.ar/media/catalog/product/cache/1/image/9df78eab33525d08d6e5fb8d27136e95/6/9/6942138916294_b.jpg","","","","","Carrefour",""
"14058","Juego de Jardín Corner 3 Piezas Rattan sintético","Mesa ratona con superficie de vidrio y sillon esquinero. Incluye almohadones."," y posee baja absorción de humedad y gran resistencia al impacto. Para mantener nuestros Muebles de Jardín es conveniente no utilizar lavadoras a presión para la limpieza. Secarlos con un paño luego de las lluvias. No exponerlos innecesariamente a los rayos ultravioletas. Guardarlos en el invierno.","00","","","","","http://www.carrefour.com.ar/jardin/muebles/juegos-de-jardin/set-corner-rattan-1-2cp-1-cp-ext-1-mesa.html","http://cdn.carrefour.com.ar/media/catalog/product/cache/1/image/9df78eab33525d08d6e5fb8d27136e95/3/2/3267078049325_1_1.jpg","","","","","Carrefour",""
"10180","Reposera de Jardín Wheel Teka"," con bandeja y ruedas para su facil traslado."," gracias a su propio aceite natural. Para mantener nuestros Muebles de Jardín es conveniente no utilizar lavadoras a presión para la limpieza. Secarlos con un paño luego de las lluvias. No exponerlos innecesariamente a los rayos ultravioletas. Guardarlos en el invierno. Solo necesita una mano de aceite para teka cada 6 meses.","00","","","","","http://www.carrefour.com.ar/jardin/muebles/bancos-reposeras/reposera-4-posiciones-con-almohadon.html","http://cdn.carrefour.com.ar/media/catalog/product/cache/1/image/9df78eab33525d08d6e5fb8d27136e95/5/7/5705820130559_1_1.jpg","","","","","Carrefour",""
"13019","Sillón de Oficina Managua Negro"," con sistema ''gas lift'' de elevación por palanca."," recupera su belleza original.","00","","","","","http://www.carrefour.com.ar/muebles/oficina/sillas-y-sillones/sillon-oficina-basico-regulable-negro.html","http://cdn.carrefour.com.ar/media/catalog/product/cache/1/image/9df78eab33525d08d6e5fb8d27136e95/3/2/3267072138520-2.jpg","","","","","Carrefour",""
"13017","Sillón Reclinable Relax Negro"," extra confort."," lo que le permite permanecer inalterable por más tiempo que otros géneros.","00","","","","","http://www.carrefour.com.ar/muebles/living-comedor/sillones/sillon-reclinable-1-cpo-negro.html","http://cdn.carrefour.com.ar/media/catalog/product/cache/1/image/9df78eab33525d08d6e5fb8d27136e95/3/2/3267072138476-2.jpg","","","","","Carrefour",""
"13376","Carpa Iglu Estrelle 3 Personas"," 450 mm de columna de agua. Incluye bolsa transportadora"," a mayor columna de agua mayor impermeabilidad tendrá la tienda.","00","Escape","","","","http://www.carrefour.com.ar/tiempo-libre-y-deportes/camping/carpas/carpa-iglu-estrelle-3-personas.html","http://cdn.carrefour.com.ar/media/catalog/product/cache/1/image/9df78eab33525d08d6e5fb8d27136e95/c/a/carpas_0003_3267077000228_1.jpg","","","","","Carrefour",""
"13375","Carpa Iglu Dome 4 Personas"," 800 mm de columna de agua. Incluye bolsa transportadora"," a mayor columna de agua mayor impermeabilidad tendrá la tienda.","00","Escape","","","","http://www.carrefour.com.ar/tiempo-libre-y-deportes/camping/carpas/escape-carpa-tipo-iglo-4-pers-c-alero-d.html","http://cdn.carrefour.com.ar/media/catalog/product/cache/1/image/9df78eab33525d08d6e5fb8d27136e95/3/2/3267077000181-2.jpg","","","","","Carrefour",""
"13372","Hidrolavadora Max Star 1500 watts APW-VA-90P(B)","Presion de 90/135 BAR y caudal de 6.0 L/Min"," toldos y todo lo que se te ocurra quedará limpio y sin esfuerzo!","00","Max Star","","","","http://www.carrefour.com.ar/jardin/hidrolavadoras/hidrolavadora-c-portarrollo-apw-va-90p.html","http://cdn.carrefour.com.ar/media/catalog/product/cache/1/image/9df78eab33525d08d6e5fb8d27136e95/2/6/2646206000000_b.jpg","","","","","Carrefour",""
