Id,Titulo_P,Subtitulo_P,Descripcion,Valor,Marca,Categoria,Subcategoria,Sub_sub_categoria,URL_Redireccion,URL_Imagen_Principal,URL_Imagen_2,URL_Imagen_3,URL_Imagen_4,URL_Imagen_5,Tienda, Stock
"13371","Hidrolavadora Max Star 1400 watt APW-VTB-90P","Presion de 90/135 BAR y caudal de 5.8 L/Min"," toldos y todo lo que se te ocurra quedará limpio y sin esfuerzo!","00","Max Star","","","","http://www.carrefour.com.ar/jardin/hidrolavadoras/hidrolavadora-apw-vtb-90p-90-135bar-1400.html","http://cdn.carrefour.com.ar/media/catalog/product/cache/1/image/9df78eab33525d08d6e5fb8d27136e95/2/6/2646205000001_b_1.jpg","","","","","Carrefour",""
"13370","Hidrolavadora Max Star 1500 watt APW-VA-90P(A)","Presion de 90/135 BAR y caudal de 6.0 L/Min"," toldos y todo lo que se te ocurra quedará limpio y sin esfuerzo!","00","Max Star","","","","http://www.carrefour.com.ar/jardin/hidrolavadoras/hidrolavadora-apw-va-90p-90-135bar-1500w.html","http://cdn.carrefour.com.ar/media/catalog/product/cache/1/image/9df78eab33525d08d6e5fb8d27136e95/2/6/2646204000002_b.jpg","","","","","Carrefour",""
"13767","Sillón Auro Chenille Tostado"," confeccionado en Chenille y estructura de madera."," otorgando mayor confort y comodidad.","00","Poliflex","","","","http://www.carrefour.com.ar/muebles/living-comedor/sillones/sillon-auro-2-cuerpos-ch-tostado-j.html","http://cdn.carrefour.com.ar/media/catalog/product/cache/1/image/9df78eab33525d08d6e5fb8d27136e95/z/e/zena_chenilletostado_vista00.jpg","","","","","Carrefour",""
"13766","Sillón Auro Ecocuero Bordo"," confeccionado en Ecocuero y estructura de madera."," otorgando mayor confort y comodidad.","00","Poliflex","","","","http://www.carrefour.com.ar/muebles/living-comedor/sillones/sillon-auro-2-cuerpos-eco-bordo-b.html","http://cdn.carrefour.com.ar/media/catalog/product/cache/1/image/9df78eab33525d08d6e5fb8d27136e95/z/e/zena_bordo_vista00.jpg","","","","","Carrefour",""
"13765","Sillón Auro Ecocuero Negro"," confeccionado en Ecocuero y estructura de madera."," otorgando mayor confort y comodidad.","00","Poliflex","","","","http://www.carrefour.com.ar/muebles/living-comedor/sillones/sillon-auro-2-cuerpos-eco-negro-b.html","http://cdn.carrefour.com.ar/media/catalog/product/cache/1/image/9df78eab33525d08d6e5fb8d27136e95/z/e/zena_negro_vista00.jpg","","","","","Carrefour",""
"7011","Licuadora de Pie Liliana Frutalic"," capacidad 1.8 litros","8 Lts. 3 velocidades + pulsador. Potencia: 600 watts","00","Liliana","Pequeños Electrodomésticos","Ayudantes de Cocina","Licuadoras","http://www.carrefour.com.ar/pequenos-electrodomesticos/ayudantes-de-cocina/licuadoras/licuadora-de-pie-liliana-frutalic.html","http://cdn.carrefour.com.ar/media/catalog/product/cache/1/image/9df78eab33525d08d6e5fb8d27136e95/7/7/7793862006732.jpg","","","","","Carrefour",""
"13764","Sillón Kibo Ecocuero Negro"," confeccionado en Ecocuero y estructura de madera."," otorgando mayor confort y comodidad.","00","Poliflex","","","","http://www.carrefour.com.ar/muebles/living-comedor/sillones/sillon-kibo-2-cuerpos-eco-negro-b.html","http://cdn.carrefour.com.ar/media/catalog/product/cache/1/image/9df78eab33525d08d6e5fb8d27136e95/k/i/kibo_negro_vista00.jpg","","","","","Carrefour",""
"13763","Sillón Kibo Ecocuero Chocolate"," confeccionado en Ecocuero y estructura de madera."," otorgando mayor confort y comodidad.","00","Poliflex","","","","http://www.carrefour.com.ar/muebles/living-comedor/sillones/sillon-kibo-2-cuerpos-eco-choco-b.html","http://cdn.carrefour.com.ar/media/catalog/product/cache/1/image/9df78eab33525d08d6e5fb8d27136e95/k/i/kibo_chocolate_vista00.jpg","","","","","Carrefour",""
"13762","Sillón Kibo Ecocuero Crudo"," confeccionado en Ecocuero y estructura de madera."," otorgando mayor confort y comodidad.","00","Poliflex","","","","http://www.carrefour.com.ar/muebles/living-comedor/sillones/sillon-kibo-2-cuerpos-eco-crudo-b.html","http://cdn.carrefour.com.ar/media/catalog/product/cache/1/image/9df78eab33525d08d6e5fb8d27136e95/k/i/kibo_beige_vista00.jpg","","","","","Carrefour",""
"13761","Sillón Frisia Chenille Bordo"," confeccionado en Chenille y estructura de madera."," otorgando mayor confort y comodidad.","00","Poliflex","","","","http://www.carrefour.com.ar/muebles/living-comedor/sillones/sillon-frisia-2-cuerpos-ch-bordo-j.html","http://cdn.carrefour.com.ar/media/catalog/product/cache/1/image/9df78eab33525d08d6e5fb8d27136e95/f/r/frisia_chenillebordo_vista00.jpg","","","","","Carrefour",""
"13369","Hidrolavadora Max Star 1650 watt ABW-VU-70","Presion de 70/105 BAR y caudal de 5.7 L/Min"," toldos y todo lo que se te ocurra quedará limpio y sin esfuerzo!","00","Max Star","","","","http://www.carrefour.com.ar/jardin/hidrolavadoras/hidrolavadora-vu70-70-105bar-1650w.html","http://cdn.carrefour.com.ar/media/catalog/product/cache/1/image/9df78eab33525d08d6e5fb8d27136e95/2/6/2634813000001_c.jpg","","","","","Carrefour",""
"13760","Sillón Frisia Chenille Tostado"," confeccionado en Chenille y estructura de madera."," otorgando mayor confort y comodidad.","00","Poliflex","","","","http://www.carrefour.com.ar/muebles/living-comedor/sillones/sillon-frisia-2-cuerpos-ch-tostado-j.html","http://cdn.carrefour.com.ar/media/catalog/product/cache/1/image/9df78eab33525d08d6e5fb8d27136e95/f/r/frisia_chenilletostado_vista00_1.jpg","","","","","Carrefour",""
"13368","Hidrolavadora Max Star 1850 watt ABW-VP-90B","Presion de 90/135 BAR y caudal de 5.7 L/Min"," toldos y todo lo que se te ocurra quedará limpio y sin esfuerzo!","00","Max Star","","","","http://www.carrefour.com.ar/jardin/hidrolavadoras/hidrolavadora-vp-90b-90-135bar-1850w.html","http://cdn.carrefour.com.ar/media/catalog/product/cache/1/image/9df78eab33525d08d6e5fb8d27136e95/2/6/2634811000003_b.jpg","","","","","Carrefour",""
"13009","Sillón Tucson Marron"," 1 cuerpo de diseño sobrio."," son apreciados para la confección de prendas y accesorios de alto rendimiento.","00","","","","","http://www.carrefour.com.ar/muebles/living-comedor/mesas-y-sillas/sofa-tucson-1-cuerpo.html","http://cdn.carrefour.com.ar/media/catalog/product/cache/1/image/9df78eab33525d08d6e5fb8d27136e95/2/6/2658518000005-1.jpg","","","","","Carrefour",""
"6293","Calefón Eléctrico Mayva 25 Litros Acero Inoxidable"," corte automático. Tipo De Conexión Eléctrico"," corte automático. Tipo De Conexión Eléctrico","00","Mayva","","","","http://www.carrefour.com.ar/electrohogar-1/calefones/calefones-electricos/calefon-electrico-mayva-acero-inoxidable-25l.html","http://cdn.carrefour.com.ar/media/catalog/product/cache/1/image/9df78eab33525d08d6e5fb8d27136e95/7/7/7798101470374.jpg","","","","","Carrefour",""
"6729","Auricular Inalámbrico Dynacom PS3 PS4 XBOX PC","Compatible con PlayStation 4. Compatible con PlayStation 3 . Compatible con Xbox 360. Compatible con PC. Control de Volumen"," para que te sumerjas en una aventura en todo sentido excepcional.","00","Dynacom","","","","http://www.carrefour.com.ar/consolas-y-video-juegos/accesorios-3/auriculares-consolas/auricular-inalambrico-dynacom-ps3-ps4-xbox-pc.html","http://cdn.carrefour.com.ar/media/catalog/product/cache/1/image/9df78eab33525d08d6e5fb8d27136e95/7/7/7796847042541.jpg","","","","","Carrefour",""
"6722","Termotanque Eléctrico Señorial Zafiro 95 Litros Blanco","Capacidad de 95 Litros. Válvula termostática. Calentamiento simultaneo"," manteniendo automáticamente la temperatura seleccionada del agua. Protección extra contra la corrosión. Resistencia blindada de reducido consumo y un interruptor térmico de seguridad que corta el circuito eléctrico en caso de excesivo calentamiento de agua. Mayor ahorro de electricidad. Calentamiento simultaneo. Sistema dual para apoyar y colgar.","00","Señorial","Electrohogar","Termotanques","Termotanques Eléctricos","http://www.carrefour.com.ar/electrohogar-1/termotanques/termotanques-electricos/termotanque-electrico-se-orial-oro-95-e.html","http://cdn.carrefour.com.ar/media/catalog/product/cache/1/image/9df78eab33525d08d6e5fb8d27136e95/7/7/7796825000617_1.jpg","","","","","Carrefour",""
"6721","Termotanque Eléctrico Señorial Zafiro 65 Litros Blanco","Capacidad de 65 E 65 litros. Válvula termostática. Sistema dual para apoyar y colgar"," manteniendo automáticamente la temperatura seleccionada del agua. Protección extra contra la corrosión. Alta seguridad.  Mayor ahorro de electricidad. Sistema dual para apoyar y colgar","00","Señorial","Electrohogar","Termotanques","Termotanques Eléctricos","http://www.carrefour.com.ar/electrohogar-1/termotanques/termotanques-electricos/termotanque-electrico-se-orial-oro-65-e.html","http://cdn.carrefour.com.ar/media/catalog/product/cache/1/image/9df78eab33525d08d6e5fb8d27136e95/7/7/7796825000600_1.jpg","","","","","Carrefour",""
"6720","Termotanque Eléctrico Señorial Zafiro 40 Litros Blanco","Termotanque eléctrico de 40 litros. mayor ahorro de electricidad. Calentamiento simultáneo. Sistema Dual."," manteniendo automáticamente la temperatura seleccionada del agua. Protección extra contra la corrosión. Posee una resistencia blindada de reducido consumo y un interruptor térmico de seguridad que corta el circuito eléctrico en caso de excesivo calentamiento de agua. Mayor ahorro de electricidad. Grifo de purga. Calentamiento simultáneo. Sistema dual para apoyar y colgar.","00","Señorial","Electrohogar","Termotanques","Termotanques Eléctricos","http://www.carrefour.com.ar/electrohogar-1/termotanques/termotanques-electricos/termotanque-electrico-se-orial-oro-40-e.html","http://cdn.carrefour.com.ar/media/catalog/product/cache/1/image/9df78eab33525d08d6e5fb8d27136e95/7/7/7796825000594_1.jpg","","","","","Carrefour",""
"13759","Sillón Naples Chenille Chocolate"," confeccionado en Chenille y estructura de madera."," otorgando mayor confort y comodidad.","00","Poliflex","","","","http://www.carrefour.com.ar/muebles/living-comedor/sillones/sillon-naples-2-cuerpos-ch-choco-j.html","http://cdn.carrefour.com.ar/media/catalog/product/cache/1/image/9df78eab33525d08d6e5fb8d27136e95/n/a/naples_chenillechocolate_vista00.jpg","","","","","Carrefour",""
"13755","Sillón Kahlo Chenille Bordo","Sillón de 2 cuerpos de tela chenille color bordó"," otorgando mayor confort y comodidad.","00","Poliflex","","","","http://www.carrefour.com.ar/mayo-demoledor/renova-tu-interior/living-comedor/sillon-kahlo-2-cuerpos-ch-bordo-j.html","http://cdn.carrefour.com.ar/media/catalog/product/cache/1/image/9df78eab33525d08d6e5fb8d27136e95/k/a/kahlo_chenillebordo_vista00.jpg","","","","","Carrefour",""
"13754","Sillón Kahlo Chenille Negro"," con almohadones rellenos de fibroesfera y patas de madera"," para obtener el pelo característico.","00","Poliflex","","","","http://www.carrefour.com.ar/muebles/living-comedor/sillones/sillon-kahlo-2-cuerpos-ch-negro-j.html","http://cdn.carrefour.com.ar/media/catalog/product/cache/1/image/9df78eab33525d08d6e5fb8d27136e95/k/a/kahlo_chenillenegro_vista00.jpg","","","","","Carrefour",""
"13753","Sillón Kahlo Chenille Chocolate","Sillón de 2 cuerpos de tela chenille color chocolate"," para obtener el pelo característico.","00","Poliflex","","","","http://www.carrefour.com.ar/muebles/living-comedor/sillones/sillon-kahlo-2-cuerpos-ch-choco-j.html","http://cdn.carrefour.com.ar/media/catalog/product/cache/1/image/9df78eab33525d08d6e5fb8d27136e95/k/a/kahlo_chenillechocolate_vista00.jpg","","","","","Carrefour",""
"15076","Muñecas Bebé Lokotoys Le Petit x2","Dos muñecas bebés de Lokotoys de 30 cm. Incluye bañera rosa y accesorios de baño."," productos para el pelo y dibujos para jugar mientras que el niño baña a los bebés.","00","Lokotoys","","","","http://www.carrefour.com.ar/tiempo-libre-y-deportes/juegos-y-juguetes/juguetes-para-ni-as/mu-ecas-bebe-lokotoys-le-petit-x2.html","http://cdn.carrefour.com.ar/media/catalog/product/cache/1/image/9df78eab33525d08d6e5fb8d27136e95/4/8/4897011192796-2.jpg","","","","","Carrefour",""
"15075","Muñeca Bebé con Carrito Lokotoys My Dolly Sucette","Rosa / Edad Recomendada: Más de 3 años"," ideal para abrazar. Color: Rosa / Edad Recomendada: Más de 3 años","00","Lokotoys","","","","http://www.carrefour.com.ar/tiempo-libre-y-deportes/juegos-y-juguetes/juguetes-para-ni-as/my-dolly-bebe-37cm-c-carrito.html","http://cdn.carrefour.com.ar/media/catalog/product/cache/1/image/9df78eab33525d08d6e5fb8d27136e95/4/8/4897011191027-1.jpg","","","","","Carrefour",""
"15074","Muñeca Bebé Lokotoys Pink con 7 sonidos","Rosa / Edad Recomendada: Más de 10 meses"," llama a su mamá. Si lo acostás se duerme y si lo levantas se pone ríe de felicidad.","00","Lokotoys","","","","http://www.carrefour.com.ar/tiempo-libre-y-deportes/juegos-y-juguetes/juguetes-para-ni-as/baby-pink-muneca-interactiva-43-cm-7-son.html","http://cdn.carrefour.com.ar/media/catalog/product/cache/1/image/9df78eab33525d08d6e5fb8d27136e95/4/8/4897011190853-1.jpg","","","","","Carrefour",""
"15073","Tiro al Blanco Dragon-i Wild West","Multicolor / Edad Recomendada: Más de 3 años","Podes tirar al blanco con una distancia de hasta 6 metros. Incluye 4 productos y un soporte de plástico que mantiene los objetos parados.. Color: Multicolor / Edad Recomendada: Más de 3 años","00","Dragon-i","","","","http://www.carrefour.com.ar/tiempo-libre-y-deportes/juegos-y-juguetes/juguetes-para-ni-os/wild-west-set-tiro-al-blanco.html","http://cdn.carrefour.com.ar/media/catalog/product/cache/1/image/9df78eab33525d08d6e5fb8d27136e95/4/8/4894166105220-1.jpg","","","","","Carrefour",""
"7751","Cafetera Express Saeco HD8325/42","15 bares de presión / Capacidad: 1 lt. de agua / Panarello para espumar leche / Calentador de tazas"," panarello para espumar la leche y calentador de tazas. Esta hecho de materiales premium de larga duración. Tiene una caldera de acero inoxidable. 15 bares de presión | Capacidad: 1 lt. de agua | 1 año de garantía | Origen: China.","00","Philips","Pequeños Electrodomésticos","Desayuno","Cafeteras","http://www.carrefour.com.ar/pequenos-electrodomesticos/desayuno/cafeteras/cafetera-express-saeco-mod-hd-8325-42.html","http://cdn.carrefour.com.ar/media/catalog/product/cache/1/image/9df78eab33525d08d6e5fb8d27136e95/8/7/8710103560166.jpg","","","","","Carrefour",""
"14823","Joystick Inalambrico Sorma PS2 PS3 y PC GPAD-SORMA01 Azul"," PS3 y PC - Inalambrico - Cable de Carga de 80 Cm"," Sony Playstation 2 y PC. Tiene un grip de goma para mayor comodidad. Incluye un cable de carga de 80 Centimetros.","00","Sorma","","","","http://www.carrefour.com.ar/consolas-y-video-juegos/accesorios-3/joysticks/joystick-ps3-ps2-pc-sorma-azul-inalambri.html","http://cdn.carrefour.com.ar/media/catalog/product/cache/1/image/9df78eab33525d08d6e5fb8d27136e95/j/o/joy_0003_742832832199.jpg","","","","","Carrefour",""
"14822","Joystick Inalambrico Sorma PS2 PS3 y PC GPAD-SORMA01 Blanco"," PS3 y PC - Inalambrico - Cable de Carga de 80 Cm"," Sony Playstation 2 y PC. Tiene un grip de goma para mayor comodidad. Incluye un cable de carga de 80 Centimetros.","00","Sorma","","","","http://www.carrefour.com.ar/consolas-y-video-juegos/accesorios-3/joysticks/joystick-ps3-ps2-pc-sorma-blanco-inalamb.html","http://cdn.carrefour.com.ar/media/catalog/product/cache/1/image/9df78eab33525d08d6e5fb8d27136e95/j/o/joy_0012_742832832175.jpg","","","","","Carrefour",""
"14821","Joystick Inalambrico Sorma PS2 PS3 y PC GPAD-SORMA01 Rojo"," PS3 y PC - Inalambrico - Cable de Carga de 80 Cm"," Sony Playstation 2 y PC. Tiene un grip de goma para mayor comodidad. Incluye un cable de carga de 80 Centimetros.","00","Sorma","","","","http://www.carrefour.com.ar/consolas-y-video-juegos/accesorios-3/joysticks/joystick-ps3-ps2-pc-sorma-rojo-inalambri.html","http://cdn.carrefour.com.ar/media/catalog/product/cache/1/image/9df78eab33525d08d6e5fb8d27136e95/j/o/joy_0006_742832832168.jpg","","","","","Carrefour",""
"14820","Joystick Inalambrico Sorma PS2 PS3 y PC GPAD-SORMA01 Negro"," PS3 y PC - Inalambrico - Cable de Carga de 80 Cm"," Sony Playstation 2 y PC. Tiene un grip de goma para mayor comodidad. Incluye un cable de carga de 80 Centimetros.","00","Sorma","","","","http://www.carrefour.com.ar/consolas-y-video-juegos/accesorios-3/joysticks/joystick-ps3-ps2-pc-sorma-negro-inalambr.html","http://cdn.carrefour.com.ar/media/catalog/product/cache/1/image/9df78eab33525d08d6e5fb8d27136e95/j/o/joy_0009_742832720700.jpg","","","","","Carrefour",""
"13749","Sillón Frisia Ecocuero Negro"," confeccionado en Ecocuero y estructura de madera."," otorgando mayor confort y comodidad.","00","Poliflex","","","","http://www.carrefour.com.ar/muebles/living-comedor/sillones/sillon-frisia-2-cuerpos-eco-negro-d.html","http://cdn.carrefour.com.ar/media/catalog/product/cache/1/image/9df78eab33525d08d6e5fb8d27136e95/f/r/frisia_negro_vista00.jpg","","","","","Carrefour",""
"13748","Sillón Frisia Ecocuero Chocolate"," confeccionado en Ecocuero y estructura de madera."," otorgando mayor confort y comodidad.","00","Poliflex","","","","http://www.carrefour.com.ar/muebles/living-comedor/sillones/sillon-frisia-2-cuerpos-eco-choco-d.html","http://cdn.carrefour.com.ar/media/catalog/product/cache/1/image/9df78eab33525d08d6e5fb8d27136e95/f/r/frisia_chocolate_vista00.jpg","","","","","Carrefour",""
"13747","Sillón Frisia Ecocuero Crudo"," confeccionado en Ecocuero y estructura de madera."," otorgando mayor confort y comodidad.","00","Poliflex","","","","http://www.carrefour.com.ar/muebles/living-comedor/sillones/sillon-frisia-2-cuerpos-eco-crudo-d.html","http://cdn.carrefour.com.ar/media/catalog/product/cache/1/image/9df78eab33525d08d6e5fb8d27136e95/f/r/frisia_beige_vista00.jpg","","","","","Carrefour",""
"13746","Sillón Naples Ecocuero Chocolate"," confeccionado en Ecocuero y estructura de madera."," otorgando mayor confort y comodidad.","00","Poliflex","","","","http://www.carrefour.com.ar/muebles/living-comedor/sillones/sillon-naples-2-cuerpos-eco-choco-d.html","http://cdn.carrefour.com.ar/media/catalog/product/cache/1/image/9df78eab33525d08d6e5fb8d27136e95/n/a/naples_chocolate_vista00.jpg","","","","","Carrefour",""
"13744","Sillón Kahlo Ecocuero Chocolate"," confeccionado en Ecocuero y estructura de madera."," otorgando mayor confort y comodidad.","00","Poliflex","","","","http://www.carrefour.com.ar/muebles/living-comedor/sillones/sillon-kahlo-2-cuerpos-eco-choco-d.html","http://cdn.carrefour.com.ar/media/catalog/product/cache/1/image/9df78eab33525d08d6e5fb8d27136e95/k/a/kahlo_chocolate_vista00.jpg","","","","","Carrefour",""
"15065","Tiro al Blanco Dragon-i Wild West","Multicolor / Edad Recomendada: Más de 3 años","Podes tirar al blanco con una distancia de hasta 6 metros. Incluye 4 productos y un soporte de plástico que mantiene los objetos parados.. Color: Multicolor / Edad Recomendada: Más de 3 años","00","","","","","http://www.carrefour.com.ar/tiempo-libre-y-deportes/juegos-y-juguetes/juguetes-para-ni-os/set-disfras-de-piratas-8-piezas.html","http://cdn.carrefour.com.ar/media/catalog/product/cache/1/image/9df78eab33525d08d6e5fb8d27136e95/3/6/3614611195856-1.jpg","","","","","Carrefour",""
"15064","Estación de Policia Majorette mas un Autito","Azul / Edad Recomendada: Más de 3 años","En el cuartel de la policía Creatix de Majorette siempre hay movimiento! El set de juguete está compuesto por dos plantas: Prisión y garage. Helipuerto y dos rampas de salida. Carreteras y accesorios. Se puede ampliar con otros sets Creatix.  Este juguete realizado en plástico de gran calidad y está equipado con gran cantidad de accesorios. Estación azul con rampa blanca.. Color: Azul / Edad Recomendada: Más de 3 años","00","Majorette","","","","http://www.carrefour.com.ar/tiempo-libre-y-deportes/juegos-y-juguetes/juguetes-para-ni-os/majorette-estacion-de-policia-1-autito.html","http://cdn.carrefour.com.ar/media/catalog/product/cache/1/image/9df78eab33525d08d6e5fb8d27136e95/3/6/3614611186786-2.jpg","","","","","Carrefour",""
"15063","Pista de Carreras Majorette Racing Pitstop","Multicolor / Edad Recomendada: Más de 3 años"," plataforma elevadora y rampa de salida. Carretera y accesorios. Se puede ampliar con otros sets Creatix. Estación amarilla rampa gris.. Color: Multicolor / Edad Recomendada: Más de 3 años","00","Majorette","","","","http://www.carrefour.com.ar/tiempo-libre-y-deportes/juegos-y-juguetes/juguetes-para-ni-os/majorette-racing-pitstop-1-autito.html","http://cdn.carrefour.com.ar/media/catalog/product/cache/1/image/9df78eab33525d08d6e5fb8d27136e95/3/6/3614611186779-2.jpg","","","","","Carrefour",""
"14383","Reposera Sillón Fija de Jardín Solcito con Apoyabrazos Amarillo"," tela plástica recubierta con PVC."," permitiendo su reutilización. Para prolongar la vida útil de la reposera nunca deberá ser guardada húmeda y para el caso de estar expuesta a aguas salitrosas enjuagar con agua dulce.","00","","","","","http://www.carrefour.com.ar/jardin/muebles/bancos-reposeras/sillon-fijo-c-apoyabrazos-metal-solwind-1.html","http://cdn.carrefour.com.ar/media/catalog/product/cache/1/image/9df78eab33525d08d6e5fb8d27136e95/7/7/7798042573325-2.jpg","","","","","Carrefour",""
"15062","Pista de Autos Majorette Estación de Servicio","Verde / Edad Recomendada: Más de 3 años / Más de 55 piezas"," gasolinera. Plataforma elevadora y ascensor manual. Carreteras y accesorios. Se puede ampliar con otros sets Creatix. Estación verde con rampas grises.","00","Majorette","","","","http://www.carrefour.com.ar/tiempo-libre-y-deportes/juegos-y-juguetes/juguetes-para-ni-os/majorette-estacion-de-servicio-1-autit.html","http://cdn.carrefour.com.ar/media/catalog/product/cache/1/image/9df78eab33525d08d6e5fb8d27136e95/3/6/3614611186762-2.jpg","","","","","Carrefour",""
"14382","Reposera Sillón Fija de Jardín Solcito con Apoyabrazos Azul"," tela plástica recubierta con PVC."," permitiendo su reutilización. Para prolongar la vida útil de la reposera nunca deberá ser guardada húmeda y para el caso de estar expuesta a aguas salitrosas enjuagar con agua dulce.","00","","","","","http://www.carrefour.com.ar/jardin/muebles/bancos-reposeras/sillon-fijo-c-apoyabrazos-metal-solwind.html","http://cdn.carrefour.com.ar/media/catalog/product/cache/1/image/9df78eab33525d08d6e5fb8d27136e95/7/7/7798042571321-2.jpg","","","","","Carrefour",""
"15061","Teclado Electrónico Winfun Beat Bop","Edad recomendada: + de 3 años. Incluye 3 pilas AA (sólo para función de demostración)"," baile y se divierta junto a las canciones y diferentes efectos de sonido.","00","Winfun","Informática","Accesorios","Teclados","http://www.carrefour.com.ar/tiempo-libre-y-deportes/juegos-y-juguetes/juguetes-para-ni-os/teclado-electronico-winfun-beat-bop.html","http://cdn.carrefour.com.ar/media/catalog/product/cache/1/image/9df78eab33525d08d6e5fb8d27136e95/3/6/3614611184430-1.jpg","","","","","Carrefour",""
"13343","Bolso Printing Tela Negro/Rosa"," Medidas 36*71*33 cm"," gruesa y duradera de alta calidad. El denier es una unidad de medida usada para cuantificar el espesor del hilo.","00","Carrefour","","","","http://www.carrefour.com.ar/bolsos-y-valijas/bolsos/bolso-con-ruedas-printing-71cm-negro-con.html","http://cdn.carrefour.com.ar/media/catalog/product/cache/1/image/9df78eab33525d08d6e5fb8d27136e95/3/6/3614610016114_a.jpg","","","","","Carrefour",""
"13342","Bolso Printing Tela Negro/Celeste","Estructura confeccionada en metal y plástico e interior forrado en poliester. Posee 2 ruedas. Medidas 36*71* cm"," gruesa y duradera de alta calidad. El denier es una unidad de medida usada para cuantificar el espesor del hilo.","00","Carrefour","","","","http://www.carrefour.com.ar/bolsos-y-valijas/bolsos/bolso-con-ruedas-printing-71cm-negro-con-1.html","http://cdn.carrefour.com.ar/media/catalog/product/cache/1/image/9df78eab33525d08d6e5fb8d27136e95/3/6/3614610016091_a_1.jpg","","","","","Carrefour",""
"8788","Depiladora Philips Satinelle Soft H","Depiladora Philips HP6423/30","Tipo de Depiladora: Pinzas Rotatorias. Velocidades: 1. Cabezal/les: Adaptador Axilas y Cavado. Cabezal Lavable. Voltaje Universal","00","Philips","Cuidado Personal y Salud","Cuidado de la Mujer","Depiladoras","http://www.carrefour.com.ar/cuidado-personal-y-salud/cuidado-de-la-mujer/depiladoras/depiladora-philips-satinelle-soft-mod-h.html","http://cdn.carrefour.com.ar/media/catalog/product/cache/1/image/9df78eab33525d08d6e5fb8d27136e95/8/7/8710103666653.jpg","","","","","Carrefour",""
"13341","Bolso Classic Tela Rojo"," Medidas 32*55*28 cm"," gruesa y duradera de alta calidad. El denier es una unidad de medida usada para cuantificar el espesor del hilo.","00","Carrefour","","","","http://www.carrefour.com.ar/bolsos-y-valijas/bolsos/bolso-classic-55cm-negro-rojo.html","http://cdn.carrefour.com.ar/media/catalog/product/cache/1/image/9df78eab33525d08d6e5fb8d27136e95/3/6/3613865360959_b.jpg","","","","","Carrefour",""
"14819","Joystick Inalambrico Sorma Boca PS2 PS3 y PC GPAD-BOCA01"," PS3 y PC - Inalambrico - Cable de Carga de 80 Cm"," Sony Playstation 2 y PC. Tiene un grip de goma para mayor comodidad. Incluye un cable de carga de 80 Centimetros.","00","Sorma","","","","http://www.carrefour.com.ar/consolas-y-video-juegos/accesorios-3/joysticks/joystick-ps3-ps2-pc-sorma-lic-inalambric.html","http://cdn.carrefour.com.ar/media/catalog/product/cache/1/image/9df78eab33525d08d6e5fb8d27136e95/j/o/joy_0015_742832720694.jpg","","","","","Carrefour",""
