Id,Titulo_P,Subtitulo_P,Descripcion,Valor,Marca,Categoria,Subcategoria,Sub_sub_categoria,URL_Redireccion,URL_Imagen_Principal,URL_Imagen_2,URL_Imagen_3,URL_Imagen_4,URL_Imagen_5,Tienda, Stock
"14159","Sillón de Jardín Board Acero Rosa","Con apoyabrazos y apilable."," con procesos de producción con mínimos desperdicios. Uno de los materiales que menos afecta el medioambiente.  Para mantener nuestros Muebles de Jardín es conveniente no utilizar lavadoras a presión para la limpieza. Secarlos con un paño luego de las lluvias. No exponerlos innecesariamente a los rayos ultravioletas. Guardarlos en el invierno.","00","","","","","http://www.carrefour.com.ar/jardin/muebles/mesas-y-sillas/sillon-board-color-rosa-67x62x65-5.html","http://cdn.carrefour.com.ar/media/catalog/product/cache/1/image/9df78eab33525d08d6e5fb8d27136e95/3/6/3614610056233-2.jpg","","","","","Carrefour",""
"15195","Colchón de Espuma Poliflex Ventura 1 Plaza","Firmeza intermedia / Estructura poliuretano / Tela sábana estampada - matelaseada","El Colchón de Espuma Poliflex Ventura es de 1 Plaza con unas medidas de 80 x 190 x 20. Su espuma densidad media naranja.","00","Poliflex","","","","http://www.carrefour.com.ar/hogar-y-bazar/dormitorio/colchones-y-sommiers/colchon-ventura-80-x-190.html","http://cdn.carrefour.com.ar/media/catalog/product/cache/1/image/9df78eab33525d08d6e5fb8d27136e95/c/o/col_0010_7796448244191.jpg","","","","","Carrefour",""
"9635","Cocina Eléctrica Atma CCE3120X","La cocina eléctrica ATMA es tu aliada en el arte de la gastronomía. Porque te permite seleccionar múltiples alternativas para que puedas brindarle a cada una de tus preparaciones las condiciones óptimas de su cocción.","Pensada para no usar gas y diseñada para tu comodidad. No dejes pasar la oportunidad de ver cómo algo nuevo se empieza a cocina en tu casa junto a ATMA.","00","ATMA","Electrohogar","Cocinas y Purificadores","Cocinas Eléctricas","http://www.carrefour.com.ar/electrohogar-1/cocinas-y-purificadores/cocinas-electricas/cocina-atma-cce3120x.html","http://cdn.carrefour.com.ar/media/catalog/product/cache/1/image/9df78eab33525d08d6e5fb8d27136e95/7/7/7798192360486.jpg","","","","","Carrefour",""
"15193","Colchón de Espuma Poliflex Ventura 2 Plazas","Firmeza intermerdia / Estructura poliuretano / Tela sábana estampada - matelaseada","El Colchón de Espuma Poliflex Ventura es de 2 Plazas con unas medidas de 140 x 190 x 20. Su espuma es de densidad media naranja.","00","Poliflex","","","","http://www.carrefour.com.ar/hogar-y-bazar/dormitorio/colchones-y-sommiers/colchon-ventura-140-x-190.html","http://cdn.carrefour.com.ar/media/catalog/product/cache/1/image/9df78eab33525d08d6e5fb8d27136e95/c/o/col_0009_7796448244696_1.jpg","","","","","Carrefour",""
"7081","Plancha de Pelo Ga.Ma Ceramic Ion Rosa","Rulos con la plancha"," le dan a esta plancha la posibilidad de crear rulos. La temperatura es de 210°c","00","Ga.Ma","","","","http://www.carrefour.com.ar/cuidado-personal-y-salud/cuidado-de-la-mujer/planchas-para-el-cabello/plancha-de-pelo-rosa-ga-ma-ceramic-ion.html","http://cdn.carrefour.com.ar/media/catalog/product/cache/1/image/9df78eab33525d08d6e5fb8d27136e95/8/0/8023277105928.jpg","","","","","Carrefour",""
"9992","Juego de Jardín Snack 5 Piezas Rattan y Acero Gris"," todo plegable."," con procesos de producción con mínimos desperdicios. Uno de los materiales que menos afecta el medioambiente. Para mantener nuestros Muebles de Jardín es conveniente no utilizar lavadoras a presión para la limpieza. Secarlos con un paño luego de las lluvias. No exponerlos innecesariamente a los rayos ultravioletas. Guardarlos en el invierno.","00","","","","","http://www.carrefour.com.ar/jardin/muebles/juegos-de-jardin/juego-de-jardin-mesa-y-4-sillas.html","http://cdn.carrefour.com.ar/media/catalog/product/cache/1/image/9df78eab33525d08d6e5fb8d27136e95/3/2/3267078054190.jpg","","","","","Carrefour",""
"9990","Juego de Jardín Talego 3 Piezas Resina de polipropileno"," todo plegable."," con procesos de producción con mínimos desperdicios. Uno de los materiales que menos afecta el medioambiente. Para mantener nuestros Muebles de Jardín es conveniente no utilizar lavadoras a presión para la limpieza. Secarlos con un paño luego de las lluvias. No exponerlos innecesariamente a los rayos ultravioletas. Guardarlos en el invierno.","00","","","","","http://www.carrefour.com.ar/jardin/muebles/juegos-de-jardin/set-3-pzs-pleg-mesa-red-diam-60cm-2-s.html","http://cdn.carrefour.com.ar/media/catalog/product/cache/1/image/9df78eab33525d08d6e5fb8d27136e95/3/2/3267078051533-05.jpg","","","","","Carrefour",""
"14153","Reposera de Jardín Rocking Rosa"," súper cómoda!"," y estrcutura mecedora/apoyabrazos de metal","00","","","","","http://www.carrefour.com.ar/jardin/muebles/bancos-reposeras/sillon-rocking-color-rosa.html","http://cdn.carrefour.com.ar/media/catalog/product/cache/1/image/9df78eab33525d08d6e5fb8d27136e95/3/6/3613865310794-2.jpg","","","","","Carrefour",""
"14152","Reposera de Jardín Rocking Verde Manzana"," súper cómoda!"," y estrcutura mecedora/apoyabrazos de metal","00","","","","","http://www.carrefour.com.ar/jardin/muebles/bancos-reposeras/sillon-rocking-color-verde-manzana.html","http://cdn.carrefour.com.ar/media/catalog/product/cache/1/image/9df78eab33525d08d6e5fb8d27136e95/3/6/3613865310787-2.jpg","","","","","Carrefour",""
"14151","Reposera de Jardín Lounge Rattan"," con almohada incluída!"," por lo que se puede dejar durante el invierno en el exterior. Para mantener nuestros Muebles de Jardín es conveniente no utilizar lavadoras a presión para la limpieza. Secarlos con un paño luego de las lluvias. No exponerlos innecesariamente a los rayos ultravioletas. Guardarlos en el invierno.","00","","","","","http://www.carrefour.com.ar/jardin/muebles/bancos-reposeras/reposera-rattan-pos-c-almoh-en-resp-54-5.html","http://cdn.carrefour.com.ar/media/catalog/product/cache/1/image/9df78eab33525d08d6e5fb8d27136e95/3/6/3610882108601-1.jpg","","","","","Carrefour",""
"6439","Cava Conservadora de Vinos Wine Collection 8 botellas","Display digital."," display digital.","00","Wine Collection","Electrohogar","Heladeras y Freezers","Cavas","http://www.carrefour.com.ar/electrohogar-1/heladeras-freezers/cavas/cava-conservadora-de-vinos-wine-collection-8-botellas.html","http://cdn.carrefour.com.ar/media/catalog/product/cache/1/image/9df78eab33525d08d6e5fb8d27136e95/7/7/7798105029110.jpg","","","","","Carrefour",""
"6794","Termotanque a Gas Señorial 85 Litros TSZ-85MG Blanco","Quemador de alto rendimiento."," permiten lograr una efectiva alta recuperación. Calentamiento simultáneo: al abrir una canilla se comienza a recuperar el agua caliente simultáneamente con el uso.Tiro natural vertical","00","Señorial","Electrohogar","Termotanques","Termotanques a Gas","http://www.carrefour.com.ar/electrohogar-1/termotanques/termotanques-a-gas/termotanque-a-gas-de-alta-recuperacion-se-orial-tts-85.html","http://cdn.carrefour.com.ar/media/catalog/product/cache/1/image/9df78eab33525d08d6e5fb8d27136e95/7/7/7796825000679_1.jpg","","","","","Carrefour",""
"6793","Termotanque a Gas Señorial 160 Litros TTS-160 Blanco","Termotanque a ga Señorial TTS-160 160lts con regulador de temperatura y piloto analizador de gases","Sistema para apoyar","00","Señorial","Electrohogar","Termotanques","Termotanques a Gas","http://www.carrefour.com.ar/electrohogar-1/termotanques/termotanques-a-gas/termotanque-a-gas-de-alta-recuperacion-se-orial-tts-160.html","http://cdn.carrefour.com.ar/media/catalog/product/cache/1/image/9df78eab33525d08d6e5fb8d27136e95/7/7/7796825000693_1.jpg","","","","","Carrefour",""
"6791","Termotanque a Gas Señorial 50 Litros TTS-50 Blanco","Termotanque a gas de alta recuperación Señorial TTS-50 50lts con regulador de temperatura y piloto analizador de gases.","Sistema dual para apoyar y colgar","00","Señorial","Electrohogar","Termotanques","Termotanques a Gas","http://www.carrefour.com.ar/electrohogar-1/termotanques/termotanques-a-gas/termotanque-a-gas-de-alta-recuperacion-se-orial-tts-50.html","http://cdn.carrefour.com.ar/media/catalog/product/cache/1/image/9df78eab33525d08d6e5fb8d27136e95/7/7/7796825000587_1.jpg","","","","","Carrefour",""
"6790","Termotanque a Gas Señorial 30 Litros TTS-30 Blanco","Termotanque a gas de alta recuperación Señorial TTS-30 30lts con regulador de temperaturay piloto analizador de gases","Sistema dual para apoyar y colgar","00","Señorial","Electrohogar","Termotanques","Termotanques a Gas","http://www.carrefour.com.ar/electrohogar-1/termotanques/termotanques-a-gas/termotanque-a-gas-de-alta-recuperacion-se-orial-tts-30.html","http://cdn.carrefour.com.ar/media/catalog/product/cache/1/image/9df78eab33525d08d6e5fb8d27136e95/7/7/7796825000570_1.jpg","","","","","Carrefour",""
"14146","Juego de Jardín Naipes 5 Piezas Resina y Acero"," todo plegable."," con procesos de producción con mínimos desperdicios. Uno de los materiales que menos afecta el medioambiente. Para mantener nuestros Muebles de Jardín es conveniente no utilizar lavadoras a presión para la limpieza. Secarlos con un paño luego de las lluvias. No exponerlos innecesariamente a los rayos ultravioletas. Guardarlos en el invierno.","00","","","","","http://www.carrefour.com.ar/jardin/muebles/juegos-de-jardin/set-hdpe-5-pzs-pleg-mesa-86x86-4-sil.html","http://cdn.carrefour.com.ar/media/catalog/product/cache/1/image/9df78eab33525d08d6e5fb8d27136e95/3/2/3267078880058-1.jpg","","","","","Carrefour",""
"14145","Parasol Atlantic Aluminio Verde Manzana"," 3 m de diámetro!"," lo que le permite permanecer inalterable por más tiempo que otros géneros. Para mantener nuestros Muebles de Jardín es conveniente no utilizar lavadoras a presión para la limpieza. Secarlos con un paño luego de las lluvias. No exponerlos innecesariamente a los rayos ultravioletas. Guardarlos en el invierno.","00","","","","","http://www.carrefour.com.ar/jardin/muebles/parasoles-y-sombrillas/parasol-alum-3m-verde-manzana.html","http://cdn.carrefour.com.ar/media/catalog/product/cache/1/image/9df78eab33525d08d6e5fb8d27136e95/3/2/3267078549306-1.jpg","","","","","Carrefour",""
"14144","Parasol Atlantic Aluminio Naranja"," 3 m de diámetro!"," lo que le permite permanecer inalterable por más tiempo que otros géneros. Para mantener nuestros Muebles de Jardín es conveniente no utilizar lavadoras a presión para la limpieza. Secarlos con un paño luego de las lluvias. No exponerlos innecesariamente a los rayos ultravioletas. Guardarlos en el invierno.","00","","","","","http://www.carrefour.com.ar/jardin/muebles/parasoles-y-sombrillas/parasol-alum-3m-naranja.html","http://cdn.carrefour.com.ar/media/catalog/product/cache/1/image/9df78eab33525d08d6e5fb8d27136e95/3/2/3267078249305-1.jpg","","","","","Carrefour",""
"14143","Parasol Atlantic Aluminio Rojo"," 3 m de diámetro!"," lo que le permite permanecer inalterable por más tiempo que otros géneros. Para mantener nuestros Muebles de Jardín es conveniente no utilizar lavadoras a presión para la limpieza. Secarlos con un paño luego de las lluvias. No exponerlos innecesariamente a los rayos ultravioletas. Guardarlos en el invierno.","00","","","","","http://www.carrefour.com.ar/jardin/muebles/parasoles-y-sombrillas/parasol-alum-3m-rojo.html","http://cdn.carrefour.com.ar/media/catalog/product/cache/1/image/9df78eab33525d08d6e5fb8d27136e95/3/2/3267078149308-1.jpg","","","","","Carrefour",""
"13068","Sillón Round Estampado Sellos"," diseño de sellos."," son apreciados para la confección de prendas y accesorios de alto rendimiento.","00","","","","","http://www.carrefour.com.ar/muebles/living-comedor/mesas-y-sillas/sillon-redondo-tela-estampillas.html","http://cdn.carrefour.com.ar/media/catalog/product/cache/1/image/9df78eab33525d08d6e5fb8d27136e95/3/2/3267072241985ok-1.jpg","","","","","Carrefour",""
"9979","Parasol Suspendido Curazao Aluminio Crudo","Con ventilación superior para que el viento no lo embolse."," con procesos de producción con mínimos desperdicios. Uno de los materiales que menos afecta el medioambiente. Para mantener nuestros Muebles de Jardín es conveniente no utilizar lavadoras a presión para la limpieza. Secarlos con un paño luego de las lluvias. No exponerlos innecesariamente a los rayos ultravioletas. Guardarlos en el invierno.","00","","","","","http://www.carrefour.com.ar/jardin/muebles/parasoles-y-sombrillas/parasol-suspendido-diam-3-mts-crudo.html","http://cdn.carrefour.com.ar/media/catalog/product/cache/1/image/9df78eab33525d08d6e5fb8d27136e95/p/a/para_0000_3267078013456.jpg","","","","","Carrefour",""
"14498","Bolso Portanotebook Business 42CM Negro","Compartimiento para notebook - Medidas: 32 x 42 x 13 Cm.","Bolso Portanotebook con dos cierres. Cuenta con un compartimiento para notebook. Riendas para colgar. Material: Poliester. Medidas: 32 x 42 x 13 Cm.","00","Carrefour","","","","http://www.carrefour.com.ar/bolsos-y-valijas/bolsos/bolso-portanotebook-business-42cm-2-comp.html","http://cdn.carrefour.com.ar/media/catalog/product/cache/1/image/9df78eab33525d08d6e5fb8d27136e95/3/6/3614610183045-1.jpg","","","","","Carrefour",""
"14495","Pelota de Básquetbol Nº5","Pelota de Básquetbol Nº5 de caucho color naranja y marron.","Pelota de Básquetbol Nº5 de caucho color naranja y marron. Tiene un peso de 470-500 Gramos. La presión ideal de aire para esta pelota es entre 0.48 y 0.62 Bar.","00","","","","","http://www.carrefour.com.ar/tiempo-libre-y-deportes/juegos-y-juguetes/juegos-deportivos/pelota-de-basketball-n-5.html","http://cdn.carrefour.com.ar/media/catalog/product/cache/1/image/9df78eab33525d08d6e5fb8d27136e95/3/6/3614610765456-1.jpg","","","","","Carrefour",""
"14493","Aro de Básquet con Sistema Volcada","Nº7 - Diametro 45 Cm","Aro de básquet con resortes de sistema de volcada color rojo con red blanca. Tiene un diámetro de 45 Centímetros ideal para pelotas Nº7.","00","","","","","http://www.carrefour.com.ar/tiempo-libre-y-deportes/juegos-y-juguetes/juegos-deportivos/aro-de-basquet-con-sistema-volcada.html","http://cdn.carrefour.com.ar/media/catalog/product/cache/1/image/9df78eab33525d08d6e5fb8d27136e95/7/7/7798142872281-1.jpg","","","","","Carrefour",""
"14492","Aro de Básquet Nº5","Aro de básquet color rojo con red blanca. Ideal Para pelotas número 5.","Aro de básquet color rojo con red blanca. Ideal Para pelotas número 5.","00","","","","","http://www.carrefour.com.ar/tiempo-libre-y-deportes/juegos-y-juguetes/juegos-deportivos/aro-de-basquet-n-5.html","http://cdn.carrefour.com.ar/media/catalog/product/cache/1/image/9df78eab33525d08d6e5fb8d27136e95/7/7/7798142872274_1.jpg","","","","","Carrefour",""
"14491","Mini Arco de Fútbol","Edad recomendada: Más de 3 Años."," 1 red","00","","","","","http://www.carrefour.com.ar/tiempo-libre-y-deportes/juegos-y-juguetes/juegos-deportivos/mini-arco-de-futbol.html","http://cdn.carrefour.com.ar/media/catalog/product/cache/1/image/9df78eab33525d08d6e5fb8d27136e95/7/7/7798142872267-1.jpg","","","","","Carrefour",""
"14490","Arco de Fútbol 2 Metros de Ancho","1.5 metros por 2 metros de ancho -  Edad recomendada: Más de 3 Años."," 1 red y 6 precintos.","00","","","","","http://www.carrefour.com.ar/tiempo-libre-y-deportes/juegos-y-juguetes/juegos-deportivos/arco-de-futbol-2-metros-de-ancho.html","http://cdn.carrefour.com.ar/media/catalog/product/cache/1/image/9df78eab33525d08d6e5fb8d27136e95/7/7/7798142872250-1.jpg","","","","","Carrefour",""
"13052","Escritorio de Oficina Iconos Negro","Confeccionado en vidrio templado y estructura de acero"," con procesos de producción con mínimos desperdicios. Uno de los materiales que menos afecta el medioambiente.","00","","","","","http://www.carrefour.com.ar/muebles/oficina/escritorios/escritorio-cano-y-vidrio-diseno-iconos-1.html","http://cdn.carrefour.com.ar/media/catalog/product/cache/1/image/9df78eab33525d08d6e5fb8d27136e95/3/2/3267072142015-2.jpg","","","","","Carrefour",""
"13051","Sillón de Oficina Cozumel Marrón"," con sistema ''gas lift'' de elevación por palanca."," recupera su belleza original.","00","","","","","http://www.carrefour.com.ar/muebles/oficina/sillas-y-sillones/sillon-de-oficina-alto-color-marron.html","http://cdn.carrefour.com.ar/media/catalog/product/cache/1/image/9df78eab33525d08d6e5fb8d27136e95/3/2/3267072142008-2.jpg","","","","","Carrefour",""
"6776","Vaporizador San-Up 3077"," 6 a 8 horas de evaporado"," tiro balanceado). Totalmente seguro y silencioso. Con apagado automático e indicador del nivel de agua. Potencia 520W. Corriente máxima 2.25 A. Capacidad del recipiente 4 lts. Tiempo de evaporado 6 a 8 hs.","00","San Up","","","","http://www.carrefour.com.ar/mundo-bebe/cuidado-del-bebe/nebulizadores/vaporizador-san-up-3077.html","http://cdn.carrefour.com.ar/media/catalog/product/cache/1/image/9df78eab33525d08d6e5fb8d27136e95/7/7/7793647030778.jpg","","","","","Carrefour",""
"14884","Termotanque a Gas Eskabe Acquapiú 52 Litros A5-800 Acero Inoxidable","Capacidad 52 litros - alta recuperacion de hasta 800 Litros por hora - Multigas","El Termotanque a Gas Eskabe Acquapiú A5-800 con una capacidad para 52 litros y una alta recuperacion de hasta 760 Litros por hora. Tiene sistema de encendido piezoeléctric. oPuede utilizarse con gas natural o con gas envasado. Tiene válvula de seguridad que cierra el gas automaticamente si se apaga la llama piloto.","00","Eskabe","Electrohogar","Termotanques","Termotanques a Gas","http://www.carrefour.com.ar/electrohogar-1/termotanques/termotanques-a-gas/termotanque-eskabe-acquapiu-800-lts-mg.html","http://cdn.carrefour.com.ar/media/catalog/product/cache/1/image/9df78eab33525d08d6e5fb8d27136e95/a/s/asd_0000_7796931840527.jpg","","","","","Carrefour",""
"14522","Depósito de Jardín Endura EGD3030ZA 3 x 3 x 2.10 M","Depósitos de Jardín Australianos de Acero con Puertas de Abrir con Bisagras.","Depósitos de Jardín Australianos de Acero con Puertas de Abrir con Bisagras. El deposito mide 3 x 3 x 2.10 Metros. No incluye Piso.","00","Endura","","","","http://www.carrefour.com.ar/jardin/muebles/depositos/dep-sito-de-jard-n-endura-3-00mx3-00mx2.html","http://cdn.carrefour.com.ar/media/catalog/product/cache/1/image/9df78eab33525d08d6e5fb8d27136e95/9/3/9345336005499-1.jpg","","","","","Carrefour",""
"14521","Depósito de Jardín Endura ESS2323A 2.25 x 2.25 x 2.05 M","Depósitos de Jardín Australianos de Acero con Puertas de Abrir con Bisagras.","Depósitos de Jardín Australianos de Acero con Puertas de Abrir con Bisagras. El deposito mide 2.25 x 2.25 x 2.05 Metros. No incluye Piso.","00","Endura","","","","http://www.carrefour.com.ar/jardin/muebles/depositos/dep-sito-de-jard-n-endura-2-25mx2-25mx2.html","http://cdn.carrefour.com.ar/media/catalog/product/cache/1/image/9df78eab33525d08d6e5fb8d27136e95/9/3/9345336004744-1.jpg","","","","","Carrefour",""
"14489","Pelota de Básquetbol Nº7","Pelota de Básquetbol Nº7 de caucho color naranja y marrón.","Pelota de Básquetbol Nº7 de caucho color naranja y marrón. Tiene un peso de 580-620 Gramos. La presión ideal de aire para esta pelota es entre 0.48 y 0.62 Bar.","00","","","","","http://www.carrefour.com.ar/tiempo-libre-y-deportes/juegos-y-juguetes/juegos-deportivos/pelota-de-basketball-n-7.html","http://cdn.carrefour.com.ar/media/catalog/product/cache/1/image/9df78eab33525d08d6e5fb8d27136e95/3/6/3614611112136-1.jpg","","","","","Carrefour",""
"14520","Depósito de Jardín Endura ESS2315ZA 2.25 x 1.50 x 2.10 M.","Depósitos de Jardín Australianos de Acero con Puertas de Abrir con Bisagras.","Depósitos de Jardín Australianos de Acero con Puertas de Abrir con Bisagras. El deposito mide 2.25 x 1.50 x 2.10 Metros. No incluye Piso.","00","Endura","","","","http://www.carrefour.com.ar/jardin/muebles/depositos/dep-sito-de-jard-n-endura-2-25mx1-50mx2.html","http://cdn.carrefour.com.ar/media/catalog/product/cache/1/image/9df78eab33525d08d6e5fb8d27136e95/d/e/dep_0002_9345336002498.jpg","","","","","Carrefour",""
"14487","Pelota de Básquetbol Nº3","Pelota de Básquetbol Nº3 de caucho color naranja y marron.","Pelota de Básquetbol Nº3 de caucho color naranja y marron. Tiene un peso de 300-320 Gramos. La presión ideal de aire para esta pelota es entre 0.28 y 0.41 Bar.","00","","","","","http://www.carrefour.com.ar/tiempo-libre-y-deportes/juegos-y-juguetes/juegos-deportivos/pelota-de-basquetbol-n-3.html","http://cdn.carrefour.com.ar/media/catalog/product/cache/1/image/9df78eab33525d08d6e5fb8d27136e95/3/6/3614610765449-1.jpg","","","","","Carrefour",""
"14486","Scooter de Tres Ruedas para Varon","Scooter de tres ruedas con diseño para varon.","Scooter de tres ruedas con diseño para varon. Rueda frontal de 15 Cm  y rueda trasera 12 Cm. El scooter es de plastico con un caño estructural de hierro.","00","Carrefour","","","","http://www.carrefour.com.ar/tiempo-libre-y-deportes/deportes/scooter-varon-tres-ruedas.html","http://cdn.carrefour.com.ar/media/catalog/product/cache/1/image/9df78eab33525d08d6e5fb8d27136e95/3/6/3613867231240-2.jpg","","","","","Carrefour",""
"14485","Scooter de Tres Ruedas para Nena","Scooter de tres ruedas con diseño para nena.","Scooter de tres ruedas con diseño para nena. Rueda frontal de 15 Cm  y rueda trasera 12 Cm. El scooter es de plastico con un caño estructural de hierro.","00","Carrefour","","","","http://www.carrefour.com.ar/tiempo-libre-y-deportes/deportes/scooter-nena-tres-ruedas.html","http://cdn.carrefour.com.ar/media/catalog/product/cache/1/image/9df78eab33525d08d6e5fb8d27136e95/3/6/3613867231233-2.jpg","","","","","Carrefour",""
"14484","Scooter de Aluminio para Nena","Scooter es de aluminio. Es pleglable y tiene altura ajustable.","Scooter de dos ruedas con diseño para nena. El scooter es de aluminio. Es pleglable y tiene altura ajustable.","00","Carrefour","","","","http://www.carrefour.com.ar/tiempo-libre-y-deportes/deportes/scooter-de-aluminio-para-nena.html","http://cdn.carrefour.com.ar/media/catalog/product/cache/1/image/9df78eab33525d08d6e5fb8d27136e95/3/6/3613866988602-2.jpg","","","","","Carrefour",""
"13445","Cafetera Programable Black and Decker CM2031"," Programable."," de 1 a 4 tazas. Tiene una jarra con una capacidad para 12 tazas de cafe.","00","Black & Decker","Pequeños Electrodomésticos","Desayuno","Cafeteras","http://www.carrefour.com.ar/pequenos-electrodomesticos/desayuno/cafeteras/cafetera-black-and-decker-programable-mo.html","http://cdn.carrefour.com.ar/media/catalog/product/cache/1/image/9df78eab33525d08d6e5fb8d27136e95/5/0/50875816497.jpg","","","","","Carrefour",""
"14482","Pelota de Fútbol Nº5 Top Life Stroke","Pelota de fútbol de cuero sintético Top Life Stroke numero 5.","Pelota de fútbol de cuero sintético Top Life Stroke numero 5. Color blanco con detalles en negro y verde.","00","Top Life","","","","http://www.carrefour.com.ar/tiempo-libre-y-deportes/juegos-y-juguetes/juegos-deportivos/pelota-de-futbol-n-5-top-life-stroke.html","http://cdn.carrefour.com.ar/media/catalog/product/cache/1/image/9df78eab33525d08d6e5fb8d27136e95/2/0/2015223456785-1.jpg","","","","","Carrefour",""
"14480","Pelota de Fútbol Nº5 Top Life Futsal","Pelota de fútbol de cuero sintético Top Life Futsal numero 5.","Pelota de fútbol de cuero sintético Top Life Futsal numero 5. Color blanco con detalles en negro y verde.","00","Top Life","","","","http://www.carrefour.com.ar/tiempo-libre-y-deportes/juegos-y-juguetes/juegos-deportivos/pelota-de-futbol-n-4-top-life-futsal.html","http://cdn.carrefour.com.ar/media/catalog/product/cache/1/image/9df78eab33525d08d6e5fb8d27136e95/1/8/1829123456780.jpg","","","","","Carrefour",""
"13048","Sillón Elegance Chocolate","."," son apreciados para la confección de prendas y accesorios de alto rendimiento.","00","","","","","http://www.carrefour.com.ar/muebles/living-comedor/mesas-y-sillas/sillon-alto-color-chocolate.html","http://cdn.carrefour.com.ar/media/catalog/product/cache/1/image/9df78eab33525d08d6e5fb8d27136e95/3/2/3267072141971-2.jpg","","","","","Carrefour",""
"14917","Sillón Reclinable 2 Cuerpos Gavle Negro"," color negro"," dependiendo de su uso.","00","Carrefour","","","","http://www.carrefour.com.ar/muebles/living-comedor/sillones/sillon-reclinable-2-cuerpos-negro.html","http://cdn.carrefour.com.ar/media/catalog/product/cache/1/image/9df78eab33525d08d6e5fb8d27136e95/3/2/3267078888634-1.jpg","","","","","Carrefour",""
"9160","Termómetro Digital Infrarrojo Aspen FDIR-V1","Termómetro FDIR-V1 de Aspen. Es para oído o frente y da una lectura rápida en solo segundos.","Termómetro FDIR-V1 de Aspen. Es para oído o frente y da una lectura rápida en solo segundos. Ideal para niños y bebés. Medición de la temperatura ambiente e incluye la función reloj.","00","Aspen","","","","http://www.carrefour.com.ar/mundo-bebe/cuidado-del-bebe/termometros/termometro-digital-infrarrojo-aspen-mod.html","http://cdn.carrefour.com.ar/media/catalog/product/cache/1/image/9df78eab33525d08d6e5fb8d27136e95/7/7/7790808036563_1.jpg","","","","","Carrefour",""
"7440","Nebulizador Ultrasónico Aspen NU 610","Nebulizador Ultrasónico Aspen NU 610 Fácilmente transportable. Ideal para niños y adultos. Timer de apagado automático. Regulador digital de niebla. Ultrasilencionso. Sistema monocamára.","Cumple con las normas de baja emisión electromagnética.","00","Aspen","Cuidado Personal y Salud","Cuidados de la Salud","Nebulizadores","http://www.carrefour.com.ar/mundo-bebe/cuidado-del-bebe/nebulizadores/nebulizador-ultrasonico-aspen-nu-610.html","http://cdn.carrefour.com.ar/media/catalog/product/cache/1/image/9df78eab33525d08d6e5fb8d27136e95/b/e/bel_0000_7790808031971.jpg","","","","","Carrefour",""
