"SUMITEX, C.A.";"";"Tel: (58) (276) 7715829";"Vía Aeropuerto, Sector Garrochal, Edif. Kamon Loc.B2-284, San Antonio San Antonio del Táchira, Venezuela";"Hilazas"
"MULTISERVICIOS ARAMAR, S.R.L";"";"Tel: (58) (243) 8084786";"Av. Ppal Olivos Viejos Maracay, Venezuela";"Hornos Microondas"
"SERVIMAC ELECTRONICS C.A.";"";"Tel: (58) (212) 7611753";"2da Av. Las Delicias, Edif. 22 De Mayo P.B, Sabana Grande Caracas, Venezuela";"Hornos Microondas"
"HORNOS MICROONDAS NOUEL ELETRONIC, C.A";"";"Tel: (58) (212) 2572122";"Av Guaicaipuro El Llanito Caracas, Venezuela";"Hornos Microondas"
"PARADISE SUITES HOTEL, C.A.";"";"Tel: (58) (276) 3942791";"Distribuidor Boca De Caneyes Autop. San Cristobal La Fria San Cristóbal, Venezuela";"Hoteles"
"APART HOTELTURISTICO DOÑA CLETA";"";"Tel: (58) (274) 2664508";"Av.Principal,La Pedregosa Mérida, Venezuela";"Hoteles"
"HOTEL FLAMINGO BEACH";"";"Tel: (58) (212) 2624750";"Cl. El Cristo La Caranta Caracas, Venezuela";"Hoteles"
"HOTEL MAIGUALIDA,C.A.";"";"Tel: (58) (293) 8391070";"Nacional,La Chica Mariguitar, Venezuela";"Hoteles"
"POSADA MALIBU";"";"Tel: (58) (212) 2211274";"Los Roques Caracas, Venezuela";"Hoteles"
"HOTEL TACHITRA";"";"Tel: (58) (257) 2517064";"Av. Juan Fernández de León Guanare Guanare, Venezuela";"Hoteles"
"HOSTAL RANCHO LA QUINTA C.A";"";"Tel: (58) (212) 2860014";"9na Los Palos Grandes Caracas, Venezuela";"Hoteles"
"HOTEL PORLAMAR";"";"Tel: (58) (295) 2633672";"C.i Igualdad Porlamar, Venezuela";"Hoteles"
"HOTEL EURO'S";"";"Tel: (58) (275) 8817040";"Av. Bolívar No. 7 - 42 El Vigía, Venezuela";"Hoteles"
"HOTEL GLIMAR";"";"Tel: (58) (212) 9515787";"Cl. Guaicaipuro El Rosal Caracas, Venezuela";"Hoteles"
"HOTEL SAN MARCOS";"";"Tel: (58) (243) 8685686";"Distribuidor de Managuas Sector Guayabal,Av.96 No.181-211 La Florida Vale ncia Edo Carabobo Maracay, Venezuela";"Hoteles"
"HOTEL D&D INN HOTEL TIBANA CARACAS";"";"Tel: (58) (212) 7930016";"Av. Bogotá Los Caobos Edif. Eco Inn Tibana Caracas, Venezuela";"Hoteles"
"POSADA MI VIEJO";"";"Tel: (58) (243) 9931169";"El Playon -O D Costa Ocumare de la Costa , Venezuela";"Hoteles"
"HOTEL PIÑANGO";"";"Tel: (58) (212) 8645821";"Av. Baralt Con Piñago Caracas, Venezuela";"Hoteles"
"ARBOLEDA INN SUITES & SPA";"";"Tel: (58) (261) 7253000";"Av. 4 Bella Vista No. 87 - 125 Maracaibo - Venezuela Maracaibo, Venezuela";"Hoteles"
"LORETO D PEDRO A";"";"Tel: (58) (212) 2672990";"Av. Aldoza Manrique Playa El Angel Caracas, Venezuela";"Hoteles"
"HOTEL HARMONY";"";"Tel: (58) (212) 7517145";"Cl Chopin Cnas De Bello Monte Caracas, Venezuela";"Hoteles"
"HOTEL WINDSURFER`S OASIS";"";"Tel: (58) (295) 2639375";"Cl Principal,El Yaque El Yaque, Venezuela";"Hoteles"
"HOTEL SAN REMO";"";"Telefax: (58) (274) 2660034";"La Pedregosa Sur Mérida, Venezuela";"Hoteles"
"HOTEL MISTAFI";"";"Tel: (58) (274) 2510729";"Abajo De la Plaza De Milla Av. 3 Con Calle 15 Mérida, Venezuela";"Hoteles"
"HOTEL MIAMI S.R.L.";"";"Tel: (58) (251) 4450054";"E/Calles 39 y 40 Avenida 20 Barquisimeto, Venezuela";"Hoteles"
"HOTEL OVIANA, C.A.";"";"Tel: (58) (281) 2761166";"Fte. Ctro. Méd. Zambrano Av. Caracas, Barcelona Barcelona, Venezuela";"Hoteles"
"HOTEL TURISTICO VARYNA C.A.";"";"Tel: (58) (273) 5333984";"Av. 23 De Enero, Barinas - Edo. Barinas Barinas, Venezuela";"Hoteles"
"HOTEL CORAL BEACH";"";"Tel: (58) (243) 9931253";"El Playon Ocumare de la Costa , Venezuela";"Hoteles"
"POSADA EL PUENTE";"";"Tel: (58) (212) 3410532";"Vía Caripito, Cuarto Rumbo Sector El Puente, Casanay Caracas, Venezuela";"Hoteles"
"POSADA TURISTICA LA FUENTE";"";"Tel: (58) (276) 3444626";"Av. Principal De Pueblo Nuevo No. 3 - 46 Entre El Ebenezer Y La Avenida F errero Tamayo Quinta Doña Lola Cl. 3, El Paraíso San Cristóbal, Venezuela";"Hoteles"
"HOTEL VENEZIA";"";"Tel: (58) (246) 8711660";"Cr 11 Calabozo Calabozo , Venezuela";"Hoteles"
"HOTEL MILLENNIUM";"";"Tel: (58) (261) 7492247";"Avenida 16 A, El Moján Maracaibo, Venezuela";"Hoteles"
"APART HOTEL PRESIDENTE";"";"Tel: (58) (261) 7983136";"Av. 11, No. 68 - 50, Entre Calles 68 Y 69 Sector Tierra Negra - Maracaibo - Edo. Zulia Maracaibo, Venezuela";"Hoteles"
"HOTEL TERAMUM";"";"Tel: (58) (281) 2813445";"Av.Ppal De Lecherias Lecherías, Venezuela";"Hoteles"
"CENTRO TERMAL LAS TRINCHERAS C.A";"";"Tel: (58) (212) 6613626";"Los Chaguaramos Caracas, Venezuela";"Hoteles"
"CHALET HOTEL C.A";"";"Tel: (58) (242) 3721372";"Ct.Nac El Palito la Paraguita Morón, Venezuela";"Hoteles"
"APART HOTEL SUITE GOLDEN MONKY C.A.";"";"Tel: (58) (261) 7973285";"Calle 78 Maracaibo, Venezuela";"Hoteles"
"HOTEL LAJA CITY";"";"Tel: (58) (285) 6329910";"Av. Bolivar Ciudad Bolivar, Venezuela";"Hoteles"
"HOTEL COLISEO C.A";"";"Tel: (58) (212) 7627916";"Av. Casanova Sabana Grande Caracas, Venezuela";"Hoteles"
"HOTEL COUNTRY, C.A.";"";"Tel: (58) (285) 6314870";"Av Simón Bolívar, Km 3 Vía Puerto Ordaz, Ciudad Bolívar Ciudad Bolivar, Venezuela";"Hoteles"
"HOTEL FAMILIAR MICHELENA";"";"Tel: (58) (212) 2230183";"Michelena Caracas, Venezuela";"Hoteles"
"CAMPAMENTO BANANA TOURS, C.A";"";"Tel: (58) (289) 9951511";"Santa Helena De Guarien, La Gran Sabana Colinas De La Laguna Santa Elena de Uairén, Venezuela";"Hoteles"
"HOTEL PIRINEOS C.A";"";"Tel: (58) (212) 3564033";"Av. España Pueblo Nuevo Caracas, Venezuela";"Hoteles"
"HOTEL ASTOR";"";"Tel: (58) (261) 7914510";"Calle 78, Pza De las Republicas Maracaibo, Venezuela";"Hoteles"
"GRAN HOTEL CUMANÁ";"";"Tel: (58) (293) 4510671";"Av Universidad Frente A La U.D.O., Cumaná Cumaná, Venezuela";"Hoteles"
"HOTEL JARDIN C.A";"";"Tel: (58) (249) 7932189";"Av. Bolivar Heres Bejuma, Venezuela";"Hoteles"
"HOTEL JOLLY, C.A.";"";"Tel: (58) (251) 2524670";"Av Moran,E/Crs 23 y 24 Barquisimeto, Venezuela";"Hoteles"
"HOTEL DAKOTA SUITES";"";"Tel: (58) (212) 4729453";"Av. O'Higgins Bella Vista Caracas, Venezuela";"Hoteles"
"HOTEL GABIAL C.A";"";"Tel: (58) (212) 7931156";"Av. Prolongación Sur Las Acacias Caracas, Venezuela";"Hoteles"
"HOTEL BRASIL";"";"Tel: (58) (281) 2623000";"CI Monagas Paseo Puerto de  la Cruz, Venezuela";"Hoteles"
"HOTEL CARIBAY";"";"Tel: (58) (274) 2637596";"Av.2 Lora Mérida, Venezuela";"Hoteles"
"HOTEL LA SIERRA, C.A.";"";"Tel: (58) (263) 4732711";"Av. Santa Teresa Machiques, Venezuela";"Hoteles"
"HOTEL ITALIA";"";"Tel: (58) (293) 4333678";"Cl Sucre, Nro 71, Cumaná Cumaná, Venezuela";"Hoteles"
"HOTEL BELLA VISTA";"";"Tel: (58) (295) 2617222";"Av Santiago Mariño, Porlamar - 6301 Nueva Esparta - Venezuela Porlamar, Venezuela";"Hoteles"
"HOTEL EL ARROYO";"";"Tel: (58) (212) 4813705";"Tasca Caracas, Venezuela";"Hoteles"
"HOTEL DA GINO";"";"Tel: (58) (285) 6328367";"Av Jesús Soto, Ciudad Bolívar Ciudad Bolivar, Venezuela";"Hoteles"
"HOSTERIA EL VIGIA, C.A.";"";"Tel: (58) (275) 8812304";"Av. Don Pepe Rojas El Vigía, Venezuela";"Hoteles"
"HOTEL ARISTON";"";"Tel: (58) (246) 8712547";"Calabozo Calabozo , Venezuela";"Hoteles"
"OASIS KAFFE,C.A.";"";"Tel: (58) (293) 8150228";"Cl Marina, playa Cochaima Santa Fe Sucre, Venezuela";"Hoteles"
"HOTEL EL MARQUES";"";"Tel: (58) (212) 2420510";"Av. Rómulo Gallegos El Marqués Caracas, Venezuela";"Hoteles"
"HOTEL PUNTA PALMA";"";"Tel: (58) (243) 2800800";"Macaray Maracay, Venezuela";"Hoteles"
"GRAN HOTEL AMAZONAS";"";"Tel: (58) (243) 8090099";"Av.Amazonas c/c Evelio Roa Pto Ayacucho Maracay, Venezuela";"Hoteles"
"HOTEL AMERICA";"";"Tel: (58) (265) 6313919";"Cl. Trujillo, Centro Urbanización Sugerid Ciudad Ojeda, Venezuela";"Hoteles"
"POSADA MONTAÑA AZUL";"";"Tel: (58) (212) 2524685";"Cl. 16 Belén Caracas, Venezuela";"Hoteles"
"HOTEL CORONADO SUITES";"";"Tel: (58) (243) 8207000";"Urb. Carabobo Valencia Maracay, Venezuela";"Hoteles"
"RENACER HEALTH SPA CENTER";"";"Tel: (58) (244) 8088004";"Sector La Cava Colonia Tovar, Venezuela";"Hoteles"
"HOTEL LA CARRETA DEL TIGRE, C.A";"";"Tel: (58) (283) 2414848";"Calle 18 Norte El Tigre, Venezuela";"Hoteles"
"POSADA TURISTICA RESTAURANT TREBOL";"";"Tel: (58) (272) 2366078";"Final Av. Bolívar Trujillo, Venezuela";"Hoteles"
"HOTEL LA PENINSULA C.A";"";"Tel: (58) (212) 2465983";"Cl. Calatayud Doña Emilia Caracas, Venezuela";"Hoteles"
"APART HOTEL OJEDA SUITE";"";"Tel: (58) (212) 6317335";"Ciudad Ojeda Edo Zulia Caracas, Venezuela";"Hoteles"
"THE HOTEL CARACAS";"";"Tel: (58) (212) 9510268";"Cl. Mohedano El Rosal Zona Financiera Caracas Caracas, Venezuela";"Hoteles"
"HOTEL CORAL CARIBE";"";"Tel: (58) (295) 2490021";"Cl. Miragua, playa El Agua Puerto Fermín, Venezuela";"Hoteles"
"HOTEL PAVINBER CONTINENTAL";"";"Tel: (58) (243) 2140554";"Calle Ricaute Hotel Pavinber Maracay, Venezuela";"Hoteles"
"HOTEL CENTRAL PARK, C.A.";"";"Telefax: (58) (276) 3435880";"Calle 7 Con Carrera 4, Centro Frente A La Parada De Capacho San Cristóbal - Edo. Táchira San Cristóbal, Venezuela";"Hoteles"
"HOTEL EL DORADO SUITES";"";"Tel: (58) (281) 2769166";"Av. Principal Mesones Zona Industrial Mesones Barcelona Edo Anzoategui Barcelona, Venezuela";"Hoteles"
"HOTEL GALICIA";"";"Tel: (58) (238) 3343354";"c/c Pabellon y Palacios Altagracia de Orituco, Venezuela";"Hoteles"
"HOTEL VILLA DORADA. C.A";"";"Tel: (58) (283) 2358798";"Av.España El Tigre, Venezuela";"Hoteles"
"HOTEL MONTECARLO";"";"Tel: (58) (274) 2525981";"Av. Entre C. 24 y 25 Mérida, Venezuela";"Hoteles"
"DINASTIA HOTEL";"";"Tel: (58) (241) 8589974";"Av. Urdaneta Con Av. Cedeño Paralela Av. Bolivar Norte Valencia, Venezuela";"Hoteles"
"POSADA EL REMANSO, C.A";"";"Tel: (58) (276) 3420085";"Av. Ppal. De Pueblo Nuevo, No. P-70 Sector Las Pilas, San Cristobal - Ed. Táchira - Venezuela San Cristóbal, Venezuela";"Hoteles"
"HOTEL GUAIQUERI, C.A.";"";"Tel: (58) (293) 4310821";"Av Bermúdez, Cumaná Cumaná, Venezuela";"Hoteles"
"ANA HOTEL";"";"Tel: (58) (246) 4315134";"Av. Los Puentes San Juan de Los Morros, Venezuela";"Hoteles"
"CAMPAMENTO ECOLOGICO YA-KOO, C.A";"";"Tel: (58) (289) 9951742";"Via Sampai, Santa Helena D UariÉn Santa Elena de Uairén, Venezuela";"Hoteles"
"HOTEL NEPTUNO";"";"Tel: (58) (281) 2685413";"Av Paseo Colên Puerto de  la Cruz, Venezuela";"Hoteles"
"HOTEL TRANSMONTANO, C.A.";"";"Tel: (58) (285) 6329099";"Av Upata, Edif. Siracusa, Pb Ciudad Bolívar, Edo. Bolívar Ciudad Bolivar, Venezuela";"Hoteles"
"HOTEL SAN FRANCISCO";"";"Tel: (58) (294) 3313284";"Av Juncal, Nú 87, Carupano Carúpano, Venezuela";"Hoteles"
"HOTEL POSADA TURISTICA VIRGINIA";"";"Tel: (58) (295) 2612373";"Calle Fermin Porlamar, Venezuela";"Hoteles"
"HOTEL OVIEDO, C.A.";"";"Tel: (58) (274) 2632009";"Av. 3 Entre 34 Y 35, Sector Glorias Patrias Av. 3 Mérida, Venezuela";"Hoteles"
"GÉNESIS HOTEL TASCA RESTAURANT, C.A.";"";"Telefax: (58) (291) 6429789";"Carrera 3, Maturín Maturín, Venezuela";"Hoteles"
"HOTEL VALLE DE SANTIAGO, C.A.";"";"Tel: (58) (276) 3425090";"Santa Inés San Cristóbal, Venezuela";"Hoteles"
"HOTEL 2000";"";"Tel: (58) (251) 2320454";"Carrera 22 con Calle 30 Barquisimeto, Venezuela";"Hoteles"
"HOTEL EL TREBOL,C.A";"";"Tel: (58) (281) 2674133";"Av. Alberto Ravell,No 11 Cerca Del Paseo Colên 1/2 Cuadra Del Bingo Star Puerto de  la Cruz, Venezuela";"Hoteles"
"HOTELES GUARAPO";"";"Tel: (58) (241) 8605600";"Av. Universidad Valencia, Venezuela";"Hoteles"
"HOTEL LA VEGA";"";"Tel: (58) (246) 8712263";"Calabozo Calabozo , Venezuela";"Hoteles"
"HOTEL MORUCO";"";"Tel: (58) (274) 8988225";"Ct. Barinas Merida,Santo Domingo Santo Domíngo, Venezuela";"Hoteles"
"TRINITARIAS SUITES";"";"Tel: (58) (243) 2304000";"C.C Trinitarias Av.Los Leones frente al monumento al sol Barquisimeto Edo Lara Reservaciones Maracay, Venezuela";"Hoteles"
"HOTEL & SPA";"";"Tel: (58) (243) 4317174";"Urbanizacion Romulo Gallegos San Juan de los Morros Edo Guarico Maracay, Venezuela";"Hoteles"
"HOTEL NEO";"";"Tel: (58) (276) 3564020";"Av. Ferrero Tamayo, Pueblo Nuevo San Cristóbal, Venezuela";"Hoteles"
"HOTEL LOS CONQUISTADORES, C.A.";"";"Tel: (58) (274) 8720350";"Av. Carabobo - Mucuchies Mucuchies, Venezuela";"Hoteles"
"HOTEL CASA DEL SOL";"";"Tel: (58) (295) 8083102";"Av.A Manrique. Playa El Angel Pampatar, Venezuela";"Hoteles"
"EUROSUITE";"";"Telefax: (58) (261) 7982089";"Av. 9b, Tierra Negra Entre Calles 74 Y 75 Maracaibo, Venezuela";"Hoteles"
"HOTEL COSTA DE ORO C.A";"";"Tel: (58) (243) 9931957";"Playon OD Costa Ocumare de la Costa , Venezuela";"Hoteles"
"HOTEL YUMBO";"";"Tel: (58) (212) 7931063";"Av. Las Palmas Con Cl. Los Apamates La Florida Caracas, Venezuela";"Hoteles"
"HOTEL CRISTINA SUITES C.A";"";"Tel: (58) (281) 4187771";"Puerto La Cruz Av. Municipal Puerto de  la Cruz, Venezuela";"Hoteles"
"HOTEL YOLI";"";"Tel: (58) (286) 9741423";"Carrera 3 Ciudad Guayana Puerto Ordaz, Venezuela";"Hoteles"
"HOTEL EDUARS SUITES & RESORT";"";"Tel: (58) (212) 2116015";"Av. La Playa Con Cl. 1 Urbanizacion Alamo Macuto Estado Vargas Caracas, Venezuela";"Hoteles"
"INTERCONTINENTAL TACARIGUA VALENCIA";"";"Tel: (58) (243) 8133143";"Urb. La Viña Cl. Juan Uslar Valencia Maracay, Venezuela";"Hoteles"
"POSADA TURISTICA LOS NEVADOS";"";"Tel: (58) (274) 2527816";"Av. 3, Entre Calles 19 Y 20 Centro Mérida, Venezuela";"Hoteles"
"HOTEL ANGELES PALACE";"";"Tel: (58) (274) 2527465";"Entre Calle 30 Y 31 Avenida 4 Mérida, Venezuela";"Hoteles"
"HOTEL LA CUMBRE, C.A.";"";"Tel: (58) (285) 6327709";"Av 5 De Julio, Ciudad Bolívar, Edo. Bolívar Ciudad Bolivar, Venezuela";"Hoteles"
"HOTEL CECILMAR";"";"Tel: (58) (212) 3230809";"Boulevard De Higuerote Caracas, Venezuela";"Hoteles"
"HOTEL GRAN PALACE";"";"Tel: (58) (246) 4313617";"Av. Bolivar San Juan de Los Morros, Venezuela";"Hoteles"
"HOTEL PARQUE TURISTICO APARTADEROS";"";"Tel: (58) (274) 8880094";"Trasandina - Apartaderos Mérida, Venezuela";"Hoteles"
"HOTEL CONQUISTADOR";"";"Tel: (58) (251) 2328878";"Carrera 22,E/Cls. 25 y 26 Barquisimeto, Venezuela";"Hoteles"
"HOTEL EMPERADOR";"";"Tel: (58) (243) 8582433";"Av. Miranda No.113 Con 134 Al Lado del Country Club Maracay, Venezuela";"Hoteles"
"SUITES REFUGIO CRISTAL C.A.";"";"Tel: (58) (289) 9951844";"Avenida Mariscal Sucre Frente A Panamco Santa Elena De Uairén - Gran Sabana - Edo. Bolívar Santa Elena de Uairén, Venezuela";"Hoteles"
"HOTEL LUNGOMARE RESTAURANT";"";"Tel: (58) (212) 3230378";"Av. La Playa Caracas, Venezuela";"Hoteles"
"HOTEL RESTAURANT BAHIA DEL MAR";"";"Tel: (58) (212) 3515935";"Urb. Balneario Av. La Playa Catia La Mar Caracas, Venezuela";"Hoteles"
"HOTEL 2001";"";"Tel: (58) (212) 4615719";"Cl. Washington El Paraiso Caracas, Venezuela";"Hoteles"
"HOTEL LAS MERCEDES";"";"Tel: (58) (212) 5776898";"Av. Vollmer San Bernandino Caracas, Venezuela";"Hoteles"
"HOTEL JUMP'N JIBE";"";"Tel: (58) (295) 2638396";"Av.Ppal Del Yaque El Yaque, Venezuela";"Hoteles"
"HOTEL TURISTICO PARAMO DE CAPACHO, S.R.L.";"";"Tel: (58) (212) 5172666";"Cl. Capacho Rancherias Independencia Caracas, Venezuela";"Hoteles"
"HOTEL COUNTRY EXPRESS, C.A.";"";"Tel: (58) (271) 2316377";"Final Av. Bolívar, Sector El Country Valera, Venezuela";"Hoteles"
"POSADA NAUTICA C.A";"";"Tel: (58) (212) 7615076";"Edif. Veronica Piso 4 1era Bello Monte Caracas, Venezuela";"Hoteles"
"RENAISSANCE CARACAS LA CASTELLANA HOTEL";"";"Tel: (58) (212) 9084222";"Av Eugenio Mendoza con Calle Urdaneta, La Castellana Caracas, Venezuela";"Hoteles"
"JW MARRIOTT HOTEL CARACAS";"";"Tel: (58) (212) 9572222";"Avenida Venezuela con Calle Mohedano, El Rosal Caracas, Venezuela";"Hoteles"
"PUNTO PALMA HOTEL & MARINA";"";"Tel: (58) (212) 2800800";"Av. Peninsula 4 De Mayo Caracas, Venezuela";"Hoteles"
"HOTEL VILLA EL GRIEGO";"";"Tel: (58) (295) 2531507";"Nueva Esparta Juan Griego, Venezuela";"Hoteles"
"HOTEL RASIL";"";"Tel: (58) (281) 2623000";"Paseo Colón Puerto de  la Cruz, Venezuela";"Hoteles"
"HOTEL SUITE UCAIMA";"";"Tel: (58) (243) 8227011";"Urb.La Viña Av. Boyaca Valencia Edo Carabobo Maracay, Venezuela";"Hoteles"
"HOTEL DORAL";"";"Tel: (58) (261) 7978385";"Av. 14a, Tierra Negra Maracaibo, Venezuela";"Hoteles"
"APARTO POSADA DEL MAR";"";"Tel: (58) (259) 8120524";"Av Silva Tucacas , Venezuela";"Hoteles"
"HOSTAL CARAUVI C.A.";"";"Tel: (58) (275) 5550812";"Av Bolivar Santa Bárbara del Zulia, Venezuela";"Hoteles"
"HOTEL INCRET";"";"Tel: (58) (276) 3431794";"Av. Libertador - Sn Ctbal San Cristóbal, Venezuela";"Hoteles"
"HOTEL RESTAURANTE DE ITALIA";"";"Tel: (58) (246) 5290152";"CI Comercio Camatagua, Venezuela";"Hoteles"
"SAN CONO SUITES";"";"Tel: (58) (251) 6229211";"Av.30,esquina Calle 31,C.C. San Cono Acarigua,Edo. Portuguesa Barquisimeto, Venezuela";"Hoteles"
"LA POSADA DE MARIA LUISA";"";"Tel: (58) (243) 9931184";"CI Comercio Ocumare de la Costa , Venezuela";"Hoteles"
"HOTEL TAMPA";"";"Tel: (58) (212) 7623831";"Av. Francisco Solano López Sabana Grande Caracas, Venezuela";"Hoteles"
"HOSPEDAJE DOÑA ROSALIA";"";"Tel: (58) (212) 5414724";"Cerca Del Metro Teatro Nacional Santa Teresa Caracas, Venezuela";"Hoteles"
"RORAIMA INN";"";"Tel: (58) (251) 9238609";"Carrera la Paragua. Edif. Roraima Inn,Puerto Ordaz-Edo. Bolívar Barquisimeto, Venezuela";"Hoteles"
"HOTEL LA FLORESTA";"";"Tel: (58) (212) 2631955";"Estación De Metro Altamira Av. Avila Altamira Sur Caracas, Venezuela";"Hoteles"
"APART HOTEL FLORENCIA SUITE";"";"Tel: (58) (291) 6415078";"Cl Florida, Urb. Juanico, Maturín Maturín, Venezuela";"Hoteles"
"HOTEL BAHÍA";"";"Tel: (58) (244) 2451565";"Av. Bolívar , esquina calle Mariño Turmero, Venezuela";"Hoteles"
"POSADA KALAMAR";"";"Tel: (58) (251) 8186262";"Barquisimeto Barquisimeto, Venezuela";"Hoteles"
"HOTEL JARDIN";"";"Tel: (58) (276) 3435228";"Av. Libertador San Cristóbal, Venezuela";"Hoteles"
"HOTEL GUACAMAYA";"";"Tel: (58) (295) 2491763";"Manzanillo,Playa Agua Puerto Fermín, Venezuela";"Hoteles"
"HOTEL MASTRANTO SUITE C.A.";"";"Telefax: (58) (273) 5321876";"Av. Cuatricentenaria, Sector El Cambio Barinas, Edo. Barinas Barinas, Venezuela";"Hoteles"
"HOTEL CAMORUCO S.R.L";"";"Tel: (58) (241) 8596828";"Av. Bolivar Norte San Jose Valencia, Venezuela";"Hoteles"
"HOTEL BELLA VISAT";"";"Tel: (58) (255) 6652080";"Av Vencedores Araure, Venezuela";"Hoteles"
"HOTEL SENADOR";"";"Tel: (58) (281) 2673522";"Cl.Miranda Puerto de  la Cruz, Venezuela";"Hoteles"
"HOTEL RESTAURANT LA TABERNA";"";"Tel: (58) (275) 8811203";"Palacio De La Justicia El Vigía, Venezuela";"Hoteles"
"HOTEL TASCA RESTAURANT LOS LLANITOS DE TABAY";"";"Tel: (58) (274) 2830362";"Llanitos de Tabay Tabay, Venezuela";"Hoteles"
"DUNES (HOTEL & BEACH RESORT)";"";"Tel: (58) (295) 2500000";"Valle De Pedro González, Calle Campo Elías Sector El Pueblito, Playa Puerto Cruz, Isla De Margarita Isla Margarita , Venezuela";"Hoteles"
"HOTEL BOWLING";"";"Tel: (58) (282) 4245583";"Cl Democracia, Anaco Anaco, Venezuela";"Hoteles"
"HOTEL LA CASONA";"";"Tel: (58) (261) 7365784";"Diagonal A Residencias El Trebol Av. 58, Circunvalación II Maracaibo, Venezuela";"Hoteles"
"HESPERIA";"";"Tel: (58) (212) 9529221";"Av Tamanaco, Centro Empresarial El Rosal, Planta Baja Local 1, El Rosal - Caracas - Venezuela Caracas, Venezuela";"Hoteles"
"MARGARITA VILLAGE INTERNATIONAL RESORT";"";"Tel: (58) (295) 2631610";"Av. Bolivar De Porlamar A 3 min De La Playa Y El Centro De La Ciudad Y 25 min Del Aeropuerto Porlamar, Venezuela";"Hoteles"
"HOTEL YATO, C.A.";"";"Tel: (58) (291) 6413632";"Av Orinoco, Maturín Maturín, Venezuela";"Hoteles"
"HOTEL EL JEQUE";"";"Tel: (58) (243) 2353877";"Zona Industrial Piñoral Sur Calle Orinoco Maracay, Venezuela";"Hoteles"
"HOTEL AEROPUERTO C.A";"";"Tel: (58) (212) 7875881";"Cl. 100 Sabaneta Caracas, Venezuela";"Hoteles"
"ESTANCIA SAN FRANCISCO";"";"Tel: (58) (212) 4162000";"Cl. Via El Valle Alto Viento Caracas, Venezuela";"Hoteles"
"MANAGUA CARIBE";"";"Tel: (58) (212) 6335208";"Pque. Nac. Laguna De Tacarigua Machurucuto Edo. Miranda Caracas, Venezuela";"Hoteles"
"HOTEL LA VIÑETA";"";"Tel: (58) (244) 3226227";"Av.Rivas Davila Este La Victoria, Venezuela";"Hoteles"
"HOTEL SOL Y MAR";"";"Tel: (58) (293) 4512725";"Av Universidad Cumaná, Venezuela";"Hoteles"
"RORAIMA INN EXPRESS";"";"Tel: (58) (286) 9203709";"Carrera La Paragua, Edif. Roraima Inn, Puerto Ordaz - Edo. Bolívar Ciudad Guayana Puerto Ordaz, Venezuela";"Hoteles"
"POSADA CARIBANA";"";"Tel: (58) (212) 2659150";"Caracas Caracas, Venezuela";"Hoteles"
"HOTEL LIMÓN";"";"Tel: (58) (212) 5766178";"Av. Lecuna El Conde Caracas, Venezuela";"Hoteles"
"APARTOTEL LA LLOVIZNA S.A";"";"Telefax: (58) (212) 2675512";"Av. Municipal Caracas, Venezuela";"Hoteles"
"HOTELARIA ITALO VENEZOLANO, C.A.";"";"Tel: (58) (293) 4322581";"Cl Arismendi, Centro, Cumaná Cumaná, Venezuela";"Hoteles"
"HOTEL SUITE ISLA LARGA";"";"Tel: (58) (212) 3614416";"Cl. Miranda Caracas, Venezuela";"Hoteles"
"HOTEL EUROPA,S.R.L.";"";"Tel: (58) (281) 2688157";"Cl Sucre Puerto de  la Cruz, Venezuela";"Hoteles"
"HOTEL CUMANÁ BAHIAZUL C.A.";"";"Tel: (58) (293) 4160152";"Av Perimetral, Diagonal A La Diex, Cumaná Cumaná, Venezuela";"Hoteles"
"HOTEL MONTE MAR C.A";"";"Tel: (58) (212) 9931173";"Cl. Vargas El Playon Caracas, Venezuela";"Hoteles"
"HOTEL GRAN GUARICO";"";"Tel: (58) (246) 8719980";"Cr 12 Centro Calabozo , Venezuela";"Hoteles"
"HOTEL EL OESTE";"";"Tel: (58) (212) 4826585";"Av. Sn Martín San Juan Caracas, Venezuela";"Hoteles"
"HOTEL BEETHOVEN";"";"Tel: (58) (265) 6317335";"Av. Bolívar, Casco Central Ciudad Ojeda, Venezuela";"Hoteles"
"LA POSADA DE ROJAS";"";"Tel: (58) (276) 3471496";"Cl. Libertad, Táchira Urb. Táchira San Cristóbal, Venezuela";"Hoteles"
"POSADA TROPICANA";"";"Telefax: (58) (212) 2211193";"Los Roques Caracas, Venezuela";"Hoteles"
"HOTEL MIRAFLORES";"";"Tel: (58) (255) 6227949";"Prolongación Acarigua, Venezuela";"Hoteles"
"HOTEL DON LUIS";"";"Tel: (58) (271) 2253561";"Avenida 14 Valera, Venezuela";"Hoteles"
"HOTEL INTERNACIONAL, C.A.";"";"Tel: (58) (282) 4222508";"Av Miranda, Anaco Anaco, Venezuela";"Hoteles"
"HOTEL Y APARTAHOTEL BELLA BONITA";"";"Tel: (58) (281) 4411677";"El Tejar-Pto Piritu Piritu, Venezuela";"Hoteles"
"POSADA TURISTICA VILLA CARIÑO C.A";"";"Tel: (58) (241) 5361545";"Calle Sucre #80 Gañango-Carabobo Valencia, Venezuela";"Hoteles"
"HOTEL GARDENIA";"";"Tel: (58) (261) 7236235";"Avenida 17, Al Fondo De La Estación De Servicio En Tránsito Maracaibo, Venezuela";"Hoteles"
"HOTEL MARSELLA, C.A.";"";"Tel: (58) (281) 2688401";"Cr. libertad, centro Puerto de  la Cruz, Venezuela";"Hoteles"
"CASA LUTECIA,C.A.";"";"Tel: (58) (295) 2638526";"Cl.Campestre/Cedeño y M. Porlamar, Venezuela";"Hoteles"
"HOTEL EDI C.A";"";"Tel: (58) (285) 6544034";"Negro Primero, Ciudad Bolívar Ciudad Bolivar, Venezuela";"Hoteles"
"POSADA RESTAURANT SERRANÍA";"";"Tel: (58) (295) 2423864";"Vía La Asunción El Valle La Asunción, Venezuela";"Hoteles"
"LA POSADA DE TERESA";"";"Tel: (58) (212) 3957801";"Av. Parque Nacional El Avila Galipán Caracas, Venezuela";"Hoteles"
"FLAMENCO HOTEL VILLAS";"";"Tel: (58) (212) 2491363";"Av. Fco. De Miranda Chacao Caracas, Venezuela";"Hoteles"
"POSADA LAS PITUFAS";"";"Tel: (58) (212) 3381035";"Cl. Principal Los Corrales Quinta Las Pitufas Caracas, Venezuela";"Hoteles"
"HOTEL LIBERTADOR C.A";"";"Tel: (58) (285) 6545378";"Av. Libertador Ciudad Bolivar, Venezuela";"Hoteles"
"HOTEL PAOCA C.A";"";"Tel: (58) (212) 6540871";"Cl. Urbina Negro Primero Caracas, Venezuela";"Hoteles"
"HOTEL CANAIMA & SUITES";"";"Tel: (58) (282) 4243855";"Av Aeropuerto, Anaco Anaco, Venezuela";"Hoteles"
"HOTEL LUNA MAR S.R.L";"";"Tel: (58) (212) 3511314";"Av. Club Nautico Con Final Av. Atlantida Catia La Mar Caracas, Venezuela";"Hoteles"
"L'AQUILA SUITE APARTA HOTEL, C.A.";"";"Tel: (58) (291) 6419669";"Av Alirio Ugarte Pelayo, Tipuro, Maturín Maturín, Venezuela";"Hoteles"
"HOTEL TRINACRIA C.A";"";"Tel: (58) (247) 3423578";"Av. Miranda San Fernando de Apure, Venezuela";"Hoteles"
"HOTEL CORO";"";"Tel: (58) (268) 2510387";"Av. Independencia Coro, Venezuela";"Hoteles"
"HOTEL MANOLO, C.A.";"";"Tel: (58) (291) 6413341";"Av Bicentenario, Centro, Maturin Maturín, Venezuela";"Hoteles"
"HOTEL MRBELLA";"";"Tel: (58) (242) 3720811";"CI.Ayacucho Moron Morón, Venezuela";"Hoteles"
"HOTEL AMERICAN CITY, C.A.";"";"Tel: (58) (291) 6517689";"Av Bella Vista, Maturin Maturín, Venezuela";"Hoteles"
"HOTEL RESTAURANT ZULIA, S.R.L.";"";"Tel: (58) (212) 7722541";"Nueva Bolivía - Caja Seca Caracas, Venezuela";"Hoteles"
"HOTEL RESTAURANT MARISCO,C.A.";"";"Tel: (58) (261) 7914646";"Calle 82 Con Av. 3 H San Martín Maracaibo, Venezuela";"Hoteles"
"POSADA EL LIMON";"";"Tel: (58) (243) 2834925";"El Limon Maracay, Venezuela";"Hoteles"
"APARTAHOTEL PUERTO PLAYA SUITES";"";"Tel: (58) (281) 2819807";"Lecheria,Edo.Anzoategui A 500 Metros de la Playa Calle Anzoategui Cruce Lecherías, Venezuela";"Hoteles"
"HOTEL BIENESTAR C.A";"";"Tel: (58) (243) 3417038";"Calle Retumbo Norte No 13 Maracay, Venezuela";"Hoteles"
"HOLTEL COSTA LINDA";"";"Tel: (58) (242) 3649668";"Av. La Paz Puerto Cabello, Venezuela";"Hoteles"
"HOTEL ESPAÑOL";"";"Tel: (58) (274) 2529235";"A 5 Cuadras De La Plaza B, C/C 15 Y 16 Av. 2 Lora, Fray J Ramos De Lora Mérida, Venezuela";"Hoteles"
"HOTEL GRAN PALACE ANACO, C.A.";"";"Tel: (58) (282) 4255701";"Av Libertador, Fte. Al Boulevard Venezuela, Anaco - Edo. Anzoátegui Anaco, Venezuela";"Hoteles"
"HOTEL CARDON";"";"Tel: (58) (269) 2483311";"Punto Fijo (Estado Falcón) Zona Libre De Paraguaná Punta Cardón, Venezuela";"Hoteles"
"RIVIERAS DEL GUARAPICHE SUITE";"";"Telefax: (58) (291) 6426716";"Av Rojas, Maturín Maturín, Venezuela";"Hoteles"
"HOTEL FARO II";"";"Tel: (58) (238) 3413852";"Av. Libertador -VD Pascua Santa Maria de Ipire, Venezuela";"Hoteles"
"POSADA PASEO LA CHIRIRI";"";"Tel: (58) (277) 2910157";"San Pedro Del Río Colón, Venezuela";"Hoteles"
"HOTEL CORONA,S.R.L.";"";"Tel: (58) (251) 2327543";"Cl. 30, E/Cl 23 y 24 Barquisimeto, Venezuela";"Hoteles"
"POSAD LA CAPILLA";"";"Tel: (58) (243) 9931393";"CI.La Capilla El Playon Ocumare de la Costa , Venezuela";"Hoteles"
"PARADOR TURISTICO II PREZZANO";"";"Tel: (58) (212) 3512626";"Av. Ppal. De Playa Grande Catia La Mar Edo Vargas Caracas, Venezuela";"Hoteles"
"HOTEL MARAINN";"";"Tel: (58) (286) 9530111";"Zona Industrial Unare II, Calle Neverí Frente Al Aeropuerto De Puerto Ordaz Ciudad Guayana - Estado Bolívar, Venezuela Ciudad Guayana Puerto Ordaz, Venezuela";"Hoteles"
