"INVERSIONES MAQUINTEX 271 C.A";"";"Tel: (58) (212) 5638844";"Av Urdaneta Altagracia Caracas, Venezuela";"Máquinas De Coser"
"MAQUICOSTURA BARQUISIMETO C.A";"";"Tel: (58) (251) 2312779";"Cr 17 E/ Cl 20 Y 21, Barquisimeto Barquisimeto, Venezuela";"Máquinas De Coser"
"COMERCIAL TALLER MACOSER, C.A.";"";"Tel: (58) (243) 2336665";"Av. 10 De Diciembre Maracay, Venezuela";"Máquinas De Coser"
"DISTRIBUIDORA JADE R C.A";"";"Tel: (58) (212) 5646979";"Esq Manduca A Puente Yanes Edif Manduca PB Loc 3, La Candelaria Caracas Caracas, Venezuela";"Máquinas De Coser"
"COMERCIAL OLIVO C.A";"";"Tel: (58) (212) 6324514";"Av Nva Granada Los Rosales Caracas, Venezuela";"Máquinas De Coser"
"REPRESENTACIONES MARBAL";"";"Tel: (58) (274) 2521728";"El Llano Mérida, Venezuela";"Máquinas De Coser"
"MEREX C.A";"";"Tel: (58) (212) 5728411";"Av Fuerzas Armadas La Candelaria Caracas, Venezuela";"Máquinas De Coser"
"IMPORTADORA MAQUINAS DE REYXIMAR MILENIUM C.A";"";"Tel: (58) (212) 4836162";"Av San Martin Caracas, Venezuela";"Máquinas De Coser"
"MAKERS C.A";"";"Tel: (58) (212) 5619347";"Socorras A Puente Yanes Edif Doral Loc A p.b. La Candelaria Caracas Caracas, Venezuela";"Máquinas De Coser"
"RUSSO SEWING CENTER, S.A";"";"Tel: (58) (261) 7417115";"Av. 15 Las Delicias Maracaibo, Venezuela";"Máquinas De Coser"
"GRUPO TAGUAPIRE";"";"Tel: (58) (286) 9236548";"Av.Ciudad Bolivar San Felix Ciudad Guayana Puerto Ordaz, Venezuela";"Máquinas De Coser"
"LA MAQUINA";"";"Tel: (58) (241) 8317633";"Cantaura, La Candelaria Valencia, Venezuela";"Máquinas De Coser"
"MARQEUTERIA RIGO C.A";"";"Tel: (58) (212) 7635003";"Av Libertador El Bosque Caracas, Venezuela";"Marcos"
"GALERIA Y MARQUETERIA BAHIA,C.A.";"";"Tel: (58) (281) 2672634";"Av Esperanza Nro.93 Puerto de  la Cruz, Venezuela";"Marcos"
"DISTRIBUIDORA DARIO S.R.L.";"";"Tel: (58) (212) 6313203";"Av L Castaños El Cementerio Caracas, Venezuela";"Marcos"
"VENPESCA ASOCIADOS,C.A.";"";"Tel: (58) (242) 3643335";"Av Salom, La Sorpresa Puerto Cabello, Venezuela";"Mariscos Y Pescados"
"PESCADERIA LA ESTRELLA, C.A.";"";"Tel: (58) (243) 5544156";"Av. Bolivar Oeste Maracay, Venezuela";"Mariscos Y Pescados"
"AIRCA";"";"Tel: (58) (269) 2467833";"Calle Comercio, N³ 35, Sector Nuevo Pueblo, Edif Venequip, P.B. Punto Fij o, Edo. Falcón Punto Fijo, Venezuela";"Mariscos Y Pescados"
"FLEXOVEN C.A.";"";"Tel: (58) (241) 8347535";"Valencia Valencia, Venezuela";"Materiales Para Empaques"
"UNIFORMES Y SEGURIDAD UNILORD, C.A.";"";"Tel: (58) (286) 9231525";"Puerto Ordaz Ciudad Guayana Puerto Ordaz, Venezuela";"Materiales Y Suministros Para Confecciones"
"INVERSIONES TAMMY, C.A.";"";"Tel: (58) (212) 2560514";"Av. Milan, Los Ruices Sur Caracas, Venezuela";"Materiales Y Suministros Para Confecciones"
"PONY UNIFORMES C.A.";"";"Tel: (58) (212) 4811249";"Esq. Miracielos, Santa Teresa Caracas, Venezuela";"Materiales Y Suministros Para Confecciones"
"ESTRATEGIA TOPS INTERNACIONAL C.A.";"";"Tel: (58) (295) 2641625";"Av 4 de MAyo, CC Shoopping Plaza, Lc 2 Pb - Oficina - Tienda Porlamar, Venezuela";"Materiales Y Suministros Para Confecciones"
"CICRECA";"";"Tel: (58) (212) 5611264";"Altagracia Caracas, Venezuela";"Materiales Y Suministros Para Confecciones"
"PLATERÍA JESÚS Y MARIA";"";"Tel: (58) (212) 9796956";"Caracas Caracas, Venezuela";"Materiales Y Suministros Para Confecciones"
"UNIFORMES CARIBE INTEX, C.A.";"";"Tel: (58) (295) 2644279";"Av. Terranova con Calle El Colegio, Centro Aldrizz, Mezzanina C, Porlamar Porlamar, Venezuela";"Materiales Y Suministros Para Confecciones"
"ELE BORDADO AK, C.A.";"";"Tel: (58) (212) 9754692";"C.C. Santa Fe Caracas, Venezuela";"Materiales Y Suministros Para Confecciones"
"CAP'S SHOP C.A.";"";"Tel: (58) (295) 2530213";"Cl El fuerte, Juan Griego Juan Griego, Venezuela";"Materiales Y Suministros Para Confecciones"
"CANNING C.A.";"";"Tel: (58) (212) 4316075";"Ruiz Pineda Caracas, Venezuela";"Materiales Y Suministros Para Confecciones"
"REPRESENTACIONES REISMAR, C.A.";"";"Tel: (58) (286) 9235365";"Villa Colombia-Pto Ordaz Ciudad Guayana Puerto Ordaz, Venezuela";"Materiales Y Suministros Para Confecciones"
"DISTRIBUIDORA FOTON 2000 S.R.L";"";"Tel: (58) (212) 2660094";"Altamira, Caracas Caracas, Venezuela";"Materiales Y Suministros Para Confecciones"
"INVERSIONES BORDAIMAGEN C.A.";"";"Tel: (58) (212) 7941441";"Av. Ppal. de Maripérez Caracas, Venezuela";"Materiales Y Suministros Para Confecciones"
"DISTRIBUIDORA DECONAMAR, C.A.";"";"Tel: (58) (212) 5632157";"Esq. Pza España, Catedral Caracas, Venezuela";"Materiales Y Suministros Para Confecciones"
"CONFECCIONES MILLENIUM";"";"Tel: (58) (286) 9231610";"Cc. El Trébol Iii Ps.1 Lc.97 Ciudad Guayana Puerto Ordaz, Venezuela";"Materiales Y Suministros Para Confecciones"
"M & A IMAGEN PUBLICITARIA, C.A.";"";"Tel: (58) (243) 5533380";"Av Bolívar Oeste Maracay, Venezuela";"Materiales Y Suministros Para Confecciones"
"BORDADOS Y CHEMISES, C.A.";"";"Tel: (58) (244) 3957449";"Calle Rondon Nte. Cagua, Venezuela";"Materiales Y Suministros Para Confecciones"
"DOSSIER PRENSA Y PUBLICIDAD";"";"Tel: (58) (281) 2818592";"Av Principal, C.C. Timonel Lecherías, Venezuela";"Materiales Y Suministros Para Confecciones"
"METALICAS HEBIADORNOS C.A";"";"Tel: (58) (212) 5423865";"Santa Rosalia Caracas, Venezuela";"Materiales Y Suministros Para Confecciones"
"JET CIERRES VENEZOLANOS C.A JETCIVEN";"";"Tel: (58) (212) 2511970";"Palo Verde Caracas, Venezuela";"Materiales Y Suministros Para Confecciones"
"INVERSIONES SER-WI, C.A.";"";"Tel: (58) (212) 4439846";"Av. Rotaria, El Paraíso Caracas, Venezuela";"Materiales Y Suministros Para Confecciones"
"P O P PROJECTS ORIENTE S.A.";"";"Tel: (58) (281) 2675166";"Ed Centicela P.B., Calle Eulalia buroz Puerto de  la Cruz, Venezuela";"Materiales Y Suministros Para Confecciones"
"INDUBORCA";"";"Tel: (58) (261) 7171191";"Calle 61 Av.(Universidad)entre Avs.10 y 12, No.11-39, Maracaibo-Zulia Maracaibo, Venezuela";"Materiales Y Suministros Para Confecciones"
"H A BORDADOS C.A.";"";"Tel: (58) (241) 8578501";"Av. Miranda Valencia, Venezuela";"Materiales Y Suministros Para Confecciones"
"SUCESORA SAN JUAN C.A";"";"Tel: (58) (246) 4312346";"Zona Industrial San Juan de Los Morros, Venezuela";"Materiales Y Suministros Para Confecciones"
"INVERSIONES LATUR, C.A.";"";"Tel: (58) (245) 5640595";"Av. Arévalo González Guacará, Venezuela";"Materiales Y Suministros Para Confecciones"
"COPROMANE";"";"Tel: (58) (295) 2646349";"Cl.Marcano E/S Raf. y Día, 50 Mtrs antes de la Clínica Chico Sanabria Porlamar, Venezuela";"Materiales Y Suministros Para Confecciones"
"CONFECCIONES BRIGIDA, S.R.L.";"";"Tel: (58) (212) 5755116";"Av. Este, Cervecería A Paradero, Edif. Libertador P.B, La Candelaria Caracas, Venezuela";"Materiales Y Suministros Para Confecciones"
"ART BORDADOS, C.A.";"";"Tel: (58) (212) 9415202";"Av. San Sebástian Edif. Scorpio P.B., Baruta Caracas, Venezuela";"Materiales Y Suministros Para Confecciones"
"SUMITEX, C.A.";"";"Tel: (58) (276) 7715829";"Vía Aeropuerto, Sector Garrochal, Edif. Kamon Loc.B2-284, San Antonio San Antonio del Táchira, Venezuela";"Materiales Y Suministros Para Confecciones"
"CREACIONES MOLLET, C.A.";"";"Tel: (58) (212) 5768921";"Alcabala A Peligro, Torre Alcalaba Local No. 03, P.B. La Candelaria Caracas, Venezuela";"Materiales Y Suministros Para Confecciones"
"CONFECCIONES PRISO C.A";"";"Tel: (58) (212) 5418033";"Salvador De León A Coliseo Edif. Almacenes Del Centro 2 Piso Local Este Caracas, Venezuela";"Materiales Y Suministros Para Confecciones"
"REPRESENTACIONES MQG, S.R.L.";"";"Tel: (58) (212) 3311319";"Nueva Sorocaima, Maiquetía Caracas, Venezuela";"Materiales Y Suministros Para Confecciones"
"PRINTABORDADOS, C.A.";"";"Tel: (58) (212) 7312906";"La Florida - Caracas Caracas, Venezuela";"Materiales Y Suministros Para Confecciones"
"PUBLILAR, C.A.";"";"Tel: (58) (261) 7911327";"Entre Don Bosco Y La Lago Maracaibo, Venezuela";"Materiales Y Suministros Para Confecciones"
"FULTON ZIPP";"";"Tel: (58) (212) 4723132";"La Yaguara Caracas, Venezuela";"Materiales Y Suministros Para Confecciones"
"REPRESENTACIONES CARLI2005 C.A";"";"Tel: (58) (212) 8613546";"La Pastora Caracas, Venezuela";"Materiales Y Suministros Para Confecciones"
"DANY TEXTIL C.A.";"";"Tel: (58) (212) 3610832";"Av La Guairita Edif Aro Zona Industrial El Recreo Guarenas, Venezuela";"Materiales Y Suministros Para Confecciones"
"F B DISEÑOS C.A";"";"Tel: (58) (212) 2390560";"Boleíta Sur Caracas, Venezuela";"Materiales Y Suministros Para Confecciones"
"DISEÑOS JUVI";"";"Tel: (58) (212) 4518585";"Av. Principal De Las Fuentes Qta. Hilda El Paraíso Caracas Caracas, Venezuela";"Materiales Y Suministros Para Confecciones"
"INDUSTRIAS TEXTILES HAI, C.A.";"";"Tel: (58) (212) 5774734";"Av. Andres Bello Guaicaipuro Caracas, Venezuela";"Materiales Y Suministros Para Confecciones"
"BORDADOS CDC 2909 C.A.";"";"Tel: (58) (212) 5766397";"Esq. De Perico A San Lazaro, Edif. No. 21 Centro Seguro La Metropolitana, Torre E,P.2 Caracas, Venezuela";"Materiales Y Suministros Para Confecciones"
"ADRIL 655, C.A.";"";"Tel: (58) (212) 2372484";"Urbanización El Marqués Caracas, Venezuela";"Materiales Y Suministros Para Confecciones"
"DISTRIBUIDORA UNIVEPP XXI, C.A.";"";"Telefax: (58) (212) 6312571";"Los Samanes, Prado de María Caracas, Venezuela";"Materiales Y Suministros Para Confecciones"
"FABRICA DE CINTAS SEIDL S.R.L";"";"Tel: (58) (212) 7817850";"6ta Transversal Maripérez Estacionamiento Caribe Caracas, Venezuela";"Materiales Y Suministros Para Confecciones"
"FANAGRA C.A";"";"Tel: (58) (212) 2371944";"Avenida San Francisco de Miranda Edif Seguros La Paz Piso 5 0fic.0-55 Caracas, Venezuela";"Materiales Y Suministros Para Confecciones"
"PROINFAN";"";"Tel: (58) (212) 5639204";"Esq. Ibarras A Esq. Las Madrices Edif. Yard, Piso 1 Caracas, Venezuela";"Materiales Y Suministros Para Confecciones"
"MULTICOLOR BORDADOS, C.A.";"";"Tel: (58) (212) 2352065";"La Carlota Caracas, Venezuela";"Materiales Y Suministros Para Confecciones"
"INVERSIONES TU MUNDO BORDADO, C.A.";"";"Tel: (58) (212) 2376705";"Est. Del Metro Los Dos Caminos Caracas, Venezuela";"Materiales Y Suministros Para Confecciones"
"CONIDICA";"";"Tel: (58) (212) 5638177";"Abanico a Canónigos, Edif. Centro Importador Local 1 Altagracia, Caracas Caracas, Venezuela";"Materiales Y Suministros Para Confecciones"
"REPRESENTACIONES CADAMI C.A.";"";"Tel: (58) (286) 9615710";"Cl Vietnam Villa Asia Ciudad Guayana Puerto Ordaz, Venezuela";"Materiales Y Suministros Para Confecciones"
"PARCHES AND GORRAS, C.A.";"";"Tel: (58) (212) 9538081";"Centro Lido, El Rosal Caracas, Venezuela";"Materiales Y Suministros Para Confecciones"
"UNIMEDIA";"";"Tel: (58) (241) 8250421";"C.C. Viñedo Plaza Valencia, Venezuela";"Materiales Y Suministros Para Confecciones"
"CREACIONES NORITEX";"";"Tel: (58) (212) 5648972";"Calero A Chimborazo. Edif. José Heriberto. Mzz. 2 La candelaria Norte Caracas, Venezuela";"Materiales Y Suministros Para Confecciones"
"VELECECA, C.A.";"";"Tel: (58) (261) 7180302";"Av. 8 Loc. 69-78, Urb. Santa Rita Maracaibo, Venezuela";"Materiales Y Suministros Para Confecciones"
"TECNOBORDADOS INDUSTRIALES, C.A.";"";"Tel: (58) (241) 8717164";"Tzas de Castillito Valencia, Venezuela";"Materiales Y Suministros Para Confecciones"
"BORDADOS TECNO EXCLUSIVA";"";"Tel: (58) (212) 2373989";"Av. Rómulo Gallegos, Boleíta Caracas, Venezuela";"Materiales Y Suministros Para Confecciones"
"VINILO FLEX C.A.";"";"Tel: (58) (295) 2687710";"Av. Municipal, Locales Comerciales No.3 Y 4 Edf. Residencial Doña Rosalina Porlamar, Venezuela";"Materias Primas Para Publicidad"
"MEDICAS BOLIVAR";"rosalcc@yahoo.es";"Cel.: (58) 3118106275";"Atiende en Colon desde su sede principal en Pasto Colón, Venezuela";"Medicina Biológica"
"OPTICLÍNICA";"";"Tel: (58) (276) 3490428";"Avenida 19 de Abril San Cristóbal, Venezuela";"Medicina General"
"ERICH TRUCHSESS";"";"Tel: (58) (261) 7525018";"Calle 72, con Av. 22 C.C. Tamacuari Sector Paraíso Maracaibo, Venezuela";"Medicina General"
"HAMMOND F, PHOEBE";"";"Tel: (58) (251) 2543666";"Av. Lara Barquisimeto, Venezuela";"Medicina General"
"CENTRO ODONTOLÓGICO SAN JACINTO";"";"Tel: (58) (261) 7574010";"San Jacinto, Sector 9 Maracaibo, Venezuela";"Medicina General"
"SÁNCHEZ J., RAÚL L. DR.";"";"Tel: (58) (276) 3568905";"Cr. 21, Barrio Obrero San Cristóbal, Venezuela";"Medicina General"
"OPTICA ALILENTE";"";"Tel: (58) (274) 2523512";"Calle 20, Entre Av. 4 y 5 Centro Mérida, Venezuela";"Medicina General"
"UNIDAD DE UROLOGÍA";"";"Telefax: (58) (274) 3462167";"Policlínica Tachira Mérida, Venezuela";"Medicina General"
"JIMENEZ J., ILDEMARO DR.";"";"Tel: (58) (261) 7985939";"Las Delicias-Maracaibo Maracaibo, Venezuela";"Medicina General"
"CHACÓN, MARITZA DRA.";"";"Tel: (58) (276) 3476937";"Urb. Las Acacias C.C. El Pinar San Cristóbal, Venezuela";"Medicina General"
"OCANDO R, HUGO A.";"";"Tel: (58) (261) 7541482";"Calle 75, Nro 65 - 119 Los Olivos Maracaibo, Venezuela";"Medicina General"
"ODONTOESTETICA";"";"Tel: (58) (276) 5161228";"San Cristobal San Cristóbal, Venezuela";"Medicina General"
"REY, SONIA DRA.";"";"Tel: (58) (276) 3441486";"Cl. 15, Pasaje Cunamá San Cristóbal, Venezuela";"Medicina General"
"ASISTENCIA ODONTOLÓGICA INTEGRAL DR. EDGARDO LÓPEZ";"";"Tel: (58) (261) 7412832";"Av. 2, Entre Cll H y H1 Maracaibo, Venezuela";"Medicina General"
"CENTRO OPTICO JOHNEN, C.A.";"";"Tel: (58) (274) 2527551";"Avenida 5, Calle 18 Mérida, Venezuela";"Medicina General"
"VARGAS S.,FRANCISCO A. DR.";"";"Tel: (58) (276) 3447930";"7ma Avenida con Calle 4 San Cristóbal, Venezuela";"Medicina General"
"RODRIGUEZ, ALI";"";"Tel: (58) (274) 2446029";"El Llanito Mérida, Venezuela";"Medicina General"
"MOLINA C, JAIRO";"";"Tel: (58) (276) 3422266";"Centro San Cristóbal, Venezuela";"Medicina General"
"LABORATORIO ÓPTICO LASER C.A.";"";"Tel: (58) (276) 3567130";"Cl. 11 e/cras. 20 y 21, Barrio Obrero San Cristóbal, Venezuela";"Medicina General"
"BRITO, MIGUEL DR.";"";"Tel: (58) (261) 7629178";"Av. 17 Baralt, Maracaibo Maracaibo, Venezuela";"Medicina General"
"CONTRERAS O. ANDREINA. DRA.";"";"Tel: (58) (276) 3949700";"C.C. Dr. José Gregorio Herna Cl. 8 Tariba, Venezuela";"Medicina General"
"MATOS SJ., LUIS H. DR.";"";"Tel: (58) (261) 7900000";"Hospital Coromoto Maracaibo, Venezuela";"Medicina General"
"MARIN, LUZ M. DRA.";"";"Tel: (58) (276) 3553192";"Cl. 13, Barrio Obrero San Cristóbal, Venezuela";"Medicina General"
"D'ONGHIA C., AGUSTIN DR.";"";"Tel: (58) (251) 4424330";"Entre Calles 55 Y 56 Carrera 21 Barquisimeto, Venezuela";"Medicina General"
"CENTRO MEDICO RUBIO CA";"";"Tel: (58) (276) 7622459";"Frente Al Parque Recreacion Calle 10 La Victoria Rubio, Venezuela";"Medicina General"
"PRADOS, JOSÉ G. DR.";"";"Tel: (58) (276) 3567210";"Cr. 21, Barrio Obrero San Cristóbal, Venezuela";"Medicina General"
"NUCETTE M, LUISA";"";"Tel: (58) (261) 7437730";"Av Fuerzas Armadas Maracaibo, Venezuela";"Medicina General"
"ROJAS, OMAR DR.";"";"Tel: (58) (261) 7984275";"Centro Médico de Occidente Maracaibo, Venezuela";"Medicina General"
"MOGOLLÓN D., ANA";"";"Tel: (58) (276) 3476810";"Av. Occidental, Mérida San Cristóbal, Venezuela";"Medicina General"
"ROMERO A., SANDRA V.";"";"Tel: (58) (276) 3429865";"Av. Las Pilas Santa Inés San Cristóbal, Venezuela";"Medicina General"
"LEÓN C. NEIL DR.";"";"Tel: (58) (261) 7915827";"Hospital Coromoto Maracaibo, Venezuela";"Medicina General"
"JIMENO J., MARIO DR.";"";"Tel: (58) (261) 7973483";"Clinica Juan B. Jimenez Maracaibo, Venezuela";"Medicina General"
"PATERNINA,INGRID DRA.";"";"Tel: (58) (261) 7629260";"Av. 17 Baralt, Maracaibo Maracaibo, Venezuela";"Medicina General"
"BOUCHAL, HACHEMI DR.";"";"Tel: (58) (261) 7928885";"Policlínica Amado Maracaibo, Venezuela";"Medicina General"
"RIOS, MARCO DR.";"";"Tel: (58) (261) 7629036";"Av. 17 Baralt, Maracaibo Maracaibo, Venezuela";"Medicina General"
"ALVARADO D., RÓMULO DR.";"";"Tel: (58) (274) 2635847";"Av. Urdaneta Mérida, Venezuela";"Medicina General"
"DRA. GLADYS CASTELLANOS";"";"Tel: (58) (276) 3569505";"Cl. 12, Barrio Obrero San Cristóbal, Venezuela";"Medicina General"
"GONZÁLEZ A., ERIC";"";"Tel: (58) (261) 7982778";"Av. 15, Delicias Villalobo Maracaibo, Venezuela";"Medicina General"
"MENDOZA A., JESÚS M.";"";"Tel: (58) (276) 3413986";"Av. Libertador Clínica El Saman San Cristóbal, Venezuela";"Medicina General"
"ÓPTICA TIMBERG";"";"Tel: (58) (261) 7927061";"Esquina Av. 4, C.C. América, Bella Vista, 5 de Julio Maracaibo, Venezuela";"Medicina General"
"BIOMEDICAL CARE SUPPLY. C.A.";"";"Tel: (58) (281) 6961225";"Av. Santiago Mariño, cerca del Hotel Bella Vista, sector Tachira, Edif. Blue Sky, Mezanina 1, Local No.6 Barcelona, Venezuela";"Medicina General"
"CLÍNICA MÉDICO ODONTOLÓGICA DONAIRE";"";"Tel: (58) (261) 7517251";"La Limpia Maracaibo, Venezuela";"Medicina General"
"VARGAS, MAGALY DRA.";"";"Tel: (58) (261) 7212422";"Cjón. Santa Elena Maracaibo, Venezuela";"Medicina General"
"UNIDAD OFTALMOLÓGICA COHEN CURTOIS";"";"Tel: (58) (261) 7432441";"Av. Universidad Pueblo Nuevo Maracaibo, Venezuela";"Medicina General"
"ESPECIALIDADES ODONTOLÓGICAS";"";"Tel: (58) (274) 2667060";"Av. Las Américas Mérida, Venezuela";"Medicina General"
"UNIDAD ODONTOLÓGICA POR ESPECIALIDADES, C.A.";"";"Tel: (58) (261) 7976245";"Clínica Falcon Maracaibo, Venezuela";"Medicina General"
"ÓPTICA CENTRO DE LA VISIÓN, C.A.";"";"Tel: (58) (261) 7973805";"Santa Rita, Maracaibo Maracaibo, Venezuela";"Medicina General"
"VISION 20/20";"";"Tel: (58) (261) 7972293";"Frente A Paseo 72 Las Delicias - Maracaibo Maracaibo, Venezuela";"Medicina General"
"LAGOPIE";"";"Tel: (58) (261) 7987343";"Av. 5 de Julio Maracaibo, Venezuela";"Medicina General"
"MORLES C, VALMORE A";"";"Tel: (58) (251) 2540720";"Del Este - Bqto Barquisimeto, Venezuela";"Medicina General"
"CLÍNICA ODONTOLÓGICA DR. HUMBERTO GONZÁLEZ RINCÓN";"";"Tel: (58) (261) 7977961";"Calle 70 Maracaibo, Venezuela";"Medicina General"
"CHÁVEZ, FERNANDO";"";"Tel: (58) (261) 7975131";"Dr. Portillo Maracaibo, Venezuela";"Medicina General"
"VISTA GLASS, S.R.L.";"";"Tel: (58) (261) 7988105";"Av. 8, Santa Rita Maracaibo, Venezuela";"Medicina General"
"OPTICA YIREH, C.A.";"";"Tel: (58) (274) 2524956";"Av. 5 Esquina Calle 23 Mérida, Venezuela";"Medicina General"
"VALERO, CARMEN J. DE DRA.";"";"Tel: (58) (261) 7984145";"Clinica Falcon Maracaibo, Venezuela";"Medicina General"
"CENTRO MÉDICO OFTALMOLÓGICO DRA. ELENA PARADA";"";"Tel: (58) (274) 2448364";"Av. Las Américas Mérida, Venezuela";"Medicina General"
"OPTICA GAMEZ";"";"Tel: (58) (276) 3430732";"Centro, San Cristóbal San Cristóbal, Venezuela";"Medicina General"
"SUGLIO, LEONARDO DR.";"";"Tel: (58) (261) 7522147";"Avenida 23 con Calle 69a, Nro 69a - 13 Indio Mara Maracaibo, Venezuela";"Medicina General"
"DÍAZ A, ROMUALDO DR.";"";"Tel: (58) (261) 7982778";"Las Delicias - Maracaibo Maracaibo, Venezuela";"Medicina General"
"SHUHAIBAR, NASIF DR.";"";"Tel: (58) (261) 7974051";"Edificio Bedaloa, Santa Rita Maracaibo, Venezuela";"Medicina General"
"RICHANI, GLENDA DE DRA.";"";"Tel: (58) (261) 7982370";"Avenida 8, Santa Rita Maracaibo, Venezuela";"Medicina General"
"LEAL G., MARTIN DR.";"";"Tel: (58) (261) 7972071";"Calle 72, Tierra Negra Maracaibo, Venezuela";"Medicina General"
"OPTICA USECHE";"";"Tel: (58) (271) 2215810";"Calle 6, Mercedes Díaz Valera, Venezuela";"Medicina General"
"ALVARADO G., GENNY M. DRA.";"";"Tel: (58) (276) 3472425";"Av 19 de Abril San Cristóbal, Venezuela";"Medicina General"
"CENECO S.A.";"";"Tel: (58) (274) 2631402";"Diagonal A la clínica del niño El Encanto Mérida, Venezuela";"Medicina General"
"GELVEZ V., VICTOR DR.";"";"Tel: (58) (274) 2527667";"Avs. 2 y 3 Calle 29 Mérida, Venezuela";"Medicina General"
"SYLVESTER, JIM";"";"Tel: (58) (261) 7981535";"Avenida 8, Santa Rita Maracaibo, Venezuela";"Medicina General"
"OPTICA OPTILENTE";"";"Tel: (58) (274) 2528360";"Calle 24 Mérida, Venezuela";"Medicina General"
"CLÍNICA DENTAL CARMELITA";"";"Tel: (58) (274) 2661076";"Av. Las AmÉricas, Santa Bárbara Este Mérida, Venezuela";"Medicina General"
"CLÍNICA ODONTOLÓGICA HIDALGO";"";"Tel: (58) (261) 7985876";"Av. 8, Santa Rita Maracaibo, Venezuela";"Medicina General"
"LOZANO S., ALFONSO J DR.";"";"Tel: (58) (261) 7983138";"Centro Médico Occidente Maracaibo, Venezuela";"Medicina General"
"QUINTEROS, MARIELA DRA.";"";"Tel: (58) (261) 7629466";"Av. 17 Baralt, Maracaibo Maracaibo, Venezuela";"Medicina General"
"OPTICA ROLDAN";"";"Tel: (58) (261) 7555993";"Galerías Mall, Av. La Limpia Maracaibo, Venezuela";"Medicina General"
"UNIDAD ODONTOLIGICA INTEGRAL DRA JANY INCIARTE DE LAMBO";"";"Tel: (58) (261) 7412378";"Fuerzas Armadas-Maracaibo Maracaibo, Venezuela";"Medicina General"
"CLÍNICA ODONTOLÓGICA VARYNA";"";"Tel: (58) (273) 5335703";"Av. Montilla Barinas, Venezuela";"Medicina General"
"UNIDAD CLÍNICA DE IMPLANTES Y PRÓTESIS ODONTOLÓGICAS";"";"Tel: (58) (276) 3464453";"C.C. El Parque San Cristóbal, Venezuela";"Medicina General"
"CLÍNICA DE ODONTOLOGÍA HOLÍSTICA, C.A.";"";"Tel: (58) (274) 1777826";"Av. Las Américas Mérida, Venezuela";"Medicina General"
"CENTRO ODONTOLÓGICO CANTA CLARO";"";"Tel: (58) (274) 2442934";"Av. L Américas Mérida, Venezuela";"Medicina General"
"DELGADO D, JUAN J.";"";"Tel: (58) (261) 7980668";"Policlínica Maracaibo Maracaibo, Venezuela";"Medicina General"
"FERNÁNDEZ, RICARDO DR.";"";"Tel: (58) (261) 7629612";"Av. 17 Baralt, Maracaibo Maracaibo, Venezuela";"Medicina General"
"MORA L., OSCAR A. DR.";"";"Tel: (58) (276) 3490400";"Policlinica Tachira San Cristóbal, Venezuela";"Medicina General"
"CDM, C.A.";"";"Tel: (58) (212) 2430552";"Urb. La Urbina, Calle Envolvente, Sector Intermedio Parcela 1 Caracas, Venezuela";"Medidores Para Agua"
"SUAREZ & UMBRIA";"";"Tel: (58) (212) 2423664";"El Marques Caracas, Venezuela";"Medidores Para Agua"
"MAXI-COSMOS";"";"Tel: (58) (276) 3473158";"Av 19 de Abril a una cuadra del Gimnasio Arminio Gutiérrez, La Concordia San Cristóbal, Venezuela";"Mercados"
"INVERSIONES GARCIA";"";"Tel: (58) (212) 7721257";"C.I. Principal El Nula Caracas, Venezuela";"Mercados"
"AUTOMERCADO LA PARADA";"";"Tel: (58) (275) 8731762";"A 2 Cuadras del Hospital San José Tovar, Venezuela";"Mercados"
"ABASTOS MOLINA, C.A.";"";"Tel: (58) (274) 2529997";"Cl.22 Mérida, Venezuela";"Mercados"
"AUTOMERCADO LA LUCHA, C.A.";"";"Tel: (58) (243) 2671835";"C.I. Bolivar Palo Negro, Venezuela";"Mercados"
"AUTOMERCADO PIPPO, C.A.";"";"Tel: (58) (262) 8721783";"Calle 24 San Rafael Del Moján, Venezuela";"Mercados"
"SUPERMERCADO EUROGUARICO, C.A.";"";"Tel: (58) (212) 8716286";"Carretera Nacional, Calabozo Caracas, Venezuela";"Mercados"
"SUPERMERCADOS REGIONAL, C.A.";"";"Tel: (58) (212) 2323077";"C.I L Delicias Caracas, Venezuela";"Mercados"
"SUPERMERCADO BARATTA";"";"Tel: (58) (276) 3563655";"Zona Ind Paramillo San Cristóbal, Venezuela";"Mercados"
"SUPERMERCADO SANTA ISABEL";"";"Tel: (58) (212) 2713970";"Av. Interc. Fco. De Miranda Caracas, Venezuela";"Mercados"
"AUTOMERCADO ALTO CHAMA";"";"Tel: (58) (274) 2715455";"Al lado de la E/S Móvil Av. Andrés Bello Mérida, Venezuela";"Mercados"
"COMERCIAL, ABASTO Y LICORERÍA CHEO";"";"Tel: (58) (275) 5551674";"Brr. Carlos André Pérez Santa Bárbara del Zulia, Venezuela";"Mercados"
"RAMÍREZ MORA TU CENTRO DE COMPRA, C.A.";"";"Tel: (58) (275) 8811841";"Cl. 10, San Isidro El Vigía, Venezuela";"Mercados"
"SUPERMERCADO STA CRUZ";"";"Tel: (58) (243) 2619336";"C.I. Lamas Santa Cruz de Aragua, Venezuela";"Mercados"
"ABASTOS TARIBA, S.R.L.";"";"Tel: (58) (276) 3942434";"Calle 8, Nro.3-36 Fte A la Plazuela Táriba Tariba, Venezuela";"Mercados"
"MEGAMERCADO DON CHANG";"";"Tel: (58) (291) 6527264";"Av. Principal Paramacone Al Lado de Radio Orbita Maturín, Venezuela";"Mercados"
"SUPERMERCADOS POLLOS A1, C.A.";"";"Tel: (58) (212) 2470259";"Av. 19 De Abril Caracas, Venezuela";"Mercados"
"NEUROLOGIA";"";"Tel: (58) (241) 8213027";"La Viña Valencia Valencia, Venezuela";"Metrología"
"SAVAGRO";"";"Tel: (58) (212) 2031211";"Cl. Tiuna Edif. Ferrototal No. 5 Planta Alta Final Av. Boleita Norte Cara cas, Ven. Caracas, Venezuela";"Motobombas"
"SUMIVEN S.A.";"";"Tel: (58) (261) 7970430";"Clle 72c/esq.13A-02,Edif.13A-02Sector Tierra Negra,Maracaibo,Edo Zulia Maracaibo, Venezuela";"Motobombas"
"AUTOMOTRIZ AUTANA, C.A.";"";"Tel: (58) (243) 2358711";"Av. Ppal. De San José Maracay, Venezuela";"Motores P Automotores"
"CHIQUITICOS";"";"Tel: (58) (212) 5773476";"Esq Alcabala a Pte Anauco Edif 216-3 La Candelaria Caracas Caracas, Venezuela";"Muebles Infantiles"
"COUNTRY COLLECTION S.R.L.";"";"Tel: (58) (212) 9637634";"El Haltillo Caracas Caracas, Venezuela";"Muebles Infantiles"
"MUEBLERIA INFANTIL B.B CITOS C.A";"";"Tel: (58) (212) 2717876";"Unicentro El Marquez Caracas, Venezuela";"Muebles Infantiles"
"PICHURRITOS";"";"Tel: (58) (212) 2327089";"La Carlota Caracas, Venezuela";"Muebles Infantiles"
"LITTLE BABY";"";"Tel: (58) (212) 9764770";"Av Principal Prados Del Este Caracas, Venezuela";"Muebles Infantiles"
"MULTICOLOR 3L C.A";"";"Tel: (58) (212) 4254933";"Makro La Urbina Caracas, Venezuela";"Muebles Infantiles"
"LA CANASTILLA DEL ESTE C.A";"";"Tel: (58) (212) 9515354";"Final Av Casanova Chacaito Caracas, Venezuela";"Muebles Infantiles"
"BEIBY MINA, C.A.";"";"Tel: (58) (241) 8571546";"Entre Comercio Y Paez No. 98-16 Av Boyaca Centro Valencia, Venezuela";"Muebles Infantiles"
"FABIMAR C.A.";"";"Telefax: (58) (243) 2632457";"Carrt Nacional Parcela No. 28, Cext Las Vueltas, A 800 Mts Del Viaducto L a Cabrera Maracay, Venezuela";"Muebles Para Equipos De Sonido Y Televisores"
"RESTAURANT EL VIEJO MUELLE";"";"Tel: (58) (295) 2532962";"Cl El Fuerte, Juan Griego Juan Griego, Venezuela";"Muelles"
"NEUMATICAS VALENCIA C.A";"";"Tel: (58) (241) 8343602";"Av Pancho Pepe Croquer, Valencia, Edo. Carabobo Valencia, Venezuela";"Neumática"
"POGASOL, S.A.";"";"Tel: (58) (261) 7232824";"Calle 88, Qta. Aismería, Local 14a-94 Las Delicias Maracaibo, Venezuela";"Neveras"
"ARNEVECA";"";"Tel: (58) (212) 3326141";"Caracas Caracas, Venezuela";"Neveras"
