"KITCHEN UTILITES C.A";"";"Tel: (58) (212) 9931540";"Las Mercedes Caracas, Venezuela";"Cocinas"
"COCINAS D' ALAMENARA";"";"Tel: (58) (212) 8707318";"Catia Caracas, Venezuela";"Cocinas"
"CONSTRUCCIONES Y DECORACIONES ZAMARA C.A";"";"Tel: (58) (212) 3713943";"Vía L Morita, S Antonio De Los Altos San Antonio De Los Altos, Venezuela";"Cocinas"
"GRAND CHEF";"";"Tel: (58) (212) 2639344";"C.C. San Ignacio, La Castellana Caracas, Venezuela";"Cocinas"
"DURA WERE";"";"Tel: (58) (212) 5455397";"Santa Teresa Caracas, Venezuela";"Cocinas"
"LICEO PEDRO EMILIO COLL";"";"Tel: (58) (212) 6819280";"Coche Caracas, Venezuela";"Colegios"
"UNIDAD EDUCATIVA CHUAO";"";"Tel: (58) (212) 9919495";"Chuao Caracas, Venezuela";"Colegios"
"AC UNIDAD EDUCATIVA PRIVADA FUNDAMERICANA";"";"Tel: (58) (212) 4824742";"Santa Teresa Caracas, Venezuela";"Colegios"
"COLEGIO PEDAGOGICO INFANTIL";"";"Tel: (58) (212) 2713664";"La California Norte, Caracas Caracas, Venezuela";"Colegios"
"COLEGIO INTERNACIONAL DE CARABOBO";"";"Tel: (58) (241) 8426551";"Valencia Valencia, Venezuela";"Colegios"
"UNIDAD EDUCATIVA COLEGIO ARISTIDES BASTIDAS";"";"Tel: (58) (285) 6540278";"Cl Alberto Carnevalli Santa Fe Ciudad Bolivar, Venezuela";"Colegios"
"CENTRO VENEZOLANO AMERICANO";"";"Tel: (58) (212) 9938422";"Las Mercedes Caracas, Venezuela";"Colegios"
"COLEGIO INTERNACIONAL DE CARACAS";"";"Tel: (58) (212) 9414677";"Los Samanes Caracas, Venezuela";"Colegios"
"COLEGIO GABRIELA MISTRAL";"";"Tel: (58) (212) 4421150";"Montalbán Caracas, Venezuela";"Colegios"
"COLEGIO SAN AGUSTÍN CARICUAO";"";"Tel: (58) (212) 4330086";"Caricuao Caracas, Venezuela";"Colegios"
"GRUPO ESCOLAR DR FRANCISCO MENDOZA";"";"Tel: (58) (212) 8606941";"Altagracia Caracas, Venezuela";"Colegios"
"UNIDAD EDUCATIVA PRIVADA EL GRAN ABORIGEN";"";"Tel: (58) (212) 3643115";"Matica Abajo, Los Teques Los Teques, Venezuela";"Colegios"
"ASOCIACIÍN CIVIL FÉ Y ALEGRÍA";"";"Tel: (58) (212) 2417532";"Petare Caracas, Venezuela";"Colegios"
"COLEGIO DE OFICIALES DE LA MARINA MERCANTE DE VZUELA";"";"Tel: (58) (212) 8648235";"Urdaneta Caracas, Venezuela";"Colegios"
"COLEGIO NUESTRA SEÑORA DE LA GUIA";"";"Tel: (58) (212) 2725005";"La California Norte Caracas, Venezuela";"Colegios"
"ESCUELA COMEDOR CRISTO REY";"";"Tel: (58) (212) 8584391";"23 De Enero Caracas, Venezuela";"Colegios"
"ESCUELA NACIONAL PRUDENCIO DIEZ";"";"Tel: (58) (212) 6312168";"El Cementerio Caracas, Venezuela";"Colegios"
"UNIDAD EDUCATIVA LAURA VICUÑA";"";"Tel: (58) (212) 2384712";"El Marqués Caracas, Venezuela";"Colegios"
"UNIDAD EDUCATIVA COLEGIO SANTO CRISTO, C.A";"";"Tel: (58) (261) 7548156";"Av. 88, La Rotaria Maracaibo, Venezuela";"Colegios"
"INSTITUTO NACIONAL TEO CAPILES";"";"Tel: (58) (212) 4717170";"Montalbán Caracas, Venezuela";"Colegios"
"LICEO ESTEBAN GIL BORGES";"";"Tel: (58) (212) 2355792";"Los Dos Caminos Caracas, Venezuela";"Colegios"
"COLEGIO DON BOSCO";"";"Tel: (58) (212) 2635323";"Altamira Caracas, Venezuela";"Colegios"
"INSTITUTO EDUCACIÓN ESPECIAL BICENTENARIO";"";"Tel: (58) (212) 8605621";"La Pastora Caracas, Venezuela";"Colegios"
"CENTRO UNIVERSITARIO DE SEGUROS";"";"Tel: (58) (212) 2570729";"Cnas De La California Caracas, Venezuela";"Colegios"
"UNIDAD EDUCATIVA LANDAETA ROSALES";"";"Tel: (58) (212) 8708655";"Catia Caracas, Venezuela";"Colegios"
"COLEGIO DE PSICÓLOGOS DEL ESTADO MIRANDA";"";"Tel: (58) (212) 2564043";"Macaracuay Caracas, Venezuela";"Colegios"
"ESCUELA CIUDAD DE BARCELONA";"";"Tel: (58) (212) 8728066";"Catia Caracas, Venezuela";"Colegios"
"COLEGIO PROMESAS PATRIAS";"";"Telefax: (58) (212) 7536809";"Cnas De Bello Monte, Caracas Caracas, Venezuela";"Colegios"
"IRACHE";"";"Tel: (58) (212) 8720256";"Propatria Caracas, Venezuela";"Colegios"
"INSTITUTO ALPHA LEARNING, C.A.";"";"Tel: (58) (241) 8253808";"Multicentro Paseo El Parral, Piso 1, Av. Los Trotones, Urb. El Parral. Valencia, Venezuela";"Colegios"
"INSTITUTO JOSE ANTONIO PAEZ";"";"Tel: (58) (281) 2651576";"Cl Carabobo 26-a Puerto de  la Cruz, Venezuela";"Colegios"
"UNIDAD EDUCATIVA JOSÉ RAFAEL POCATERRA";"";"Tel: (58) (212) 3623510";"Trapichito, Guarenas Guarenas, Venezuela";"Colegios"
"CASA ORIENTACIÓN DE ESTUDIOS ESPECIALES";"";"Tel: (58) (212) 7822454";"La Florida Caracas, Venezuela";"Colegios"
"UNIDAD EDUCATIVA INSTITUTO DIDACTICO SIMÓN RODRÍGUEZ";"";"Tel: (58) (212) 2577736";"Av Atenas, La California Sur Caracas, Venezuela";"Colegios"
"U.E. CECITEC MANUEL PIAR";"";"Tel: (58) (274) 2633005";"Av. Urdaneta, Merida Mérida, Venezuela";"Colegios"
"SOCIEDAD CIVIL ESCUELA BRITÁNICA";"";"Tel: (58) (212) 2655194";"Altamira Caracas, Venezuela";"Colegios"
"COLEGIO RODRIGUEZ PAZ";"";"Tel: (58) (212) 2841689";"8va Transv Ruta Metro Bus 111 Parada U.N.A, Sebucan Caracas, Venezuela";"Colegios"
"UNIDAD EDUCATIVA MORAL Y LUCES DEL TUY";"";"Tel: (58) (239) 2255497";"O Alvarez, Ocumare Del Tuy Ocumare del Tuy, Venezuela";"Colegios"
"UNIDAD EDUCATIVA DE APOYO INTEGRAL JUAN JACOBO ROUSSEAU";"";"Tel: (58) (281) 2688109";"Av 1 Guaraguao Puerto de  la Cruz, Venezuela";"Colegios"
"COLEGIO NUESTRA SRA DEL CARMEN";"";"Tel: (58) (212) 3210451";"Los Teques Los Teques, Venezuela";"Colegios"
"ESCUELA BÁSICA JENARO AGUIRRE ELORRIAGA";"";"Tel: (58) (212) 2443398";"Petare Caracas, Venezuela";"Colegios"
"FUNDACIÓN COLEGIO FRANCIA";"";"Tel: (58) (212) 2340687";"Campo Claro Caracas, Venezuela";"Colegios"
"COLEGIO NUESTRA SEÑORA DE FATIMA";"";"Tel: (58) (212) 2615619";"La Castellana Caracas, Venezuela";"Colegios"
"INSTITUTO POPULAR DE CULTURA ALÍ PRIMERA";"";"Tel: (58) (212) 5712412";"El Conde Caracas, Venezuela";"Colegios"
"UNIDAD EDUCATIVA VARGAS II";"";"Tel: (58) (212) 4513213";"Av Páez C.C. Santa Rita, El Paraíso Caracas, Venezuela";"Colegios"
"UNIDAD EDUCATIVA ALEJANDRO FUENMAYOR";"";"Tel: (58) (291) 6437141";"Cll agapito Maturín, Venezuela";"Colegios"
"U.E. ANTONIO LAURO";"";"Tel: (58) (282) 4246229";"Av. Portuguesa Anaco, Venezuela";"Colegios"
"LA FUNDACIÓN EL PORTAL";"";"Tel: (58) (212) 8621653";"La Pastora Caracas, Venezuela";"Colegios"
"COMPUKIDS C.A";"";"Tel: (58) (212) 9458224";"La Trinidad Caracas, Venezuela";"Colegios"
"ESCUELA BÁSICA NACIONAL LA CUMBRE";"";"Tel: (58) (212) 4726229";"Antímano Caracas, Venezuela";"Colegios"
"ESCUELA BÁSICA NACIONAL LOS MAGALLANES";"";"Tel: (58) (212) 8708710";"Catia Caracas, Venezuela";"Colegios"
"UNIDAD EDUCATIVA VISTA AVILA C.A";"";"Tel: (58) (212) 3347407";"Cl Las Animas Caracas, Venezuela";"Colegios"
"UNIDAD EDUCATIVA EL PINAR";"";"Tel: (58) (212) 4617506";"El Paraíso Caracas, Venezuela";"Colegios"
"CAJA DE AHORROS DEL COLEGIO UNIVERSITARIO DE CARACAS";"";"Tel: (58) (212) 5711909";"San Agustín Caracas, Venezuela";"Colegios"
"CENTRO DE ESTUDIO ALFRED NOBEL";"";"Tel: (58) (212) 9937172";"Las Mercedes Caracas, Venezuela";"Colegios"
"COLEGIO VERE-LUSO";"";"Tel: (58) (212) 8704301";"Pérez Bonalde, Caracas Caracas, Venezuela";"Colegios"
"PREESCOLAR PABLO VI";"";"Tel: (58) (212) 2575320";"El Llanito Caracas, Venezuela";"Colegios"
"UNIDAD EDUCATIVA COLEGIO CERVANTES";"";"Tel: (58) (212) 7936183";"Esq. Las Palmas, Florida Caracas, Venezuela";"Colegios"
"COLEGIO NUESTRA SEÑORA DE COROMOTO DEL ESTE";"";"Tel: (58) (212) 2482595";"Rivas, Charallave Caracas, Venezuela";"Colegios"
"INSTITUTO EDUCATIVO TIUNA";"";"Tel: (58) (212) 4317386";"Ruiz Pineda Caracas, Venezuela";"Colegios"
"LICEO PARROQUIAL NUESTRA SEÑORA DEL ROSARIO";"";"Tel: (58) (212) 9450322";"La Trinidad Caracas, Venezuela";"Colegios"
"MATERNAL PREESCOLAR U.E MONTESSORI";"";"Tel: (58) (212) 4152947";"Cl Ayacucho, El Pueblo, Los Teques Los Teques, Venezuela";"Colegios"
"INSTITUTO UNIVERSITARIO DE TECNOLOGIA TÓMAS LANDER";"";"Tel: (58) (239) 2256392";"Centro, Ocumare Del Tuy Ocumare del Tuy, Venezuela";"Colegios"
"UNIDAD EDUCATIVA COLEGIO VILLA FELÍZ";"";"Tel: (58) (212) 2544205";"Nueva Segovia Caracas, Venezuela";"Colegios"
"PREESCOLAR SIMÓN BOLÍVAR";"";"Tel: (58) (212) 9770831";"Prados Del Este Caracas, Venezuela";"Colegios"
"COLEGIO GUAICAIPURO";"";"Tel: (58) (212) 6317365";"El Cementerio Caracas, Venezuela";"Colegios"
"COLEGIO MARÍA SANTISIMA";"";"Tel: (58) (212) 2376141";"El Marqués Caracas, Venezuela";"Colegios"
"UNIDAD EDUCATIVA CUMANAGOTO";"";"Tel: (58) (212) 2516589";"Palo Verde Caracas, Venezuela";"Colegios"
"COLEGIO VIRGEN DEL VALLE";"";"Tel: (58) (212) 3519116";"La Fundación, Maiquetia Caracas, Venezuela";"Colegios"
"PREESCOLAR NEGRA HIPÓLITA";"";"Tel: (58) (212) 6930245";"Santa Mónica Caracas, Venezuela";"Colegios"
"COLEGIO ALA BLANCA";"";"Tel: (58) (212) 2345223";"La Carlota, Caracas Caracas, Venezuela";"Colegios"
"ACTIVIDADES EDUCATIVAS EDUDACTAS";"";"Tel: (58) (212) 5513443";"San Bernardino Caracas, Venezuela";"Colegios"
"INSTITUTO ESCUELA TÁCHIRA";"";"Tel: (58) (212) 8730696";"Catia Caracas, Venezuela";"Colegios"
"CENTRO DE EDUCACIÓN INICIAL EL PRINCIPITO";"";"Tel: (58) (251) 2551327";"Carrera 2 Con Esquina Calle 3. Urbanización del Este Barquisimeto, Venezuela";"Colegios"
"CREACIÓN CICLO BÁSICO SIMÓN RODRÍGUEZ";"";"Tel: (58) (212) 5721634";"Sarría Caracas, Venezuela";"Colegios"
"U E INSTITUTO DE EDUCACIÓN MODERNA";"";"Tel: (58) (212) 7530151";"Cnas De Bello Monte Caracas, Venezuela";"Colegios"
"UNIDAD ESCUELA PARROQUIAL CORAZÓN DE MARÍA";"";"Tel: (58) (212) 2718396";"Petare Caracas, Venezuela";"Colegios"
"UNIDAD EDUCATIVA NUESTRA SEÑORA DE GUADALUPE";"";"Tel: (58) (261) 7594623";"Indio Mara Maracaibo, Venezuela";"Colegios"
"U.E. COLEGIO SAN AGUSTIN";"";"Tel: (58) (286) 9943856";"Final Av Paseo Caroni Local 1-a Ciudad Guayana Puerto Ordaz, Venezuela";"Colegios"
"UNIDAD EDUCATIVA TECNICA PRIVADA CULTURA Y TECNOLOGIA C.A.";"";"Tel: (58) (243) 2468229";"Cl. el Canal, Libertad Maracay, Venezuela";"Colegios"
"U E AGUSTÍN CODAZZI";"";"Telefax: (58) (212) 7305198";"Alta Florida Caracas, Venezuela";"Colegios"
"U.E.P COLEGIO CIUDAD MARIANA DE CARACAS";"";"Tel: (58) (212) 4810851";"Av Los Pinos, C.M.C El Paraíso Caracas, Venezuela";"Colegios"
"COLEGIO EL CARMELO";"";"Tel: (58) (212) 6329451";"Las Acacias Caracas, Venezuela";"Colegios"
"COLEGIO MONSEÑOR CASTILLO";"";"Tel: (58) (212) 8627463";"La Pastora Caracas, Venezuela";"Colegios"
"UNIDAD EDUCATIVA JOSÉ VICENTE DE UNDA";"";"Tel: (58) (212) 4720077";"Vista Alegre Caracas, Venezuela";"Colegios"
"ESCUELA NACIONAL BOLÍVAR";"";"Tel: (58) (212) 5422180";"Santa Rosalía Caracas, Venezuela";"Colegios"
"ACADEMIA DE POLICIA FRANCISCO LEANDRO";"";"Tel: (58) (212) 2678389";"Chacao Caracas, Venezuela";"Colegios"
"COLEGIO SIETE ESTRELLAS";"";"Tel: (58) (212) 7937447";"Los Caobos Caracas, Venezuela";"Colegios"
"ESCUELA BÁSICA RITA FREIRE DE GALLEGOS";"";"Tel: (58) (212) 4844415";"Santa Teresa Caracas, Venezuela";"Colegios"
"UNIDAD EDUCATIVA PRIVADA COLEGIO SAN CAYETANO";"";"Tel: (58) (212) 5621865";"Altagracia Caracas, Venezuela";"Colegios"
"COLEGIO CIUDAD FAJARDO DE GUATIRE";"";"Telefax: (58) (212) 3443845";"Cl 19 De Abril Al Lado De La Casa Sindical, Guatire Guatire, Venezuela";"Colegios"
"COLEGIO ESPAÑOL";"";"Tel: (58) (243) 2346931";"Bermudez Maracay, Venezuela";"Colegios"
"SEMINARIO EVÁNGELICO DE CARACAS";"";"Tel: (58) (212) 6619063";"Santa Mónica Caracas, Venezuela";"Colegios"
"ACADEMIA CRISTIANA INTERNACIONAL DE CARACAS";"";"Tel: (58) (212) 7540321";"Cnas De Bello Monte Caracas, Venezuela";"Colegios"
"COLEGIO MADISON C.A";"";"Tel: (58) (212) 9858078";"El Cafetal Caracas, Venezuela";"Colegios"
"COLEGIO BICENTENARIO DE BOLÍVAR";"";"Tel: (58) (212) 4611735";"El Paraíso Caracas, Venezuela";"Colegios"
"ASOCIACIÓN NACIONAL DE INSTITUTOS EDUCATIVOS PRIVADOS";"";"Tel: (58) (212) 5649182";"Altagracia Caracas, Venezuela";"Colegios"
"U E INSTITUTO ELENA DE BUENO";"";"Tel: (58) (212) 2353436";"Av Principal, Los Chorros Caracas, Venezuela";"Colegios"
"UNIDAD EDUCATIVA NUESTRA SEÑORA DEL ROSARIO";"";"Tel: (58) (241) 8597204";"Cl Independencia Valencia, Venezuela";"Colegios"
"COLEGIO AGRAMONTE";"";"Tel: (58) (212) 8623603";"Catia Caracas, Venezuela";"Colegios"
"UNIDAD EDUCATIVA FRANCISCO SALÍAS";"";"Tel: (58) (212) 4724569";"Montalbán Caracas, Venezuela";"Colegios"
"UNIDAD EDUCATIVA NUEVA GRANADA";"";"Tel: (58) (212) 6322821";"Los Rosales Caracas, Venezuela";"Colegios"
"COLEGIO RICARDO GREEMIDGE";"";"Tel: (58) (212) 4841170";"El Paraíso Caracas, Venezuela";"Colegios"
"ESCUELA CAMPO ALEGRE S.A";"";"Tel: (58) (212) 9933922";"Las Mercedes Caracas, Venezuela";"Colegios"
"ICE INSTITUTO CENTRAL DE EDUCACIÓN";"";"Tel: (58) (212) 8625403";"Altagracia Caracas, Venezuela";"Colegios"
"COLEGIO CLARET";"";"Tel: (58) (212) 9630287";"Alto Hatillo Caracas, Venezuela";"Colegios"
"C.E VALLE ABIERTO";"";"Tel: (58) (212) 9859455";"Urb San Luis, El Cafetal Caracas Caracas, Venezuela";"Colegios"
"COLEGIO LA MILAGROSA";"";"Tel: (58) (212) 6317357";"El Cementerio Caracas, Venezuela";"Colegios"
"COLEGIO SAN MARTÍN DE PORRES";"";"Tel: (58) (212) 8701071";"Catia Caracas, Venezuela";"Colegios"
"EDUCENTER C.A";"";"Tel: (58) (212) 9933336";"El Mirador Caracas, Venezuela";"Colegios"
"ESCUELA MUNICIPAL BÁRBARO RIVAS";"";"Tel: (58) (212) 9455368";"Las Minas De Baruta Caracas, Venezuela";"Colegios"
"HERMANAS ADORATRICES";"";"Tel: (58) (212) 2857177";"Los Dos Caminos Caracas, Venezuela";"Colegios"
"COLEGIO PRIVADO ARRÍAS";"";"Tel: (58) (212) 8720233";"Propatria Caracas, Venezuela";"Colegios"
"INSTITUTO EDUCACIONAL JOSÉ FELIX RIBAS";"";"Tel: (58) (212) 9938348";"Av Río De Janeiro, Chuao Caracas, Venezuela";"Colegios"
"ESCUELA BÁSICA VIRGINIA DE RUIZ";"";"Tel: (58) (212) 8587253";"La Silsa Caracas, Venezuela";"Colegios"
"COLEGIO UNIVERSITARIO MONSEÑOR DE TALAVERA";"";"Tel: (58) (212) 2669966";"La Castellana Caracas, Venezuela";"Colegios"
"LICEO BRICEÑO MÉNDEZ";"";"Tel: (58) (212) 5645454";"Altagracia Caracas, Venezuela";"Colegios"
"COLEGIO CHIMBORAZO";"";"Tel: (58) (212) 5624459";"La Candelaria Caracas, Venezuela";"Colegios"
"UNIDAD DE APOYO EDUCATIVO MUNICIPAL SAN JOSÉ";"";"Tel: (58) (212) 9539927";"El Rosal Caracas, Venezuela";"Colegios"
"UEP COLEGIO CORBETA LEANDER";"";"Tel: (58) (212) 5000077";"F J Ustáriz San Bernardino Caracas, Venezuela";"Colegios"
"A C U E CENTRO CULTURAL Y FORMACIÓN ACADEMICA JULIO";"";"Tel: (58) (212) 2394560";"Petare Caracas, Venezuela";"Colegios"
"COLEGIO NAZARET";"";"Tel: (58) (212) 5519878";"San Bernardino Caracas, Venezuela";"Colegios"
"MADISON LEARNING CENTER S.R.L";"";"Tel: (58) (212) 9858834";"El Cafetal Caracas, Venezuela";"Colegios"
"UNIDAD EDUCATIVA NACIONAL MERCEDES LIMARDO";"";"Tel: (58) (212) 4435717";"Antímano Caracas, Venezuela";"Colegios"
"U E DR RUBÉN MERENFELD";"";"Tel: (58) (212) 4622295";"El Paraíso Caracas, Venezuela";"Colegios"
"U E FUENTE DE JACOB";"";"Tel: (58) (212) 8628076";"Catia Caracas, Venezuela";"Colegios"
"COLEGIO ANTONIO ORTEGA ORDOÑEZ";"";"Tel: (58) (212) 3720098";"Dolores, S Antonio De L Altos San Antonio De Los Altos, Venezuela";"Colegios"
"JARDÍN DE INFANCIA VINICIO ADAMES";"";"Tel: (58) (212) 2722112";"La California Norte Caracas, Venezuela";"Colegios"
"COLEGIO PRESIDENTE KENNEDY";"";"Tel: (58) (212) 2912880";"Barrio Bolívar, Filas De Mariche Filas de Mariche, Venezuela";"Colegios"
"U E COLEGIO TERESIANO NUESTRA SEÑORA DE COROMOTO";"";"Tel: (58) (212) 4814139";"El Paraíso Caracas, Venezuela";"Colegios"
"ESCUELA INTEGRAL MUNICIPAL CARLOS SOUBLETTE";"";"Tel: (58) (212) 2636213";"Bello Campo Caracas, Venezuela";"Colegios"
"COLEGIO INTEGRAL GUAYANA";"";"Tel: (58) (286) 9616001";"Sector los Olivos Ciudad Guayana Puerto Ordaz, Venezuela";"Colegios"
"COLEGIO LATINOAMERICANO S.R.L";"";"Tel: (58) (212) 4728524";"La Paz Caracas, Venezuela";"Colegios"
"ASOCIACIÓN DE PROMOCIÓN DE EDUCACIÓN POPULAR";"";"Tel: (58) (212) 4319511";"Caricuao Caracas, Venezuela";"Colegios"
"U E ANTONIO NICOLAS BRICEÑO";"";"Tel: (58) (212) 9753809";"Charallavito, Caracas Caracas, Venezuela";"Colegios"
"JARDIN DE INFANCIA AÑO BICENTENARIO";"";"Tel: (58) (212) 8606147";"Los Mecedores Caracas, Venezuela";"Colegios"
"UNIDAD EDUCATIVA COLEGIO LA DIVINA PROVIDENCIA";"";"Tel: (58) (286) 9614946";"Villa Africana Ciudad Guayana Puerto Ordaz, Venezuela";"Colegios"
"COLEGIO SAGRADA FAMILIA FE Y ALEGRÍA";"";"Tel: (58) (212) 4223057";"El Manguito, El Junquito Caracas, Venezuela";"Colegios"
"COLEGIO LA SANTISIMA TRINIDAD";"";"Tel: (58) (212) 8701372";"Catia Caracas, Venezuela";"Colegios"
"INSTITUTO EDUCACIONAL ANDRES BELLO";"";"Tel: (58) (295) 2421677";"Palo sano sur La Asunción, Venezuela";"Colegios"
"CENTRO DON BOSCO DE MARICHE";"";"Tel: (58) (212) 5321254";"Mariches, Filas De Mariche Filas de Mariche, Venezuela";"Colegios"
"U E COLEGIO LA MILAGROSA";"";"Tel: (58) (212) 3626877";"Cl Felix Rivas Caracas, Venezuela";"Colegios"
"INSTITUTO EDUCACIONAL HENRY CLAY";"";"Tel: (58) (212) 9431569";"Los Samanes, Caracas Caracas, Venezuela";"Colegios"
"U.E. COLEGIO NUESTRA SEÑORA DEL ROSARIO";"";"Tel: (58) (286) 9323408";"Av Antonio berrios Frente al parque los mangos Ciudad Guayana Puerto Ordaz, Venezuela";"Colegios"
"IPSOPOL";"";"Tel: (58) (212) 5783232";"La Candelaria Caracas, Venezuela";"Colegios"
"COLEGIO LA CONCEPCIÓN MONTALBÁN";"";"Tel: (58) (212) 4427055";"Montalbán Caracas, Venezuela";"Colegios"
"UNIDAD EDUCATIVA RÍO MANZANARE";"";"Tel: (58) (212) 2484145";"La Estrella, Charallave Caracas, Venezuela";"Colegios"
"COLEGIO JAPONES DE CARACAS";"";"Tel: (58) (212) 9611244";"El Hatillo Caracas, Venezuela";"Colegios"
"COLEGIO DOMINGO SAVIO";"";"Tel: (58) (251) 4453779";"Quinta Los Cinco Carrera 17, E/ Cl 41 y 42 Barquisimeto, Venezuela";"Colegios"
"COLEGIO SAN JOSÉ DE TARBES";"";"Tel: (58) (212) 7301074";"La Florida Caracas, Venezuela";"Colegios"
"HIPOPÓPTAMO JARDIN DE INFANCIA";"";"Tel: (58) (212) 9859774";"Los Naranjos Caracas, Venezuela";"Colegios"
"INSTITUTO LAS AMÉRICAS C.A";"";"Tel: (58) (212) 4845903";"Catedral Caracas, Venezuela";"Colegios"
"TALLER CREATIVO INFANTIL MIS BROCHITAS";"";"Tel: (58) (212) 2712135";"Cl París, La California Norte Caracas, Venezuela";"Colegios"
"UE ESCUELA PARROQUIAL SANTA TERESA";"";"Tel: (58) (212) 4846923";"Santa Teresa Caracas, Venezuela";"Colegios"
"UNIDAD BÁSICA CENTRO EDUCACIONAL TU PRIMERO";"";"Tel: (58) (212) 4429150";"Montalbán Caracas, Venezuela";"Colegios"
"COLEGIO SAN FRANCISCO DE SALES";"";"Tel: (58) (212) 5717187";"Guaicaipuro Caracas, Venezuela";"Colegios"
"INSTITUTO DE EDUCACIÓN INTEGRAL EL NIÑO DON SIMÓN";"";"Tel: (58) (212) 6900711";"Las Acacias Caracas, Venezuela";"Colegios"
"INSTITUTO GUAICAIPURO";"";"Tel: (58) (212) 7309333";"Av Los Jabillos, La Florida Caracas, Venezuela";"Colegios"
"UNIDAD EDUCATIVA COLEGIO LOS PROCERES";"";"Tel: (58) (286) 9291567";"Cl Meditarreneo Ciudad Guayana Puerto Ordaz, Venezuela";"Colegios"
"UNIDAD EDUCATIVA CENTRO PAULO VI";"";"Tel: (58) (212) 8720134";"Turumo Caracas, Venezuela";"Colegios"
"COLEGIO TIRSO DE MOLINA";"";"Telefax: (58) (212) 5526486";"Av Cristobal Rojas Con Av Humboldt, San Bernardino Caracas, Venezuela";"Colegios"
"U.E. GENERAL ISAIAS MEDINA ANGARITA CIMA";"";"Telefax: (58) (281) 2636889";"Av Santa Cruz N4 Ponzuelos Puerto de  la Cruz, Venezuela";"Colegios"
"COLEGIO MATER SALVATORIS";"";"Tel: (58) (212) 9931395";"Las Mercedes Caracas, Venezuela";"Colegios"
"COLEGIO HERMANAS CATEQUISTAS NUESTRA SEÑORA DE LOURDES";"";"Tel: (58) (212) 4816268";"Santa Teresa Caracas, Venezuela";"Colegios"
"UNIDAD EDUCATIVA JESUS OBRERO";"";"Tel: (58) (286) 9527091";"Rio Aro Av Este Oeste Ciudad Guayana Puerto Ordaz, Venezuela";"Colegios"
"ASOCIACION CIVIL NUESTRA SEÑORA DEL CARMEN";"";"Tel: (58) (286) 9233477";"Cantro Civico Ciudad Guayana Puerto Ordaz, Venezuela";"Colegios"
"COLEGIO SIMÓN BOLÍVAR LI";"";"Tel: (58) (212) 9767654";"Prados Del Este Caracas, Venezuela";"Colegios"
"UNIDAD EDUCATIVA ROBERTO MARTINEZ CENTENO";"";"Tel: (58) (281) 2763923";"Calle Colon Urdaneta Barcelona, Venezuela";"Colegios"
"U.E. INSTITUTO METROPOLITANO ADVENTISTA";"";"Tel: (58) (212) 2663374";"Cr3a. Pueblo Nuevo Caracas, Venezuela";"Colegios"
"UNIDAD EDUCATIVA PRIVADA COLEGIO ARAUCA";"";"Tel: (58) (212) 5514818";"San Bernardino Caracas, Venezuela";"Colegios"
"COLEGIO DE TRABAJADORES SOCIALES DE VENEZUELA";"";"Tel: (58) (212) 7938376";"Los Caobos Caracas, Venezuela";"Colegios"
"COLEGIO TERESIANO LA CASTELLANA";"";"Tel: (58) (212) 2665422";"La Castellana Caracas, Venezuela";"Colegios"
"INSTITUTO ATENAS DE SABANA GRANDE";"";"Tel: (58) (212) 7635218";"Bello Monte Caracas, Venezuela";"Colegios"
"UNIDAD EDUCATIVA INSTITUTO GRAN COLOMBIA";"";"Tel: (58) (241) 8584718";"Entra Paez y Comercio Valencia, Venezuela";"Colegios"
"RELIGIOSAS DOMINICAS SAGRADA FAMILIA";"";"Tel: (58) (212) 9536750";"El Rosal Caracas, Venezuela";"Colegios"
"INSTITUTO EDUCACIONAL MARISCAL SUCRE S.R.L";"";"Tel: (58) (212) 3520364";"Catia La Mar, Maiquetia Caracas, Venezuela";"Colegios"
"INSTITUTO PRINCIPAL EDUCATIVO C.A";"";"Tel: (58) (212) 4613755";"San Martín Caracas, Venezuela";"Colegios"
"LICEO JOSÉ GREGORIO HERNANDEZ";"";"Tel: (58) (212) 2485687";"Bolívar, Charallave Caracas, Venezuela";"Colegios"
"UNIDAD EDUCATIVA PEDRO ISAÍAS OJEDA BLANCO";"";"Tel: (58) (212) 3217163";"Páez, Los Teques Los Teques, Venezuela";"Colegios"
"COLEGIO AVE MARÍA";"";"Tel: (58) (212) 4725502";"El Paraíso Caracas, Venezuela";"Colegios"
"UNIDAD EDUCATIVA CAURIMARE UNO";"";"Tel: (58) (212) 9852982";"Caurimare Caracas, Venezuela";"Colegios"
"ASOCIACIÓN CIVIL COLEGIO PARROQUIAL SANTA TERESITA";"";"Tel: (58) (212) 8700832";"3Av El Parque, Urdaneta Caracas, Venezuela";"Colegios"
"UNIDAD EDUCATIVA COLEGIOS ASOCIADOS SER Y LA FE";"";"Tel: (58) (212) 2833754";"Los Palos Grandes Caracas, Venezuela";"Colegios"
"COLEGIO DEL SANTO ANGEL CONGREGACIÓN HERMANAS DEL ANGEL DE LA GUARDA";"";"Tel: (58) (239) 2256942";"Cl Ribas, Ocumare Del Tuy Ocumare del Tuy, Venezuela";"Colegios"
"INSTITUTO FUNDAMÉRICA";"";"Tel: (58) (212) 4848731";"Santa Teresa Caracas, Venezuela";"Colegios"
"UNIDAD EDUCATIVA COLEGIO PRIVADO MARÍA INMACULADA";"";"Tel: (58) (212) 5620730";"San José Caracas, Venezuela";"Colegios"
"CENTRO EDUCATIVO MONTALBAN";"";"Tel: (58) (212) 4437205";"Montalbán Caracas, Venezuela";"Colegios"
"PRE-ESCOLAR SIMÓN RODRÍGUEZ";"";"Tel: (58) (212) 2563095";"Macaracuay Caracas, Venezuela";"Colegios"
"COLEGIO JUAN E PESTALOZZI";"";"Tel: (58) (261) 7563073";"Grano de Oro Maracaibo, Venezuela";"Colegios"
"AC SANTIAGO DE LEÓN DE CARACAS";"";"Tel: (58) (212) 2842190";"La Floresta Caracas, Venezuela";"Colegios"
"ESCUELA BÁSICA JUAN LANDAETA";"";"Tel: (58) (212) 8708069";"Catia Caracas, Venezuela";"Colegios"
"UNIDAD EDUCATIVA COLEGIO ILUSTRE AMERICANO BARQUISIMETO, C.A.";"";"Tel: (58) (212) 2313455";"Cr23 E/Cl 27 Y 28 Caracas, Venezuela";"Colegios"
"COLEGIO SANTA MARIANA";"";"Tel: (58) (212) 3721992";"El Picacho, S Antonio De L Altos San Antonio De Los Altos, Venezuela";"Colegios"
"COLEGIO INMACULADA CONCEPCIÓN";"";"Tel: (58) (212) 7304413";"La Florida Caracas, Venezuela";"Colegios"
"UNIDAD EDUCATIVA COLEGIO SION";"";"Tel: (58) (285) 6540067";"Calle San Felix Ciudad Bolivar, Venezuela";"Colegios"
"UNIDAD EDUCATIVA COLEGIO BOLIVAR Y PALACIOS";"";"Tel: (58) (212) 4333871";"La Hacienda Caracas, Venezuela";"Colegios"
"UNIDAD EDUCATIVA COLEGIO MIS PRIMEROS ESTUDIOS";"";"Tel: (58) (212) 4727034";"Antímano Caracas, Venezuela";"Colegios"
"COLEGIO EL PLACER";"";"Tel: (58) (212) 9434124";"Baruta Caracas, Venezuela";"Colegios"
"ESCUELA PARROQUIAL MADRE CABRINI";"";"Tel: (58) (212) 8703666";"Catia Caracas, Venezuela";"Colegios"
"U.E. IDEAL INSTITUTO DE ENSEÑANAZA AMERICA LATINA";"";"Tel: (58) (281) 2864241";"El Carmen El peñonal Lecherías, Venezuela";"Colegios"
"U E INDEPENDENCIA DE 1810 C.A";"";"Tel: (58) (212) 4321897";"Caricuao Caracas, Venezuela";"Colegios"
"UNIDAD EDUCATIVA COLEGIO ALEJANDRO DE HUMBOLDT";"";"Tel: (58) (212) 3417466";"Urb Valle Arriba Cl C, Guatire Guatire, Venezuela";"Colegios"
"COLEGIO PRINCIPAL EDUCATIVO";"";"Tel: (58) (212) 4619767";"San Martín Caracas, Venezuela";"Colegios"
"FUNDACIÓN JUAN NEPOMUCENO CHAVEZ";"";"Tel: (58) (212) 9756321";"Valle Arriba Caracas, Venezuela";"Colegios"
"UNIDAD EDUCATIVA CENDRE";"";"Tel: (58) (212) 5520049";"San Bernardino Caracas, Venezuela";"Colegios"
"COLEGIO CHURUN MERO";"";"Tel: (58) (212) 5523554";"Cl Humboldt, San Bernardino Caracas, Venezuela";"Colegios"
"COLEGIO HUMBOLDT";"";"Tel: (58) (212) 7300580";"Alta Florida Caracas, Venezuela";"Colegios"
"COLEGIO SAN CAMILO S.R.L";"";"Tel: (58) (212) 6817750";"Coche Caracas, Venezuela";"Colegios"
"INSTITUTO CENTRO DOCENTE DE EDUCACIÓN";"";"Tel: (58) (212) 4831078";"Plaza Madariaga Caracas, Venezuela";"Colegios"
"INSTITUTO NUESTRA SEÑORA DE FÁTIMA";"";"Tel: (58) (212) 2341561";"Los Chorros Caracas, Venezuela";"Colegios"
"UNIDAD EDUCATIVA SAN ONOFRE";"";"Tel: (58) (212) 8610993";"Los Frailes Caracas, Venezuela";"Colegios"
"UNIDAD EDUCATIVA ALFA Y OMEGA";"";"Tel: (58) (212) 5527265";"San Jose Caracas, Venezuela";"Colegios"
"PREESCOLAR C.I.N.T.E.D.U.C COLEGIO DE INTEGRACIÓN EDUCATIVA";"";"Tel: (58) (212) 7303402";"La Florida Caracas, Venezuela";"Colegios"
"UNIDAD EDUCATIVA ALCAZAR DEL CENTRO";"";"Tel: (58) (212) 4844384";"Santa Teresa Caracas, Venezuela";"Colegios"
"ESCUELA NACIONAL BOGOTÁ";"";"Tel: (58) (212) 6312784";"El Cementerio Caracas, Venezuela";"Colegios"
"COLEGIO LA SALLE";"";"Tel: (58) (212) 7931545";"Los Caobos Caracas, Venezuela";"Colegios"
"COLEGIO SANTA MÓNICA";"";"Telefax: (58) (212) 6931696";"Cl Ramón Ignacio Méndez, Santa Mónica Caracas, Venezuela";"Colegios"
"GRUPO ESCOLAR NACIONAL DR G DELGADO P";"";"Tel: (58) (212) 6828002";"El Valle Caracas, Venezuela";"Colegios"
"ISEIT C.A";"";"Tel: (58) (212) 9435503";"La Trinidad Caracas, Venezuela";"Colegios"
"UEA MANUEL FELIPE TOVAR";"";"Tel: (58) (212) 3637523";"Av Ppal, Guarenas Guarenas, Venezuela";"Colegios"
"UNIDAD EDUCATIVA CIUDAD CASARAPA C.A";"";"Tel: (58) (212) 3622997";"Ciudad Casarapa, Guarenas Guarenas, Venezuela";"Colegios"
"UNIDAD EDUCATIVA PRIVADA FAYOL Y TAYLOR";"";"Tel: (58) (212) 4325586";"Caricuao Caracas, Venezuela";"Colegios"
"ASOCIACIÓN PARA UNA NUEVA EDUCACIÓN APUNE";"";"Tel: (58) (212) 7820665";"Cnas De Los Caobos Caracas, Venezuela";"Colegios"
