"FARMACIA ESCORCHE, C.A.";"";"Tel: (58) (212) 3624607";"Cl. Comercio, Guarenas Guarenas, Venezuela";"Medicamentos - Productos Cuidado Personal"
"COMERCIALIZADORA Y DISTRIBUIDORA ECONOCLEAN, C.A.";"";"Tel: (58) (283) 2315250";"Av. Fco Miranda, Pueblo Nuevo S El Tigre, Venezuela";"Medicamentos - Productos Cuidado Personal"
"FARMACIA TARIBA,S.R.L";"";"Tel: (58) (273) 5332574";"La corolina Barinas, Venezuela";"Medicamentos - Productos Cuidado Personal"
"FARMACIA LAS MERCEDES DE LA 20, C.A.";"";"Tel: (58) (212) 2522003";"Con Calle 14 Y 15 Avenida 20 Caracas, Venezuela";"Medicamentos - Productos Cuidado Personal"
"FARMACIA INTEGRAL LA TAHONA";"";"Tel: (58) (212) 9452833";"La Tahona - Caracas Caracas, Venezuela";"Medicamentos - Productos Cuidado Personal"
"FARMACIA MERIDA, C.A.";"";"Tel: (58) (282) 4242220";"Av. Merida Anaco, Venezuela";"Medicamentos - Productos Cuidado Personal"
"LABORATORIO DENTAL DENTACRILL PS, C.A.";"";"Tel: (58) (283) 2354395";"CI. Miguel Otero Silva El Tigre, Venezuela";"Medicamentos - Productos Cuidado Personal"
"SIAM FARMACEUTICA C.A.";"";"Tel: (58) (212) 9858633";"Av. Circunvalación Del Sol, Centro Profesional Santa Paula, Torre B, Piso 12, Ofic. 1210 Caracas, Venezuela";"Medicamentos - Productos Cuidado Personal"
"LABORATORIO BACTERIOLÓGICO Y CLÍNICO TIRADO CASTRILLO, C.A.";"";"Tel: (58) (251) 2318051";"Cr. 17 E/Av. Vargas Y 19 Barquisimero, Estado Lara Barquisimeto, Venezuela";"Medicamentos - Productos Cuidado Personal"
"FARMACIA AYACUCHO";"";"Tel: (58) (277) 2914425";"Calle 4, Centro Colón, Venezuela";"Medicamentos - Productos Cuidado Personal"
"INVERSIONES LA CHUCUREÑA, C.A.";"";"Tel: (58) (212) 3232746";"Av. Barlovento, Higuerote Caracas, Venezuela";"Medicamentos - Productos Cuidado Personal"
"FARMACIA LA CANDELARIA, C.A.";"";"Tel: (58) (276) 3563325";"Paramillo San Cristóbal, Venezuela";"Medicamentos - Productos Cuidado Personal"
"FARMACIA IMPRODEN, C.A.";"";"Tel: (58) (276) 3467451";"Av. Lucio Oquendo San Cristóbal, Venezuela";"Medicamentos - Productos Cuidado Personal"
"DISTRIBUIDORA ORDOBAN, O & N";"";"Tel: (58) (212) 3524052";"Av. Ppal. De La Atlántida, Cl.11 Edif., Piso 1, Loc. 4, Catia La Mar Caracas, Venezuela";"Medicamentos - Productos Cuidado Personal"
"J J SUMINISTROS, C.A.";"";"Tel: (58) (286) 9236039";"Calle Cabudare, Campo A-I Ciudad Guayana Puerto Ordaz, Venezuela";"Medicamentos - Productos Cuidado Personal"
"FACE COSMETICS, C.A.";"";"Tel: (58) (212) 7166102";"Santa Teresa Caracas, Venezuela";"Medicamentos - Productos Cuidado Personal"
"FARMACIA MAMA CIRA, S.R.L.";"";"Tel: (58) (261) 7644467";"Br. Altamira, Av. 19dNú106a-154 La Pomona Maracaibo, Venezuela";"Medicamentos - Productos Cuidado Personal"
"FARMACIA QUIRUMED, C.A.";"";"Tel: (58) (293) 4311266";"Cl Vela D Cumaná, Venezuela";"Medicamentos - Productos Cuidado Personal"
"DISTRIBUIDORA PUNTO DE BELLEZA";"";"Tel: (58) (293) 2311622";"Av. Francisco de Miranda,Sector pueblo Nuevo Norte (Fte E/S Texaco),El Tigre, Edo.Anzoategui Cumaná, Venezuela";"Medicamentos - Productos Cuidado Personal"
"FARMACIA EL AMPARO";"";"Tel: (58) (243) 2710384";"CI Venezuela, Sta Rita, Nú 54 Maracay, Venezuela";"Medicamentos - Productos Cuidado Personal"
"CORPORACIÓN EL GUARDIAN, C.A.";"";"Tel: (58) (258) 7660411";"Cl. A, Zona Industrial Tinaquillo, Venezuela";"Medicamentos - Productos Cuidado Personal"
"DISTRIBUIDORA DIOFEL, C.A.";"";"Tel: (58) (212) 8701452";"Pérez Bonalde - Caracas Caracas, Venezuela";"Medicamentos - Productos Cuidado Personal"
"FARMACIA FATIMA, C.A.";"";"Tel: (58) (244) 4471606";"Av. Bolívar - Cagua Cagua, Venezuela";"Medicamentos - Productos Cuidado Personal"
"FARMA CENTRO, C.A.";"";"Tel: (58) (286) 9714870";"Av. 5, San Félix Ciudad Guayana San Félix, Venezuela";"Medicamentos - Productos Cuidado Personal"
"FARMACIA CENTRAL 19, S.R.L.";"";"Tel: (58) (243) 2692653";"CI. Mariño, 19 de Abril Maracay, Venezuela";"Medicamentos - Productos Cuidado Personal"
"FARMACIA LAS FLORES, S.A.";"";"Tel: (58) (282) 4552971";"Cl Las Flores, Inavi Cantaura, Venezuela";"Medicamentos - Productos Cuidado Personal"
"FARMACIA MIRANDA";"";"Tel: (58) (266) 3210250";"Frente A La Plaza Miranda Avenida 2 Puertos de Altagracia, Venezuela";"Medicamentos - Productos Cuidado Personal"
"PANQUIMICA C.A.";"";"Telefax: (58) (212) 9781075";"Cl. Girasol, Prados del Este Caracas, Venezuela";"Medicamentos - Productos Cuidado Personal"
"FARMACIA CARMEN PRATO";"";"Tel: (58) (286) 9340420";"Ruta 2 Vista al Sol Ciudad Guayana San Félix, Venezuela";"Medicamentos - Productos Cuidado Personal"
"FARMACIAS X";"";"Tel: (58) (212) 5780447";"Av. Este O, Sur 19 Y 21 Av. Av Este 2, La Candelaria Centro Parque Caraca s Local 1, Planta Baja Caracas, Venezuela";"Medicamentos - Productos Cuidado Personal"
"ARNAMAR, CA C";"";"Tel: (58) (293) 3610570";"Transversal 4 Este No. 32, Urb Ind. Cloris, Apdo. Postal No. 34, Guarenas Edo. Miranda Cumaná, Venezuela";"Medicamentos - Productos Cuidado Personal"
"DISTRIBUIDORA KAROL";"";"Tel: (58) (265) 6313225";"Av. Bolivar, N³ 4 Ciudad Ojeda, Venezuela";"Medicamentos - Productos Cuidado Personal"
"SURGIMED, C.A.";"";"Tel: (58) (212) 7636413";"Av. Francisco Solano, Sabana Grande Caracas, Venezuela";"Medicamentos - Productos Cuidado Personal"
"FARMACIA DEL DR. AHORRO";"";"Tel: (58) (212) 5780916";"Esq. Pele El Ojo. La Candelaria (Fte. Al Liceo Andrés Bello) Caracas, Venezuela";"Medicamentos - Productos Cuidado Personal"
"EL RINCÓN DE TU MASCOTA "PIKI PAKA"";"";"Tel: (58) (243) 2177647";"Santa Rosa, 5ta Av. Maracay, Venezuela";"Medicamentos - Productos Cuidado Personal"
"FARMACIA CASABLANCA";"";"Tel: (58) (281) 2814455";"Av Americo Vespucio Lecherías, Venezuela";"Medicamentos - Productos Cuidado Personal"
"FARMACIA LAS COLINAS, C.A.";"";"Telefax: (58) (212) 7531555";"Caurimare, Cnas De Bello Monte Caracas, Venezuela";"Medicamentos - Productos Cuidado Personal"
"FARMACIA PRINCIPAL";"";"Tel: (58) (264) 3712222";"Sector El Dividive -Cabimas Cabimas, Venezuela";"Medicamentos - Productos Cuidado Personal"
"CLÍNICA VETERINARIA PUERTO LA CRUZ";"";"Tel: (58) (281) 2695227";"Av. Bolívar Puerto de  la Cruz, Venezuela";"Medicamentos - Productos Cuidado Personal"
"DISTHOCA C.A";"";"Tel: (58) (281) 2773412";"Av. 1, Los Montones Barcelona, Venezuela";"Medicamentos - Productos Cuidado Personal"
"FARMADESCUENTOS";"";"Tel: (58) (247) 3410243";"Fuerzas Armadas San Fernando de Apure, Venezuela";"Medicamentos - Productos Cuidado Personal"
"FARMACIA GERMANIA";"";"Tel: (58) (281) 6329335";"Av. Germania Barcelona, Venezuela";"Medicamentos - Productos Cuidado Personal"
"FARMACIA EMPRESARIAL, C.A.";"";"Tel: (58) (274) 2713950";"Av Bolivar Resd. Dorali Pb Local1 Mérida, Venezuela";"Medicamentos - Productos Cuidado Personal"
"COMERCIALIZADORA LIBERTAD C.A.";"";"Tel: (58) (275) 8810634";"Av. 14 La Inmaculada El Vigía, Venezuela";"Medicamentos - Productos Cuidado Personal"
"FARMACIA DON BOSCO III, C.A.";"";"Tel: (58) (212) 2651370";"Av. L Roche, Altamira Sur Caracas, Venezuela";"Medicamentos - Productos Cuidado Personal"
"FARMACIA CARONI, C.A.";"";"Tel: (58) (286) 9740468";"Centro Ciudad Guayana San Félix, Venezuela";"Medicamentos - Productos Cuidado Personal"
"FARMACIA BERMUDEZ";"";"Tel: (58) (243) 2453097";"Av. Bermidez Maracay, Venezuela";"Medicamentos - Productos Cuidado Personal"
"ECONOMAX";"";"Tel: (58) (241) 8388212";"Av. Industrial, La Isabelica Valencia, Venezuela";"Medicamentos - Productos Cuidado Personal"
"CLI LABORATORIO, C.A.";"";"Tel: (58) (251) 2546855";"Urbanización El Parque, Torre Delta, 2do. Piso Barquisimeto - Edo. Lara Barquisimeto, Venezuela";"Medicamentos - Productos Cuidado Personal"
"FARMACIA ALTO CHAMA";"";"Tel: (58) (274) 2711670";"Sc Alto Chama Mérida, Venezuela";"Medicamentos - Productos Cuidado Personal"
"VENEZONALA DE ALIMENTOS Y MEDICINAS, C.A. VENALMED, C.A.";"";"Tel: (58) (212) 5423384";"Edif. El Viejo, Mezzanina Esq. Cipreses A Hoyo, Caracas Santa Teresa Caracas, Venezuela";"Medicamentos - Productos Cuidado Personal"
"FARMACIA COROMOTO";"";"Tel: (58) (258) 7662084";"Av. Miranda, Tinaquillo Tinaquillo, Venezuela";"Medicamentos - Productos Cuidado Personal"
"FARMACIA MUNICIPAL DE LA INDEPENDENCIA";"";"Tel: (58) (254) 2324828";"Av. Libertador San Felipe, Venezuela";"Medicamentos - Productos Cuidado Personal"
"FARMACIA ORTOPEDICA, C.A.";"";"Tel: (58) (281) 2676043";"Av. Luis Razatti, Vista Alta Puerto de  la Cruz, Venezuela";"Medicamentos - Productos Cuidado Personal"
"FARMACIA HOMEOPATICA HAHNEMANN";"";"Tel: (58) (212) 5766149";"Esq. Monroy, La Candelaria Caracas, Venezuela";"Medicamentos - Productos Cuidado Personal"
"FARMACIA MATIYURE SRL";"";"Tel: (58) (247) 8821843";"Av. Los Centauros Achaguas, Venezuela";"Medicamentos - Productos Cuidado Personal"
"FARMACIA LAS ADJUNTAS S.R.L.";"";"Tel: (58) (212) 4336534";"Av. Sector Santa Cruz, Macarao Caracas, Venezuela";"Medicamentos - Productos Cuidado Personal"
"FARMACIA BELEN, C.A.";"";"Tel: (58) (261) 7531805";"A 50 Mtros de La Clinica La Sagrada Familia St. Amparo, Edif. Los Vicentes Cl 83 Amparo Maracaibo, Venezuela";"Medicamentos - Productos Cuidado Personal"
"FARMACIA SAAS LOS COLORADOS";"";"Tel: (58) (241) 8589554";"Av. G. Blanco, Los Colorados Valencia, Venezuela";"Medicamentos - Productos Cuidado Personal"
"AUTO FARMACIA ANDES, S.R.L.";"";"Tel: (58) (241) 8342963";"Tercera Av. La Isabelica Valencia, Venezuela";"Medicamentos - Productos Cuidado Personal"
"FARMACIA URIBANTE";"";"Tel: (58) (212) 2858465";"Sebucán - Caracas Caracas, Venezuela";"Medicamentos - Productos Cuidado Personal"
"DENTAL-ART INVERSIONES CA";"";"Tel: (58) (212) 6936058";"Caracas Caracas, Venezuela";"Medicamentos - Productos Cuidado Personal"
"AGRÍCOLA LLANO LARGO, C.A.";"";"Tel: (58) (212) 6315672";"Prado de María - Caracas Caracas, Venezuela";"Medicamentos - Productos Cuidado Personal"
"FARMANUTRY C.A.";"";"Tel: (58) (212) 4723054";"Vista Alegre Caracas, Venezuela";"Medicamentos - Productos Cuidado Personal"
"FARMACIA ORGANICA, C.A.";"";"Tel: (58) (235) 3415058";"Av. Romulo Gallegos, Centro Valle de la Pascua, Venezuela";"Medicamentos - Productos Cuidado Personal"
"FARMACIA SOLIDA 2002, C.A.";"";"Tel: (58) (212) 5627434";"Esq. San Luis A Santa Isabel, San José Caracas, Venezuela";"Medicamentos - Productos Cuidado Personal"
"FARMACIA LA FACULTAD";"";"Tel: (58) (243) 2455408";"Edif. Tello, Loc. 86-1, Pb Maracay, Venezuela";"Medicamentos - Productos Cuidado Personal"
"CLÍNICA VETERINARIA HOUSE ANIMAL'S";"";"Tel: (58) (243) 2359114";"Santa Ana-Maracay Maracay, Venezuela";"Medicamentos - Productos Cuidado Personal"
"DROFARMA, C.A.";"";"Tel: (58) (251) 2315498";"Av. Venezuela Barquisimeto, Venezuela";"Medicamentos - Productos Cuidado Personal"
"ODONTOCERAMICA BARRIOS, S.R.L";"";"Tel: (58) (261) 7928841";"Centro Profesional Villa Consuelo Av. 4,5 de Julio Maracaibo, Venezuela";"Medicamentos - Productos Cuidado Personal"
"DI BLASI F., MARALY DRA.";"";"Tel: (58) (295) 2627089";"Los Robles-Porlamar Porlamar, Venezuela";"Medicina Estética"
"MEDICINA ESTETICA VITAE";"";"Tel: (58) (281) 2871653";"Av.Intercomunal- Barcelona Barcelona, Venezuela";"Medicina Estética"
"UNIDAD DE MEDICINA ESTÉTICA Y CIRUGÍA PLÁSTICA SILUETA PERFECTA";"";"Tel: (58) (212) 5781255";"Av. Panteon San Bernardino Centro Caracas, Dg. Al Hospital Clínicas Carac as, Piso 2, Cons 2-E Caracas, Venezuela";"Medicina Estética"
"MEDICAS BOLIVAR";"rosalcc@yahoo.es";"Cel.: (58) 3118106275";"Atiende en Colon desde su sede principal en Pasto Colón, Venezuela";"Medicina Ortomolecular"
"SALAS, ALBERTO J. DR.";"";"Tel: (58) (276) 3435138";"Ctro Clinico San Cristobal Piso 6, Consultorio 606 Santa Ines San Cristóbal, Venezuela";"Médicos Ginecólogos Menopausia"
"RISQUEZ A., ROBERTO A. DR.";"";"Tel: (58) (276) 3420475";"Centro de Cirugia San Sebastian Av. Ppal, Pueblo Nuevo San Cristóbal, Venezuela";"Médicos Ginecólogos Menopausia"
"CEQUEDA, EFRAIN R";"";"Tel: (58) (243) 2320545";"Centro Medico Maracay Consultorio Medico 105 Ext 232 Las Delicias, El Bos que Maracay, Venezuela";"Médicos Urología Pediátrica"
"TEXAS DE OCCIDENTE, C.A.";"";"Telefax: (58) (261) 7378816";"Calle 52, Las Cabrias Número 114-91 Los Estanques, Maracaibo Maracaibo, Venezuela";"Metalmecánica"
"METALOCK VENEZUELA C.A";"";"Tel: (58) (212) 9447153";"Cl Colegio Americano Loc 37-24 Caracas, Venezuela";"Metalmecánica"
"DIPUMECA C.A";"";"Tel: (58) (212) 3911322";"Caracas Caracas, Venezuela";"Metalmecánica"
"IMOCON DE VENEZUELA";"";"Tel: (58) (241) 8325930";"C.E Este Oeste Loc 25 Cl Este Oeste 2 Con Av Norte Sur 3, Zona Ind Norte Valencia Edo Carabobo Valencia, Venezuela";"Metalmecánica"
"METALMECANICA MITECA, C.A.";"";"Tel: (58) (241) 8354507";"Av. L. Alvarado Valencia, Venezuela";"Metalmecánica"
"INDUSTRIA METALMECANICA ZERRI, C.A.";"";"Tel: (58) (244) 3225554";"Zona Ind.La Chapa La Victoria, Venezuela";"Metalmecánica"
"VENEZOLANA DE TORNOS C.A. VENTORCA";"";"Tel: (58) (283) 2353614";"Av. España, Dist El Tigre, Venezuela";"Metalmecánica"
"IMECO C.A.";"";"Tel: (58) (286) 9945577";"Zona Industrial Ciudad Guayana Puerto Ordaz, Venezuela";"Metalmecánica"
"HERTEC C.A";"";"Tel: (58) (212) 9915397";"Av. Ppal Santa Rosa De Lima Caracas, Venezuela";"Metalmecánica"
"TECNO ACERO DE VENEZUELA";"";"Tel: (58) (291) 6431032";"Av. Alirio Ugarte Pelayo Maturín, Venezuela";"Metalmecánica"
"INDUSTRIAS METALMECANICA FERROZ C.A";"";"Tel: (58) (212) 5724874";"La Candelaria Caracas, Venezuela";"Metalmecánica"
"METAL MECANICA 2000.C.A";"";"Tel: (58) (212) 3325551";"Cl Real Pariata Maiquetia Caracas, Venezuela";"Metalmecánica"
"MATRICERIA INDUSTRIAL ARAGUA, C.A.";"";"Tel: (58) (244) 3213542";"Zona Industrial Soco- L Victoria La Victoria, Venezuela";"Metalmecánica"
"TRANSMETALCA";"";"Telefax: (58) (286) 9943640";"Transv.A, Manzana 9,Ud-321 Ciudad Guayana Puerto Ordaz, Venezuela";"Metalmecánica"
"DISTRIBUIDORA PRODUCTOS INDUSTRIALES E ALEMANIA, C.A.";"";"Tel: (58) (241) 8717027";"A. Boyaca 103 Zona Ind Castillito Valencia, Venezuela";"Metalmecánica"
"SEYMA SUPPLY, C.A";"";"Tel: (58) (265) 6624893";"Frente A Residencia Giomar Av. Internacional Ciudad Ojeda, Venezuela";"Metalmecánica"
"ASERIA C.A.";"";"Tel: (58) (286) 9941731";"Parcelamiento, Ud3-21 Zona Ind Matanzas Ciudad Guayana Puerto Ordaz, Venezuela";"Metalmecánica"
"METAL MECANICA BENSA, C.A";"";"Telefax: (58) (261) 7612822";"A 100 Mts, Plaza Las Banderas Manzanillo Maracaibo, Venezuela";"Metalmecánica"
"JC METAL MECANICA, C.A.";"";"Tel: (58) (241) 8724605";"Cl.Plaza Los Jarales Valencia, Venezuela";"Metalmecánica"
"METALMECANICA RELEVEN C.A.";"";"Telefax: (58) (286) 9940451";"Zona Industrial 321 Ciudad Guayana Puerto Ordaz, Venezuela";"Metalmecánica"
"MECANIZADOS DEL SUR C.A.";"";"Tel: (58) (286) 9943694";"Interno A Regevensa Ciudad Guayana Puerto Ordaz, Venezuela";"Metalmecánica"
"INSUSELCA";"";"Tel: (58) (261) 7559903";"C.C. Ciudad Cumbres Loc. 5 Cumbres de Maracaibo Maracaibo, Venezuela";"Metalmecánica"
"FERREARTE S.R.L.";"";"Tel: (58) (261) 7534818";"Av. 28 (La Limpia), No. 70 - 07, Maracaibo Maracaibo, Venezuela";"Metalmecánica"
"POLIMEROS Y MINERALES, C.A. - SAFRA, C.A.";"";"Tel: (58) (212) 6333225";"Av. El Cortijo, Qta. Lucana No. 15 Los Rosales, Caracas Caracas, Venezuela";"Metalmecánica"
"CRISTALMAQ C.A.";"";"Tel: (58) (286) 9943784";"Zona Industrial Matanzas Ciudad Guayana Puerto Ordaz, Venezuela";"Metalmecánica"
"BISERTORCA";"";"Tel: (58) (244) 3955777";"Ct Cagua Cagua, Venezuela";"Metalmecánica"
"METALMECANICA PANAMERICANA, C.A.";"";"Tel: (58) (249) 7934526";"Ct Panamericana, Guasdualito Bejuma, Venezuela";"Metalmecánica"
"METALMECANICA GOGAR C.A.";"";"Tel: (58) (244) 43230750";"Urb. Bolivar Norte con Calle Santa Isabel-6 La Victoria, Venezuela";"Metalmecánica"
"TOTAL PARTS & SERVICES, C.A.";"";"Tel: (58) (241) 8716593";"Urb.Ind.Castillo,C.C.CEM,Loc No.18,Vía SanDiego Valencia, Edo. Carabobo Valencia, Venezuela";"Montacargas"
"PROMINCA";"";"Tel: (58) (241) 8335319";"Z.I. Principal Norte. Av Norte Sur 3, Parcela No.84260 Valencia, Venezuela";"Montacargas"
"EL MUNDO DEL MONTACARGA C.A";"";"Telefax: (58) (241) 8252971";"Urb Sabana Larga Cl 128-A, Casa No. 107-111 Fte a C.C. Mediterranea Plaza Valencia, Venezuela";"Montacargas"
"GRÚAS BEPISA, S.R.L.";"";"Tel: (58) (251) 7189350";"Carrera 5, entre Calles 19 y 20 Barquisimeto, Venezuela";"Montacargas"
"SERVICIO LAREMAT C.A";"";"Tel: (58) (212) 2543085";"Prado Maria Caracas Venezuela Caracas, Venezuela";"Montacargas"
"MONTAVEN C.A";"";"Tel: (58) (212) 3736701";"Km 15 Carr Panamericana Centro L a Colina Nivel C3 Loc C3 14,San Antonio De Los Altos Caracas, Venezuela";"Montacargas"
"MULTISERRVICIOS MAPORAL C.A";"";"Tel: (58) (212) 6313215";"Cl La Saleya Prado De Maria Caracas, Venezuela";"Montacargas"
"IMPORTADORA LAS GEMELAS,C.A.";"";"Tel: (58) (261) 6140928";"Av. 28 La Limpia, La Limpia Maracaibo, Venezuela";"Montacargas"
"MONTACARGAS MONNEL C.A.";"";"Telefax: (58) (243) 8342003";"Maracay Maracay, Venezuela";"Montacargas"
"MONTACARGAS HERLAY, C.A.";"";"Tel: (58) (243) 6436264";"Av. Los Aviadores c/c Calle El Progreso No.75 Barrio 12 De Febrero Maracay, Venezuela";"Montacargas"
"METALMECANICA INDUSTRIALES DE VENEZUELA, C.A.";"";"Tel: (58) (261) 7566845";"Carretera Los Lirios, No. T-750 El Marite, Maracaibo, Venezuela Maracaibo, Venezuela";"Montacargas"
"C.A. VENEZOLANA DE MONTACARGAS RAYMOND";"";"Tel: (58) (212) 6333829";"Calle Tamanaco Caracas, Venezuela";"Montacargas"
"H. LUDEMAN C.A";"";"Tel: (58) (212) 9442010";"Caracas Caracas, Venezuela";"Montacargas"
"GARAGE Y ESTACIONAMINETO PLAYA GRANDE I.C.A";"";"Tel: (58) (212) 3527864";"Av Principal Playa Grande Frente Residencia Dwelfines Ii Catia La Mar Caracas, Venezuela";"Montacargas"
"TECNAVAL";"";"Tel: (58) (212) 2857822";"4ta Av Entre 8va Y 9na Trasv No 1106 Los Palos Grandes Caracas 1060 Caracas, Venezuela";"Montacargas"
"ALQUILERES MONTACARGAS C.A ALQUIMONCA";"";"Tel: (58) (212) 9433636";"Caracas Caracas, Venezuela";"Montacargas"
"MAWILCA MONTACARGAS C.A";"";"Tel: (58) (212) 5142958";"Av La Facultad Los Chaguaramos Caracas, Venezuela";"Montacargas"
"BARAKA DE VENEZUELA C.A";"";"Tel: (58) (241) 8715130";"Cl. 97 Zona Ind Castillito Valencia, Venezuela";"Montacargas"
"SERPREGENCA C.A";"";"Tel: (58) (212) 4314192";"Cl C Esq A Urb Ind Ruiz Pineda Caricuao Caracas Caracas, Venezuela";"Montacargas"
"MULTICARGA C.A.";"";"Tel: (58) (241) 8386668";"Calle Mariño No. 7 Los Guayos Valencia, Venezuela";"Montacargas"
"METALURGICA NACIONAL, C.A.";"";"Tel: (58) (251) 4411959";"Carrera 1, N³3b-150 , Zona Industrial II Barquisimeto, Venezuela";"Montacargas"
"AMERICANA DE MONTACARGAS C.A.";"";"Tel: (58) (212) 4235344";"Cl Principal LA yaguara C/2da Trasv Edif Guaica Piso 2 Caracas, Venezuela";"Montacargas"
"SÁNCHEZ & CIA, S.A.";"";"Tel: (58) (212) 6311922";"Autop. Roosevelt, Prado De María Caracas Caracas, Venezuela";"Montacargas"
"ELEVACARGAS ARAGUA";"";"Tel: (58) (243) 5541387";"Av. Ayacucho Con Bolivar Edif. Don Antonio L.8 Maracay, Venezuela";"Montacargas"
"MONTASCANI C.A.";"";"Tel: (58) (241) 4513162";"Urb. Prebo III Calle 137 119-41 Valencia, Venezuela";"Montacargas"
"CONTORCA";"";"Tel: (58) (241) 8781685";"Av. Ppal, Zona Ind El Recreo Valencia, Venezuela";"Montacargas"
"TOYOTA INDUSTRIAL DE VENEZUELA C.A";"";"Tel: (58) (212) 2108779";"Av Intercomunal Guarenas Guatire Urb Ind El Marques Cl Faata Guatire Edo Miranda Venezuela Guatire, Venezuela";"Montacargas"
"MONTACARGAS DELTA";"";"Tel: (58) (241) 8332191";"Zona Industrial Norte, Av Ernesto Branger, Parcela 141 Diagonal Al Cuerpo De Bomberos Via Aeropuerto Valencia, Venezuela";"Montacargas"
"MONTACARGAS Y GRUAS DE OCCIDENTE, C.A.";"";"Tel: (58) (261) 7358630";"Km2 1/2Vía Perijá fte al ant monum del carro chocado Maracaibo-Est Zulia Maracaibo, Venezuela";"Montacargas"
"TOCARS ARAGUA C.A.";"";"Telefax: (58) (241) 8342244";"Av.Michelena, C.C. Neveri, Pb Local 87 Al 99 Valencia, Venezuela";"Montacargas"
"MONTACARGAS ALVIC, C.A";"";"Tel: (58) (212) 6254590";"3era Call Prolongacion Zuloaga Loc 3 Los Rosales Caracas Caracas, Venezuela";"Montacargas"
"MONTACARGAS TOYOTA 8FG/8FD";"";"Tel: (58) (271) 2311119";"Av. Bolivar,Sector el Country,Edif.Toyoandina,Valera,Edo trujillo Valera, Venezuela";"Montacargas"
"GRÚAS AMÉRICO C.A";"";"Tel: (58) (212) 6616505";"Av. Teresa De La Parra Edif. Raniero Sta Mónica Caracas, Venezuela";"Montacargas"
"REPRESENTACIONES INDUSTRIALES RIMERI C.A";"";"Tel: (58) (212) 6931735";"Av Universitaria Edif Odeon Piso 11-P.H-A Los Charaguamos Caracas, Venezuela";"Montacargas"
"MONTACARGAS CASTILLITO, C.A.";"";"Telefax: (58) (241) 8718411";"Urb. Terrazas De Castillito,C.C. Infra,Local 12 Valencia, Venezuela";"Montacargas"
"SANCHES & CÍA, S.A.";"";"Tel: (58) (281) 2752167";"Vía Alterna el Espejo Barcelona, Venezuela";"Montacargas"
"FREMO, C.A.";"";"Tel: (58) (243) 2456364";"Av. Aragua Z.I. San Miguel. No.4 Maracay, Venezuela";"Montacargas"
"GRUAS TACORONTE C.A";"";"Tel: (58) (212) 5719521";"Esq Consolacion A Plazoleta Saria Caracas, Venezuela";"Montacargas"
"TALLER SERDIMERCA S.R.L";"";"Tel: (58) (212) 3315114";"Litoral Caracas, Venezuela";"Montacargas"
"ELECTRO AUTO EUROPA MONTACARGA, C.A.";"";"Tel: (58) (243) 2334971";"Prolongacion Av.99 Sector La Barraca Galpon No.38 Maracay, Venezuela";"Montacargas"
"MONTACARGAS 2000, C.A.";"";"Tel: (58) (241) 8578385";"Av. Michelena, Calle 91,No. 86-242 Valencia, Venezuela";"Montacargas"
"MONTACARGAS ELECTRICOS C.A";"";"Tel: (58) (212) 3111856";"Z. I Acasio Galpón 5-A Urb San Luis San Antonio De Los Altos Caracas, Venezuela";"Montacargas"
"HEAVY INDUSTRIES CO.LTD. COSNTRUCTION EQUIPMENT DIVISION";"";"Tel: (58) (212) 2715124";"1era. Av. Buena Vista con Calle San Antonio, Piso 1 Edif. Befca, Urb.Buen a Vista Caracas, Venezuela";"Montacargas"
"MONPASERCA";"";"Tel: (58) (281) 2689866";"Av Interconmunal ,Sector Isla de Cuba Puerto de  la Cruz, Venezuela";"Montacargas"
"WINTOCA";"";"Tel: (58) (212) 3810234";"Av. Int. Guarenas Guatire Caracas, Venezuela";"Montacargas"
"MONTACARGAS A1 C.A";"";"Tel: (58) (212) 4518874";"Av A-1 Qta Claret Urb El Pinar El Paraiso Caracas Caracas, Venezuela";"Montacargas"
"CLARK DE VENEZUELA";"";"Tel: (58) (251) 7184167";"Calle69 con Av.66,No.66-10 Sector los Olivos Barquisimeto, Venezuela";"Montacargas"
"ALFACARGA MAQUINARIAS C.A.";"";"Telefax: (58) (241) 8080886";"Zona Industrial Norte, Av Henry Ford,Parcelas B1-B Las Caracaritas, Via A eropuerto Valencia, Venezuela";"Montacargas"
"MONTACARGAS COGUA S.R.L.";"";"Telefax: (58) (244) 4476954";"Carretera Nacional La Villa Cagua, Venezuela";"Montacargas"
"MONTACARGAS REIMAR C.A";"";"Tel: (58) (212) 6615085";"Av Teresa De La Parra Edif Raniero Sta Monica Caracas, Venezuela";"Montacargas"
"MOVIL ENLACE";"";"Tel: (58) (212) 5770922";"Cl. La Candelaria Caracas, Venezuela";"Móviles"
"MOVIL CARS COMUNICACIONES A.C.";"";"Tel: (58) (243) 8589330";"Av. Diaz Moreno, Edif. Don Pelayo Torre B, Piso 9, Ofic. 9-i Maracay, Venezuela";"Móviles"
"DEPÓSITOS MÓVILES, C.A.";"";"Tel: (58) (212) 2322755";"Caracas Caracas, Venezuela";"Móviles"
"ARCHIVOS MÓVILES ACDI C.A.";"";"Tel: (58) (212) 2563366";"Av Chicago Centro Empresarial "Sturgis" 2 Piso La California Sur Caracas, Venezuela";"Móviles"
"OFFICE CENTER MOVIL, C.A.";"";"Tel: (58) (276) 3579962";"Cl. 16, la Romera San Cristóbal, Venezuela";"Móviles"
"MOVIL MOTOR SERVICES, C.A.";"";"Tel: (58) (243) 5515506";"Av Bolívar Este, Galpón Nro. 283-4 Diagonal A Cavim Tapa-Tapa, Maracay Maracay, Venezuela";"Móviles"
"MOTO MOVIL, CA";"";"Tel: (58) (241) 8642678";"Av. Bolivar Valencia, Venezuela";"Móviles"
"TAXIS MOVIL ENLACE RL";"";"Tel: (58) (212) 5422346";"Esq. de Gobernador, Santa Rosalia Caracas, Venezuela";"Móviles"
"M.E.S. MOVIL EXPRESS SERVICE";"";"Tel: (58) (212) 8084207";"Caracas Caracas, Venezuela";"Móviles"
"MOVIL CENTER CHUAO, C.A.";"";"Telefax: (58) (212) 9912932";"Av Río De Janeiro, Frente Al Aeropuerto La Carlota, Chuao, Caracas Caracas, Venezuela";"Móviles"
"RADIO MOVIL DIGITAL DE VENEZUELA";"";"Tel: (58) (261) 7519390";"AV. 15 Las Delicias Esq.Cl.7. Ctro. Com. Paseo 72 Ph. Maracaibo, Venezuela";"Móviles"
"SISTEMAS DE LAVADO MOVIL PW C.A";"";"Tel: (58) (212) 9916537";"Las Mercedes Caracas, Venezuela";"Móviles"
"MÓVIL EXPRESS CENTER 3 C.A";"";"Tel: (58) (212) 5515912";"San Bernardino Caracas, Venezuela";"Móviles"
"LINEA TAXIS MOVIL PLAZA VENEZUELA";"";"Tel: (58) (212) 7939242";"Terminal Caracas, Venezuela";"Móviles"
"SOLUCIONES Y SISTEMAS C. A.";"";"Tel: (58) (291) 6414345";"Av Juncal entre carreras 14 y 15 , Edif Tecnovanguardia pb L-1 Sector Los Bloques Maturín, Venezuela";"Muebles Para Comercios"
"Industrias Metálicas 2000";"ventas@metalicas2000.com";"Cel.: (58) 3206680047";"Atiende en Villa Del Rosario desde su sede principal en Medellín Villa del Rosario, Venezuela";"Muebles Y Articulos Metalicos"
"EL REMATE DE LAS VITRINAS, C.A.";"";"Tel: (58) (212) 6312572";"Av. Nva. Granada con Padre Machado Loc. Nro.6 A 50 Mts de Banesco Caracas, Venezuela";"Muebles Y Articulos Metalicos"
"ACEROS DIVERSIFICADOS STANTEX";"";"Tel: (58) (212) 9536348";"Final Cl Alameda No. 56 El Rosal Municipio Chacao Edo Miranda Caracas, Venezuela";"Muebles Y Articulos Metalicos"
"MOBICOM C.A.";"";"Tel: (58) (241) 8360802";"Calle Peña, res. Don Guillermo, Local 10 Valencia, Venezuela";"Muebles Y Articulos Metalicos"
"VITRIARAGUA, C.A.";"";"Tel: (58) (243) 2369359";"Fundación Mendoza Maracay, Venezuela";"Muebles Y Articulos Metalicos"
"METAL MUEBLES HERRARTES, C.A.";"";"Tel: (58) (212) 5321871";"Caretera Petare Sta. Lucía, Km 9 Calle Principal La Estancia,Galpón 1 Filas de Machire,Edo. Miranda, Venezuela Caracas, Venezuela";"Muebles Y Articulos Metalicos"
"POLIMOBIL C.A.";"";"Tel: (58) (212) 6938659";"Av Pdte Medina Edif Las Americas, Las Acacias Caracas, Venezuela";"Muebles Y Articulos Metalicos"
"VITRINAS MILENUM C.A.";"";"Tel: (58) (243) 4319616";"Av. Acosta Carles, salida Hacienda Villa Maracay, Venezuela";"Muebles Y Articulos Metalicos"
