"INVERSIONES WMG, C.A.";"";"Tel: (58) (212) 7613566";"Av Casanova, Sabana Grande Caracas, Venezuela";"Plantas Para Tratamiento Y Purificación De Aguas"
"SAVER GUINAND, C.A.";"";"Tel: (58) (212) 2349968";"Av Ppal. Los Ruices Caracas, Venezuela";"Plantas Para Tratamiento Y Purificación De Aguas"
"WATER SISTEMS A.Y.G. C.A";"";"Tel: (58) (212) 3472285";"Av. Palo Alto,Castillejo Guatire, Venezuela";"Plantas Para Tratamiento Y Purificación De Aguas"
"VENTRAT VENEZOLANA DE TRATAMIENTOS, S.A.";"";"Telefax: (58) (212) 5760630";"Candilito A Cruz De Candelaria Residencias Candelaria, P.H.-A, Caracas 1010 Caracas, Venezuela";"Plantas Para Tratamiento Y Purificación De Aguas"
"O T K OFICINA TÉCNICA KAMMERER, C.A.";"";"Tel: (58) (212) 2356709";"Cl Motatal, El Marqués Caracas, Venezuela";"Plantas Para Tratamiento Y Purificación De Aguas"
"JOYERIA ONIX CA NO. 1";"";"Tel: (58) (261) 7983241";"Av 15 Las Delicias Maracaibo, Venezuela";"Prenderias Y Compraventas"
"INVERSIONES JUPITER C.A.";"";"Tel: (58) (286) 9340369";"Al lado De La Tienda del Pintor Av Manuel Piar Lc N.3 Ciudad Guayana Puerto Ordaz, Venezuela";"Prenderias Y Compraventas"
"INVERSIONES GOLD ORIENTE C.A.";"";"Tel: (58) (281) 2651570";"Edifcio hachar P.B. Local 1-a Av 5 de julio, Puerto La Cruz Puerto de  la Cruz, Venezuela";"Prenderias Y Compraventas"
"INVERSIONES HORIZONTE";"";"Tel: (58) (285) 6543490";"Av Republica, Ciudad Bolivar Ciudad Bolivar, Venezuela";"Prenderias Y Compraventas"
"INVERSIONES EL DIAMANTERO";"";"Tel: (58) (212) 8623078";"Capitolio Caracas, Venezuela";"Prenderias Y Compraventas"
"IMPORTADORA TORRES";"";"Tel: (58) (276) 3468582";"Av. Parque Exposición, No. 6-83 Frente Al Mercado Pequeños Comerciante Urb.La Concordia San Cristóbal, Venezuela";"Prenderias Y Compraventas"
"INVERSORA REINA JOYAS";"";"Tel: (58) (261) 7419210";"18 De Octubre Maracaibo, Venezuela";"Prenderias Y Compraventas"
"INVERSIONES DE BRANF, C.A.";"";"Tel: (58) (212) 2616509";"Av. Luis Roche, Altamira Sur Caracas, Venezuela";"Prenderias Y Compraventas"
"SUPER EFECTIVO FRANKY'S C.A.";"";"Tel: (58) (212) 8735362";"Propatria - Caracas Caracas, Venezuela";"Prenderias Y Compraventas"
"INVERSIONES MALU, S.R.L.";"";"Tel: (58) (212) 3524139";"Av.Ppal. La Atlantida Cl. 7, La Atlantida Caracas, Venezuela";"Prenderias Y Compraventas"
"OPERADOR CAMBIARIO FRONTERIZO TÁCHIRA";"";"Tel: (58) (276) 7714690";"Cl 7a. Esquina Av. Venezuela San Antonio del Táchira, Venezuela";"Prenderias Y Compraventas"
"CASA LOYS C.A.";"";"Tel: (58) (212) 5628696";"Veroes A Jesuitas, Edif. Centro Imanta P.B. Local 3 Caracas, Venezuela";"Prenderias Y Compraventas"
"INVERSIONES MAURO";"";"Tel: (58) (269) 2467612";"Cl. Zamora Entre Bolívar y México Punto Fijo, Venezuela";"Prenderias Y Compraventas"
"INVERSIONES MASSIEL, C.A.";"";"Tel: (58) (276) 3410764";"Urb. Centro San Cristóbal, Venezuela";"Prenderias Y Compraventas"
"ALIS JOYAS, C.A.";"";"Tel: (58) (276) 7236006";"Av. Libertador, Fte. A Las Playitas San Cristóbal, Venezuela";"Prenderias Y Compraventas"
"LA NUEVA JM SRL";"";"Tel: (58) (251) 2320028";"Entre Calles 25 y 26 Centro Comercial Francia Loc-3-B Ct.19 Barquisimeto, Venezuela";"Prenderias Y Compraventas"
"INVERSIONES GOLD TIME C.A";"";"Tel: (58) (212) 9591163";"Chuao Caracas, Venezuela";"Prenderias Y Compraventas"
"CREACIONES MILTON, C.A.";"";"Tel: (58) (276) 3419231";"Av. 7ma. Centro San Cristóbal, Venezuela";"Prenderias Y Compraventas"
"INVERSIONES EL NORTEÑO";"";"Tel: (58) (281) 2675033";"Calle Sucre Centro Puerto de  la Cruz, Venezuela";"Prenderias Y Compraventas"
"CASA DE EMPEÑO LOS DUQUES";"";"Tel: (58) (275) 8814159";"Local No. 11-49 Cl 3 El Vigía, Venezuela";"Prenderias Y Compraventas"
"MEDICAS BOLIVAR";"rosalcc@yahoo.es";"Cel.: (58) 3118106275";"Atiende en Colon desde su sede principal en Pasto Colón, Venezuela";"Productos De Tocador Y Belleza"
"PANQUIMICA C.A.";"";"Telefax: (58) (212) 9781075";"Cl. Girasol, Prados del Este Caracas, Venezuela";"Productos De Tocador Y Belleza"
"COSMETICOS LA CORUÑA C.A.";"";"Tel: (58) (212) 5767152";"Av. Principal De Sarria No. 181-B Edf. Rio Sil Piso Sotano, Sarria Caracas, Venezuela";"Productos De Tocador Y Belleza"
"DISTRIBUIDORA EXITO MUNDIAL RN ANCOR";"";"Tel: (58) (281) 2687477";"C.I Democracia Puerto de  la Cruz, Venezuela";"Productos De Tocador Y Belleza"
"VARGAS";"";"Tel: (58) (212) 9498311";"Edf. Pronaca. Cl Bolivar La Trinidad Caracas. Caracas, Venezuela";"Productos De Tocador Y Belleza"
"DISTRIBUIDORA X-COLOR S, C.A.";"";"Tel: (58) (254) 2313812";"6ta Av. E/Cl 15y16 San Felipe, Venezuela";"Productos De Tocador Y Belleza"
"DROCOSCA, C.A.";"";"Tel: (58) (212) 2395433";"4ta De Horizonte El Marqués Caracas, Venezuela";"Productos De Tocador Y Belleza"
"DROGUERÙA QUIMIMARKET, C.A.";"";"Tel: (58) (212) 2427606";"La Urbina Caracas, Venezuela";"Productos De Tocador Y Belleza"
"T.O SPA TIJERA DE ORO";"";"Tel: (58) (265) 6317024";"Cl.Bermudez Diag Cantv Ciudad Ojeda, Venezuela";"Productos De Tocador Y Belleza"
"FARMA TAWIL";"";"Tel: (58) (295) 2636205";"Urb. La Arboleda Porlamar, Venezuela";"Productos De Tocador Y Belleza"
"CORAMODIO";"";"Tel: (58) (212) 2435193";"Cl 8 Sector Sur Edif Rodano, La Urbina Caracas, Venezuela";"Productos De Tocador Y Belleza"
"EL MUNDO DEL PERFUME C.A.";"";"Tel: (58) (212) 4819297";"Caracas Caracas, Venezuela";"Productos De Tocador Y Belleza"
"COSMETICOS MARBEN 2000, C.A.";"";"Tel: (58) (212) 3619595";"2da Avenida Zona Ind. Del Este Guarenas Caracas, Venezuela";"Productos De Tocador Y Belleza"
"CORPAGECA";"";"Tel: (58) (261) 6401979";"Av, 3e, Valle Frio Maracaibo, Venezuela";"Productos De Tocador Y Belleza"
"JORDAN COSMETICS, S.A.";"";"Telefax: (58) (212) 9415756";"L Minas De Baruta Caracas, Venezuela";"Productos De Tocador Y Belleza"
"COSMETICOS MEIBA S.A.";"";"Tel: (58) (212) 4225270";"Km. 14, El Junquito Urb. Ibero Américano, Cl. San José Parcela 70 Caracas, Venezuela";"Productos De Tocador Y Belleza"
"PORTAFOLIO E IMPORTACIONES AEG, C.A.";"";"Tel: (58) (212) 3936697";"Cl. Cecilo Acosta Chacao Caracas, Venezuela";"Productos De Tocador Y Belleza"
"VERIPERSONI";"";"Tel: (58) (212) 7625554";"Cl Union Sabana Grande Caracas, Venezuela";"Productos De Tocador Y Belleza"
"COSMETICOS MARY S.R.L";"";"Tel: (58) (293) 4324172";"Av. Bermudez Cumaná, Venezuela";"Productos De Tocador Y Belleza"
"COSMETICOS LABOTARIES COHER C.A";"";"Tel: (58) (212) 9434769";"Las Minas Baruta Caracas, Venezuela";"Productos De Tocador Y Belleza"
"KIA KELLY INTERNATIONAL ACADEMY, C.A";"";"Tel: (58) (261) 7927463";"San Martin, Maracaibo, Venezuela";"Productos De Tocador Y Belleza"
"ARNAMAR, CA C";"";"Tel: (58) (293) 3610570";"Transversal 4 Este No. 32, Urb Ind. Cloris, Apdo. Postal No. 34, Guarenas Edo. Miranda Cumaná, Venezuela";"Productos De Tocador Y Belleza"
"IMPORTADORA MARY C.A.";"";"Tel: (58) (285) 6322219";"Frente al C.C. Fortin Cl San José, La Lameda Ciudad Bolivar, Venezuela";"Productos De Tocador Y Belleza"
"PORRAS F. YIN M. D.R.";"";"Tel: (58) (261) 7412582";"Piso 7, Consultorio 7-03 Av. Universidad Maracaibo, Venezuela";"Productos De Tocador Y Belleza"
"AUTOMERCADO LA PARADA";"";"Tel: (58) (275) 8731762";"A 2 Cuadras del Hospital San José Tovar, Venezuela";"Productos De Tocador Y Belleza"
"DISTHOCA C.A";"";"Tel: (58) (281) 2773412";"Av. 1, Los Montones Barcelona, Venezuela";"Productos De Tocador Y Belleza"
"C.A. PROBELSA";"";"Tel: (58) (212) 2351987";"Av Ppal, Boleita Nte Caracas, Venezuela";"Productos De Tocador Y Belleza"
"MANUFACTURERA EL VIGIA, C.A.";"";"Telefax: (58) (212) 3229412";"Cl. Bonanza No. 19 El Vigia Los Teques Caracas, Venezuela";"Productos De Tocador Y Belleza"
"MASS IMPORTACIONES SA";"";"Tel: (58) (241) 8239826";"Av. Bolívar, El Recreo Valencia, Venezuela";"Productos De Tocador Y Belleza"
"COSMETICOS ROLDA";"";"Tel: (58) (241) 3832766";"Cl Industrias 1era Tv Lomas De Urquia P.B. L 5 Carrizal Edo Miranda Valencia, Venezuela";"Productos De Tocador Y Belleza"
"ARNAMAR C.A.";"";"Tel: (58) (212) 3624692";"Tv 4 Este No. 32 Urb ind Cloris Apdo Postal No. 34, Guarenas, Edo Miranda Guarenas, Venezuela";"Productos De Tocador Y Belleza"
"AMS C.A.";"";"Tel: (58) (212) 3443049";"Carr. Nac Guatire La Rosa El Desvio Caracas, Venezuela";"Productos De Tocador Y Belleza"
"AVON";"";"Tel: (58) (212) 3401000";"Av Internacional Guatire Urb El Marques, Edo Miranda Guarenas, Venezuela";"Productos De Tocador Y Belleza"
"DISTRIBUIDORA Y PERFUMERIA DULCINEA, C.A.";"";"Tel: (58) (212) 6627211";"Los Chaguaramos Caracas, Venezuela";"Productos De Tocador Y Belleza"
"VALEBRON";"";"Tel: (58) (212) 2612444";"Edf. Multivest P. 3 Av. Ppal De San Felipe Y 2da Transv. Urb. La Castella na Caracas Caracas, Venezuela";"Productos De Tocador Y Belleza"
"CAMERINO MAQUILLAJE C.A.";"";"Tel: (58) (212) 2637526";"Nivel Autopista, Chacao Caracas, Venezuela";"Productos De Tocador Y Belleza"
"PARIS CENTER C,A";"";"Tel: (58) (261) 6602755";"Av, Libertador, C.C Santa Cruz Las Playitas Sector Terreno Viejo Pasillo 11Guarico Maracaibo, Venezuela";"Productos De Tocador Y Belleza"
"REPRESENTACIONES BIOESTETIC II, C.A.";"";"Tel: (58) (212) 5161882";"Edf. Araure Ofc. 504 Caracas, Venezuela";"Productos De Tocador Y Belleza"
"FECOSCA";"";"Tel: (58) (212) 2396767";"Cl. Los Laboratorios, Los Ruices Caracas, Venezuela";"Productos De Tocador Y Belleza"
"DISTRIBUIDORA DEL PELUQUERO, S.A";"";"Tel: (58) (273) 5527348";"Av, Cruz Paredes, Centro Barinas, Venezuela";"Productos De Tocador Y Belleza"
"FACE COSMETICS, C.A.";"";"Tel: (58) (212) 7166102";"Santa Teresa Caracas, Venezuela";"Productos De Tocador Y Belleza"
"OXIGENOS ARAGUA, C.A.";"";"Tel: (58) (243) 5533454";"Santa Rosa, CI. San Miguel Maracay, Venezuela";"Productos Medicinales"
"FERRE MEDIC";"";"Tel: (58) (243) 2693715";"Calle Los Próceres, Nú 20 Sector 19 de Abril Av. Intercomunal Santiago M. Maracay, Venezuela";"Productos Medicinales"
"PRATO A, GREGORIO, DR.";"";"Tel: (58) (212) 2650196";"Inst. De Asma, Alegria E Inmunologia Av. Santa Ana, Bello Campo Caracas, Venezuela";"Productos Medicinales"
"ORTEGA T., CARLOS DR.";"";"Tel: (58) (212) 7306624";"Urb. Bello Campo, Av. Sta. Ana 10-03 Caracas, Venezuela";"Productos Medicinales"
"GIL S., MAGDALENA DRA.";"";"Tel: (58) (212) 7304455";"Instituto Clínico La Florida Cons. 5, Area E Caracas, Venezuela";"Productos Medicinales"
"DI PRISCO, MARIA C";"";"Tel: (58) (212) 7519997";"Av. Caurimare, Cnas De Bello Monte Caracas, Venezuela";"Productos Medicinales"
"ROZERCA C.A.";"";"Tel: (58) (243) 2186305";"Maracay Maracay, Venezuela";"Productos Medicinales"
"LABORATORIO Y DISTRIBUIDORA MEDICO DENTAL AN DINO";"";"Tel: (58) (276) 3446152";"7ma Avenida Casa 3-2 Centro San Cristobal San Cristóbal, Venezuela";"Productos Para El Cuidado Oral"
"CLINICA LABORATORIO PROTIS DENTAL";"";"Tel: (58) (281) 2761462";"CI. Bolivar, 29 de Marzo Barcelona, Venezuela";"Productos Para El Cuidado Oral"
"LABORATORIO DENTAL JOARCA, C.A.";"";"Tel: (58) (212) 6623774";"Av. Universitaria, Los Chaguaramos Caracas, Venezuela";"Productos Para El Cuidado Oral"
"ODONTOCERAMICA BARRIOS, S.R.L";"";"Tel: (58) (261) 7928841";"Centro Profesional Villa Consuelo Av. 4,5 de Julio Maracaibo, Venezuela";"Productos Para El Cuidado Oral"
"MEJIAS R., HUMBERTO DR.";"";"Tel: (58) (293) 4333955";"Av. Santa Rosa, La Copita Piso 1, Av Santa Rosa Cumaná, Venezuela";"Productos Para El Cuidado Oral"
"DENTAL-ART INVERSIONES CA";"";"Tel: (58) (212) 6936058";"Caracas Caracas, Venezuela";"Productos Para El Cuidado Oral"
"LABORATORIO DENTAL FERODENT, C.A.";"";"Tel: (58) (212) 8730560";"Cl. 3, Catia Caracas, Venezuela";"Productos Para El Cuidado Oral"
"TOP DENTAL, C.A.";"";"Tel: (58) (212) 9533361";"Cl. Chacaíto, Chacaíto Caracas, Venezuela";"Productos Para El Cuidado Oral"
"TECNOLOGIA DENTAL CARDENT, C.A.";"";"Telefax: (58) (212) 5616479";"Caracas Caracas, Venezuela";"Productos Para El Cuidado Oral"
"LABORATORIO DENTAL GALUE, C.A";"";"Tel: (58) (261) 7981337";"Av. 9, Tierra Negra Maracaibo, Venezuela";"Productos Para El Cuidado Oral"
"NUÑEZ G LABORATORIO DENTAL";"";"Tel: (58) (212) 2633104";"Edif. Caro. Piso 8, Ofc. 83 Av. Fco Mda, Chacao Caracas, Venezuela";"Productos Para El Cuidado Oral"
"LABORATORIO ROSDENT, C.A.";"";"Tel: (58) (212) 5776860";"Esq. Paradero La Candelaria Caracas, Venezuela";"Productos Para El Cuidado Oral"
"LABORATORIO DENTAL DENTACRILL PS, C.A.";"";"Tel: (58) (283) 2354395";"CI. Miguel Otero Silva El Tigre, Venezuela";"Productos Para El Cuidado Oral"
"LABORATORIO DENTAL MONTEC";"";"Tel: (58) (212) 2725756";"Av. Budapest, La California Norte Caracas, Venezuela";"Productos Para El Cuidado Oral"
"LABORATORIO DENTAL Y CLINICA FISCHER";"";"Tel: (58) (274) 2522974";"Viaducto Campo Elias Mérida, Venezuela";"Productos Para El Cuidado Oral"
"LABORATORIO DENTAL ITALGER C.A.";"";"Tel: (58) (212) 2661255";"Elice, Chacao Caracas, Venezuela";"Productos Para El Cuidado Oral"
"ODONTOCERAMICA, C.A.";"";"Tel: (58) (212) 2853137";"Av. R Gallegos, Santa Eduvigis Caracas, Venezuela";"Productos Para El Cuidado Oral"
"LABORATORIO DENTAL SPINELLI";"";"Tel: (58) (212) 6324155";"Cl. Luis Razetti, Entre Av. Roosvelt Y Cl. El Colegio, Qta. San Jose, Pla nta Alta Los Rosales Caracas, Venezuela";"Productos Para El Cuidado Oral"
"LABORATORIO DENTAL JUAN MALDONADO";"";"Tel: (58) (281) 2764762";"Urb. Portugal Barcelona, Venezuela";"Productos Para El Cuidado Oral"
"LABORATORIO DENTAL BEST ESTETIC";"";"Tel: (58) (276) 3472354";"Carrera 11 Nú Ro 5-26 A 50 Mts. de Trt La Concordia San Cristóbal, Venezuela";"Productos Para El Cuidado Oral"
"DIVISION DE SEGURIDAD INDUSTRIAL, C.A.DISEINCA";"";"Telefax: (58) (251) 2527043";"Cl. 11 E/Crs 24 y 25 Barquisimeto, Venezuela";"Profesionales En Vigilancia Y Seguridad"
"SERENOS MONAGAS, C.A.";"";"Tel: (58) (291) 6429635";"Calle 14 N³24, Edif. Serenos Monagas P.B., Sector Palo negro, Maturín Maturín, Venezuela";"Profesionales En Vigilancia Y Seguridad"
"ACCIÊN PREVENTIVA 24, C.A.";"";"Tel: (58) (212) 9456683";"Cl. La Solera, La Tahona Caracas, Venezuela";"Profesionales En Vigilancia Y Seguridad"
"ALERTA 900, C.A.";"";"Tel: (58) (212) 9446278";"Av. San SebastiÈn, Edif. Escorpio, La Trinidad Caracas, Venezuela";"Profesionales En Vigilancia Y Seguridad"
"PLAGECA C.A.";"";"Tel: (58) (212) 2651510";"Cl Andres Galarraga, Chacao Caracas, Venezuela";"Profesionales En Vigilancia Y Seguridad"
"CASEPRIEM, C.A.";"";"Tel: (58) (212) 4825626";"Esq. Piedras, Santa Teresa Caracas, Venezuela";"Profesionales En Vigilancia Y Seguridad"
"INVERTEC, C.A.";"";"Telefax: (58) (286) 9233006";"Via Caracas Ciudad Guayana Puerto Ordaz, Venezuela";"Profesionales En Vigilancia Y Seguridad"
"SEGURIDAD CÓDIGO UNO, C.A.";"";"Tel: (58) (281) 2811605";"Av. Principal de Lechería, C.C. Coconut Center, Piso 1, Local 14-A Lecherías, Venezuela";"Profesionales En Vigilancia Y Seguridad"
"GEDINCA";"";"Tel: (58) (261) 7367585";"San Pedro Calle 9 Maracaibo, Venezuela";"Profesionales En Vigilancia Y Seguridad"
"WORLDNET SOLUTIONS C.A.";"";"Tel: (58) (212) 7515818";"Bello Monte Caracas, Venezuela";"Profesionales En Vigilancia Y Seguridad"
"SERVITEIN,R.L";"";"Tel: (58) (286) 8602255";"VILLA BRASIL SENDA MANOS CASA 01 VEREDA 157 Ciudad Guayana Puerto Ordaz, Venezuela";"Profesionales En Vigilancia Y Seguridad"
"CARONI SEALS, C.A.";"";"Tel: (58) (286) 9530136";"Calle Neveri - Unare II C.C. San Miguel 1 Local 4, Pto Ordaz Ciudad Guayana Puerto Ordaz, Venezuela";"Profesionales En Vigilancia Y Seguridad"
"VIGILANCIA Y PROTECCIÓN MOR-MAR, C.A.";"";"Tel: (58) (285) 6316423";"Cl. Ppal, Vista Hermosa II Ciudad Bolivar, Venezuela";"Profesionales En Vigilancia Y Seguridad"
"CORINPROINCA";"";"Tel: (58) (212) 3811004";"Guarenas Guarenas, Venezuela";"Profesionales En Vigilancia Y Seguridad"
"SERENOS HERDANDEZ, C.A.";"";"Tel: (58) (276) 3554647";"Carrera 23, Pasaje Acueducto Barrio Obrero San Cristóbal, Venezuela";"Profesionales En Vigilancia Y Seguridad"
"EVER GOLD SECURITY SERVICES VENEZUELA";"";"Tel: (58) (212) 5761616";"Caracas Caracas, Venezuela";"Profesionales En Vigilancia Y Seguridad"
"ITALIAN SECURITY CA";"";"Tel: (58) (241) 8255364";"Av. Bolivar, Las Acacias Valencia, Venezuela";"Profesionales En Vigilancia Y Seguridad"
"VIGIBANCA";"";"Tel: (58) (291) 6416752";"Sede Oriente Maturín, Venezuela";"Profesionales En Vigilancia Y Seguridad"
"VOMISRA, C.A.";"";"Tel: (58) (212) 7634730";"Sabana Grande - Caracas Caracas, Venezuela";"Profesionales En Vigilancia Y Seguridad"
"MONTO SEGURIDAD, C.A.";"";"Tel: (58) (212) 3729866";"C.C. La Colina, Nivel C-4, Ofic.02 Sector Las Minas, San Antonio de Altos Caracas, Venezuela";"Profesionales En Vigilancia Y Seguridad"
"VIGILANCIA Y PROTECCIÓN PROFESIONAL, C.A.";"";"Tel: (58) (283) 2313533";"9na Cll sur, El Tigre El Tigre, Venezuela";"Profesionales En Vigilancia Y Seguridad"
"GRUPO PROFESIONAL DE SEGURIDAD 2020, C.A.";"";"Telefax: (58) (212) 5773245";"Parque Central, Edif.Catuche, Nivel Oficina 2 Ofic.219, Caracas Caracas, Venezuela";"Profesionales En Vigilancia Y Seguridad"
"ORGANIZACIÓN DE SEGURIDAD INVICTA, C.A.";"";"Tel: (58) (241) 8326884";"Av Henry ford, C.C.Paseo Las Industrias, Mezzanina, Local M-23 y 24 Valencia, Venezuela";"Profesionales En Vigilancia Y Seguridad"
"PROTECCION PRIVADA, C.A. PROPRICA";"";"Tel: (58) (261) 7437162";"No. 51-73 Avenida 2 D, Milagro Norte Maracaibo, Venezuela";"Profesionales En Vigilancia Y Seguridad"
"SERSECO PROTECCIÓN, C.A.";"";"Tel: (58) (212) 9777085";"Av. Río Caura, Prados Del Este Caracas, Venezuela";"Profesionales En Vigilancia Y Seguridad"
"SEROCCA";"";"Tel: (58) (261) 7983361";"Av. 11 con Calle 69a Nro.69a-40, Tierra Negra Maracaibo, Venezuela";"Profesionales En Vigilancia Y Seguridad"
"SEGURIDAD INTEGRAL TAURUS 659, C.A.";"";"Tel: (58) (261) 7864094";"sc. Andres E. Blanco, Av. 55 Con Calle 98 Corredor Vial universidad Ceci lio Acosta Maracaibo, Venezuela";"Profesionales En Vigilancia Y Seguridad"
"GUARDIANES DE ORIENTE, C.A.";"";"Tel: (58) (293) 4334265";"Cl Chacopata, Sector A-1 Cumaná, Venezuela";"Profesionales En Vigilancia Y Seguridad"
"MGH PROTECCIÓN INTEGRAL, C.A.";"";"Tel: (58) (212) 6934371";"Cl. Vargas, Los Chaguaramos Caracas, Venezuela";"Profesionales En Vigilancia Y Seguridad"
"PLODECA";"";"Tel: (58) (241) 8534697";"Calle Plaza o 106-90 Apdo. de Correos No 1536 Valencia Valencia, Venezuela";"Profesionales En Vigilancia Y Seguridad"
"SERVICIO Y VIGILANCIA Y PROTECCION PRIVADA";"";"Tel: (58) (261) 7830201";"Calle 73 Con Av. 18 no. 18-16 Sector Paraiso Maracaibo, Venezuela";"Profesionales En Vigilancia Y Seguridad"
"CORPORACIÓN PROTEGE'96 C.A.";"";"Tel: (58) (212) 5644048";"Esq.Tracabordo a Pte. Yanes, Edif.Dillón Piso 3, Ofic.3B, La Candelaria Caracas, Venezuela";"Profesionales En Vigilancia Y Seguridad"
"CEPROALARM";"";"Tel: (58) (251) 2549563";"Barquisimeto Av. Los Leones, C.E. Barquisimeto,Piso 5, Ofic 5-6 y 5-7 Barquisimeto, Venezuela";"Profesionales En Vigilancia Y Seguridad"
"J.A.G. SEGURIDAD Y PROTECCIÓN, C.A.";"";"Tel: (58) (212) 5432343";"Esq. Cruz Verde, El Silencio, Cruz Verde A Velásquez Caracas, Venezuela";"Profesionales En Vigilancia Y Seguridad"
"VIGILANTES UNIÓN - VIGILUNIÓN, C.A.";"";"Tel: (58) (212) 6625415";"Cl. Reinaldo Hahn Qta., Vigilunión, Santa Mónica Caracas, Venezuela";"Profesionales En Vigilancia Y Seguridad"
"SEGURIDAD INTEGRAL P.G, CA";"";"Tel: (58) (285) 65900166";"S/N Republica, Via Puente Angostura, Sector Plaza de Las Banderas, Local Ciudad Bolivar, Venezuela";"Profesionales En Vigilancia Y Seguridad"
"BILLY'S SECURITY, C.A.";"";"Tel: (58) (241) 8246751";"106 El Biñedo Valencia, Venezuela";"Profesionales En Vigilancia Y Seguridad"
"GRUPO DE VIGILANCIA Y PROTECCIÓN H.C.M., C.A.";"";"Tel: (58) (212) 2413609";"Calle 10, Edif. San Gabriel, Piso 3, La Urbina, Caracas Caracas, Venezuela";"Profesionales En Vigilancia Y Seguridad"
"COMPROTECCIÓN";"";"Tel: (58) (212) 8319967";"Caracas Caracas, Venezuela";"Profesionales En Vigilancia Y Seguridad"
"SERENOS LOS CEDROS, C.A.";"";"Tel: (58) (251) 2324626";"Cr. 17 E/Cl 33 y 34 Barquisimeto, Venezuela";"Profesionales En Vigilancia Y Seguridad"
"SERVICIOS DE SEGURIDAD INTEGRAL 2013, CA";"";"Tel: (58) (212) 5141814";"Av. Veracruz, Edif. Keope, Piso 1, Ofic.15-A, Las Mercedes Caracas, Venezuela";"Profesionales En Vigilancia Y Seguridad"
"SERENOS LASSER 2020, C.A.";"";"Tel: (58) (212) 4434193";"Reducto A Municipal, Edif. Saverio Russo, P.B., Local 3 El Silencio Caracas, Venezuela";"Profesionales En Vigilancia Y Seguridad"
"VIPROVENCA";"";"Tel: (58) (212) 5767686";"Av.Este 2 Edif. Adm. Unión Piso 4 Ofic. 4-B Los Caobos Caracas, Venezuela";"Profesionales En Vigilancia Y Seguridad"
"INTERNATIONAL SEGURITY SYSTEM 98, C.A.";"";"Tel: (58) (212) 7942223";"MaripÉrez - Caracas Caracas, Venezuela";"Profesionales En Vigilancia Y Seguridad"
"INVERSIONES FERRECOLIN, C.A.";"";"Tel: (58) (212) 7518406";"Av. Beethoven Cnas De Bello Monte Caracas, Venezuela";"Profesionales En Vigilancia Y Seguridad"
"BASECA";"";"Tel: (58) (235) 4313701";"Guarico Chaguaramas, Venezuela";"Profesionales En Vigilancia Y Seguridad"
"LINO CUICAS INVESTIGADOR";"";"Tel: (58) (251) 2320525";"Carrera 18, E/Cls 24y25 Barquisimeto, Venezuela";"Profesionales En Vigilancia Y Seguridad"
"VILLABLAS";"";"Tel: (58) (261) 7921143";"Edif. Res. Del Lago Av. 3C No. 67-40 Local 2-2 Maracaibo, Venezuela";"Profesionales En Vigilancia Y Seguridad"
"NIVALDO ASOCIADOS C.A.";"";"Tel: (58) (212) 7624211";"Av Libertador CC El Bosque L 2 Caracas, Venezuela";"Profesionales En Vigilancia Y Seguridad"
"SEGUVINCA, C.A.";"";"Tel: (58) (244) 4479951";"Urb Sabana Largo con Santiago de León, No.11.13, Cagua, Edo. Aragua Cagua, Venezuela";"Profesionales En Vigilancia Y Seguridad"
"CELTIC SECURITY, C.A.";"";"Telefax: (58) (212) 5418923";"Caracas Caracas, Venezuela";"Profesionales En Vigilancia Y Seguridad"
"SERENOS LA PROTECCIÓN, C.A.";"";"Tel: (58) (212) 9536487";"Av. E Retiro, El Rosal Caracas, Venezuela";"Profesionales En Vigilancia Y Seguridad"
"SERENOS ASOCIADOS, C.A.";"";"Tel: (58) (276) 3553078";"Cl. 16 Barrio Obrero San Cristóbal, Venezuela";"Profesionales En Vigilancia Y Seguridad"
"AIPPECA INVESTIGACIONES";"";"Tel: (58) (212) 5612338";"Esq San Jacinto A Doctor Paul, Catedral Caracas, Venezuela";"Profesionales En Vigilancia Y Seguridad"
"VIGILANTES INDUSTRIALES, S.A.";"";"Tel: (58) (241) 8474441";"Calle 72 No.99-79, Entre Avs Las Ferias y Urdaneta, Valencia, Edo. Carabo Valencia, Venezuela";"Profesionales En Vigilancia Y Seguridad"
"SEGURIDAD 99 C.A.";"";"Telefax: (58) (212) 5635531";"Caracas Caracas, Venezuela";"Profesionales En Vigilancia Y Seguridad"
"ORGANIZACIÓN TÉCNICA DE SEGURIDAD OTS, C.A.";"";"Tel: (58) (212) 4511975";"Caracas Caracas, Venezuela";"Profesionales En Vigilancia Y Seguridad"
"SISTEMAS OPERATIVOS, S.A.";"";"Telefax: (58) (281) 2760882";"Av. Intercomunal a 100 mts de la Pasarela de Boyacá-Barcelona Barcelona, Venezuela";"Profesionales En Vigilancia Y Seguridad"
"CORPORACIÓN VENEZOLANA DE PROTECCIÓN C.A.";"";"Tel: (58) (212) 3445937";"Av. Bermúdez, Edif. Centro Empresarial Primer Piso, Ofic.1-5, Guatire Guatire, Venezuela";"Profesionales En Vigilancia Y Seguridad"
"SERENOS PREVENTIVOS 28 DE JUNIO, C.A.";"";"Tel: (58) (281) 2867494";"Av. Intercomunal, Colinas del Neverí Barcelona, Venezuela";"Profesionales En Vigilancia Y Seguridad"
"SEGURIDAD MORALES, C.A.";"";"Tel: (58) (243) 2469222";"Calle Varela, San Miguel Maracay, Venezuela";"Profesionales En Vigilancia Y Seguridad"
"LA CASA DEL VITRAL INV. S.A.";"";"Tel: (58) (241) 8212796";"Santa Cecilia Valencia, Venezuela";"Profesionales En Vigilancia Y Seguridad"
"GUTIÉRREZ PROTECCIÓN Y SEGURIDAD C.A. GUPROSE";"";"Tel: (58) (212) 2310772";"Trujillo Caracas, Venezuela";"Profesionales En Vigilancia Y Seguridad"
"CA CORPORACIÓN CÁRDENAS, C.A.";"";"Telefax: (58) (212) 9933876";"Edif. Corporación Cárdenas, Cl. Caroní Entre Calles Madrid y París, Las M ercedes, Caracas Caracas, Venezuela";"Protectores De Cheques"
"APR ELECTRONIC C.A.";"";"Tel: (58) (212) 6901879";"Cl. El Convento, Edif. El Roble, Piso 1 Local 6, Urb.Valle Abajo Caracas, Venezuela";"Protectores De Cheques"
"PROMOCIONES EL PARQUE C.A";"";"Tel: (58) (212) 9597105";"Chuao Caracas, Venezuela";"Proveedores De Materias Primas"
"MADERAS Y LÁMINAS 2100 C.A";"";"Tel: (58) (212) 9528305";"Chacaito Caracas, Venezuela";"Proveedores De Materias Primas"
"PLATANERA LOS CASTAÑOS";"";"Tel: (58) (212) 6724269";"Bajando Hotel Colonial, Galpón 3b Sta. Cruz de Figueroa Caracas, Venezuela";"Proveedores De Materias Primas"
"CORPORACIÓN NAMARO C.A";"";"Tel: (58) (212) 7307120";"La Campiña Caracas, Venezuela";"Proveedores De Materias Primas"
"PLATANERÍA EL CRISTO";"";"Tel: (58) (212) 8721074";"Cl. El Cristo, Caracas Caracas, Venezuela";"Proveedores De Materias Primas"
"ELECTRO 2000 GUARARÉ,C.A.";"";"Tel: (58) (251) 2531910";"Callejón Don Pepe, Av.Vargas La Pastora Barquisimeto, Venezuela";"Proveedores De Materias Primas"
"CÁMARA DE ECONOMIA VENEZOLANA ISRAELÍ";"";"Tel: (58) (212) 7312530";"El Bosque Caracas, Venezuela";"Proveedores De Materias Primas"
"DISTRIBUIDORA DON PANCHO";"";"Tel: (58) (276) 3563837";"Zona Ind Paramillo San Cristóbal, Venezuela";"Proveedores De Materias Primas"
"INTERCONTINENTAL BUSINESS TRADE C.A";"";"Tel: (58) (212) 9597458";"Chuao Caracas, Venezuela";"Proveedores De Materias Primas"
"CÁMARA DE COMERCIO INDUSTRIA Y AGRICULTURA VENEZOLANA FRANCE";"";"Tel: (58) (212) 9931614";"Las Mercedes Caracas, Venezuela";"Proveedores De Materias Primas"
"INPROCOIN C.A";"";"Tel: (58) (212) 9527897";"El Rosal Caracas, Venezuela";"Proveedores De Materias Primas"
"DISINCA";"";"Tel: (58) (276) 3414968";"Av. Principal, Galpón 14-63 Barrancas San Cristóbal, Venezuela";"Proveedores De Materias Primas"
"AGRODUCTOS 2000 C.A.";"";"Tel: (58) (244) 2451669";"Carretera la Victoria La Victoria, Venezuela";"Proveedores De Materias Primas"
"DISTRIBUIDORA VICTORIA CHOY, C.A.";"";"Tel: (58) (265) 6315266";"Calle Vargas Ciudad Ojeda, Venezuela";"Proveedores De Materias Primas"
"D.I.S.A.R.";"";"Tel: (58) (271) 2255651";"Av. Ppal. La Floresta, La Floresta Valera, Venezuela";"Proveedores De Materias Primas"
